Text,link,year,aspect,sentiment,prob
maçon à Donzère mais aussi grand amateur de courses hippiques avait cru utile et rémunérateur d éditer avec le concours de son frère imprimeur à Pierrelate un journal hebdomadaire spécialisé dans l établissement de pronostics fondés sur ses connaissances de la valeur des chevaux engagés dans les courses dites de tiercé,https://www.lemonde.fr/archives/article/1967/01/05/l-editeur-d-un-journal-de-pronostics-hippiques-est-condamne-a-100-francs-d-amende_2610887_1819218.html,1967.0,frère,Positive,0.6075820922851562
45 le leader algérien accompagné de sa femme et de son beau frère sortait de son domicile madrilène rue Saint François de Sales situé à l entrée du quartier résidentiel qui mène à la cité universitaire,https://www.lemonde.fr/archives/article/1967/01/05/les-deux-meurtriers-attendaient-le-leader-algerien-devant-son-domicile-a-madrid_3110971_1819218.html,1967.0,frère,Positive,0.9971253275871277
Sa femme et son beau frère transportèrent la victime dans un taxi à la clinique de la Conception distante de quelque 700 mètres du lieu de l attentat,https://www.lemonde.fr/archives/article/1967/01/05/les-deux-meurtriers-attendaient-le-leader-algerien-devant-son-domicile-a-madrid_3110971_1819218.html,1967.0,frère,Positive,0.8559122085571289
Augert dont le frère Jean Pierre est déjà membre de l équipe de France tirerait le plus grand profit d un contact avec des champions confirmés avant une sélection possible pour les Jeux olympiques de Grenoble en 1968,https://www.lemonde.fr/archives/article/1967/01/07/la-sixieme-coupe-juniors-de-ski-alpin-sans-les-francais_2610067_1819218.html,1967.0,frère,Positive,0.7029935121536255
Le treize de France aura la formation suivante Arrière Pierre Lacaze frère de Claude Lacaze arrière de l équipe de France à quinze,https://www.lemonde.fr/archives/article/1967/01/11/a-trente-ans-le-toulousain-dubie-fait-ses-debuts-en-equipe-de-france_2609040_1819218.html,1967.0,frère,Neutral,0.9388619065284729
A la suite de l annonce dans le Monde du 8 9 janvier de la mort mystérieuse d un membre de l opposition haïtienne Mme Marie Thérèse Beauvoir son frère M,https://www.lemonde.fr/archives/article/1967/01/14/plusieurs-officiers-haitiens-se-refugient-dans-des-ambassades-a-port-au-prince_2609093_1819218.html,1967.0,frère,Neutral,0.6973357796669006
Son initiative fait suite au jugement rendu le 11 janvier par un tribunal de Karlskoga dans le centre de la Suède qui a permis à un frère et à une sœur respectivement âgés de trente quatre et vingt cinq ans de continuer à vivre maritalement,https://www.lemonde.fr/archives/article/1967/01/14/un-mariage-entre-un-frere-et-une-s-ur-legalise-en-suede_2608763_1819218.html,1967.0,frère,Neutral,0.7596768140792847
Une tête brune sculptée dans le marbre un sourire de bouddha tourné vers l intérieur les yeux mi clos Ali Akhbar Khan semble porter sur ses larges épaules la longue tradition dont il est l héritier fils du maître de la musique indienne moderne Allaudin Khan âgé aujourd hui de quatre vingt dix sept ans lui même élève de Wazir Khan dernier descendant du fameux Tansen musicien de la cour de l empereur mogol Akhbar au 16e siècle dont il est dit qu il n a pas existé dans l Inde depuis plus de mille ans un musicien qui fut son égal Ali Akhbar Khan comme son beau frère Ravi Shankar incarne ce qu il y a de plus impressionnant dans la musique indienne le lyrisme d une civilisation qui meurt et qui renaît chaque jour,https://www.lemonde.fr/archives/article/1967/01/18/ali-akhbar-khan_2610269_1819218.html,1967.0,frère,Positive,0.9965676069259644
Après avoir affirmé que sa mission avait exclusivement un but charitable et visait à étudier sur place l aide à apporter aux populations touchées par la guerre le prélat parlant de son entrevue avec le président Ho Chi Minh a rapporté que ce dernier lui a dit Je sais que le pape est tellement humain qu il aime son ennemi comme un frère,https://www.lemonde.fr/archives/article/1967/01/19/mgr-hussler-le-president-ho-chi-minh-deplore-l-indiscipline-au-sein-de-l-eglise-catholique_2608581_1819218.html,1967.0,frère,Neutral,0.6390644311904907
Le frère du président assassiné est attendu jeudi à Londres,https://www.lemonde.fr/archives/article/1967/01/26/le-senateur-robert-kennedy-sera-recu-mardi-par-le-general-de-gaulle_2608514_1819218.html,1967.0,frère,Negative,0.9926559925079346
Pierre Messmer a rappelé que l article 17 de la loi du 9 juillet 1965 sur le service national avait prévu des dispenses pour les jeunes gens dont le père la mère un frère ou une sœur sont morts pour la France ou en service commandé,https://www.lemonde.fr/archives/article/1967/01/26/m-louis-joxe-propose-au-gouvernement-deux-series-de-mesures-pour-le-reclassement-des-cadres-sans-emploi_2609449_1819218.html,1967.0,frère,Neutral,0.7306931018829346
Rendant visite l été dernier à un frère et une sœur M,https://www.lemonde.fr/archives/article/1967/01/30/inquietude-a-jerusalem-au-sujet-des-relations-sovieto-israeliennes_2608860_1819218.html,1967.0,frère,Neutral,0.967254638671875
Annie Famose nous a annoncé que son jeune frère de quinze ans s était classé troisième du championnat des Pyrénées toutes catégories,https://www.lemonde.fr/archives/article/1967/01/31/perillat-profite-d-un-accrochage-de-killy-et-enleve-le-slalom-de-megeve_2608459_1819218.html,1967.0,frère,Negative,0.6198469400405884
Le frère du président Kennedy avait auparavant déclaré Ce fut une conversation très intéressante et pour moi pleine d information,https://www.lemonde.fr/archives/article/1967/02/02/m-robert-kennedy-la-france-et-le-general-de-gaulle-vont-jouer-un-role-important-dans-tout-effort-en-faveur-d-une-solution-pacifique_2621017_1819218.html,1967.0,frère,Neutral,0.9575274586677551
Son frère Jean François est conseiller général de La Canourgue dans l arrondissement de Mende et les bienfaits de sa grand mère la défunte marquise comme on dit à Marvejols sont encore célébrés dans toute la région,https://www.lemonde.fr/archives/article/1967/02/08/a-marvejols-m-charles-de-chambrun-mise-sur-un-nom-celebre-et-sur-l-avenir-medico-social-de-la-lozere_2622649_1819218.html,1967.0,frère,Positive,0.8447282910346985
Robert Mitterrand frère du président national de la Fédération,https://www.lemonde.fr/archives/article/1967/02/08/i-dans-le-limousin-les-jeunes-loups-de-l-u-n-r-font-face-a-une-gauche-divisee_2622081_1819218.html,1967.0,frère,Neutral,0.6995003819465637
de moins de dix huit ans une indemnité mensuelle de logement de 100 F une allocation de 10 F par enfant à charge une prime d indemnité au delà de trente ans de service égale à 19 du barème ressource garanti correspondant la majoration de 60 à 75 de l indemnité différentielle en cas de remplacement d un collaborateur d un échelon supérieur à partir du quatrième mois l attribution d une journée payée en cas de décès d un frère ou d une sœur et enfin le versement de l allocation de départ à la retraite en cas d invalidité inférieure à 60,https://www.lemonde.fr/archives/article/1967/02/08/les-baremes-garantis-des-employes-et-techniciens-sont-augmentes-de-4-35_2622076_1819218.html,1967.0,frère,Negative,0.9318745732307434
Surprenante la façon dont les Australiens notamment les avants ont dominé les nôtres surprenante l extrême discrétion de nos attaquants blâmables et décevants tous les coups et irrégularités qui ont altéré le match et en ont brisé le rythme étonnante enfin l extraordinaire précision de Guy Camberabero qui en réussissant 17 points de coups de pied ajoutés à l essai marqué par son frère a singulièrement provoqué la défaite d une équipe australienne supérieure dans tous les domaines du jeu sauf dans celui des tirs au but 20 14,https://www.lemonde.fr/archives/article/1967/02/14/les-coups-de-pied-de-guy-camberabero-ont-sauve-les-avants-du-xv-de-france_2620813_1819218.html,1967.0,frère,Negative,0.7343541383743286
Affirmer que Guy Camberabero associé à son frère a triomphé de l Australie serait un peu sommaire,https://www.lemonde.fr/archives/article/1967/02/14/les-coups-de-pied-de-guy-camberabero-ont-sauve-les-avants-du-xv-de-france_2620813_1819218.html,1967.0,frère,Neutral,0.45542362332344055
La seule attaque Les gestes des Français n avaient pas la même vivacité et lorsque Lilian Camberabero servi par un pack dominé adressait une longue passe à son frère Guy la rapide montée des défenseurs adverses trois quarts et troisièmes lignes réduisait considérablement les possibilités de manœuvre de nos attaquants,https://www.lemonde.fr/archives/article/1967/02/14/les-coups-de-pied-de-guy-camberabero-ont-sauve-les-avants-du-xv-de-france_2620813_1819218.html,1967.0,frère,Negative,0.8123822808265686
On apprend d autre part que l ex roi Saoud va acheter près du Caire un palais appartenant à son frère et ennemi le roi Fayçal,https://www.lemonde.fr/archives/article/1967/02/15/la-jordanie-serait-sur-le-point-de-rompre-les-relations-diplomatiques-avec-le-regime-republicain-du-yemen_2622679_1819218.html,1967.0,frère,Positive,0.5033150315284729
Jamais nous n abandonnerons un Etat frère en lutte,https://www.lemonde.fr/archives/article/1967/02/15/moscou-les-americains-meprisent-l-opinion-mondiale_2620358_1819218.html,1967.0,frère,Positive,0.8809643983840942
Les trois témoins Gold déjà condamné pour espionnage Greenglan frère de Mme Rosenberg inculpé d espionnage et Elitcher manipulé par le F,https://www.lemonde.fr/archives/article/1967/02/18/morton-sobell-condamne-en-1951-avec-les-rosenberg-n-obtient-pas-la-reouverture-de-son-proces_2622579_1819218.html,1967.0,frère,Negative,0.7846773266792297
Plusieurs autres arrestations de caractère politique auraient également eu lieu dont celle du jeune frère de l ancien secrétaire d État,https://www.lemonde.fr/archives/article/1967/02/20/un-ancien-ministre-arrete-au-tchad_2620461_1819218.html,1967.0,frère,Negative,0.9549547433853149
Si en effet ce timbre porte en anglais quelques mots d un célèbre poème tamoul Tout pays est mon pays tout homme est mon frère les autorités de New Delhi ont quelque peu manqué de tact en maintenant sur la vignette une légende en hindi,https://www.lemonde.fr/archives/article/1968/01/05/les-tamouls-tiennent-leur-congres-mondial-a-madras-et-les-partisans-de-l-hindi-chahutent-a-benares_2512148_1819218.html,1968.0,frère,Positive,0.743827223777771
Celui ci prétendit être le frère de M,https://www.lemonde.fr/archives/article/1968/01/08/deux-banques-condamnees-pour-avoir-neglige-d-avertir-la-police-a-l-occasion-d-une-fraude_2513428_1819218.html,1968.0,frère,Negative,0.9764268398284912
Le 4 novembre alors que je l attendais pour dîner j appris à 3 heures du matin qu il était parti chez son beau frère qui commandait une unité blindée stationnée à Lodi près de Médéa laissant dire qu il s y était réfugié parce qu il craignait de se faire arrêter,https://www.lemonde.fr/archives/article/1968/01/08/je-ne-pensais-pas-que-zbiri-marcherait-sur-la-capitale-declare-le-chef-du-gouvernement_2513119_1819218.html,1968.0,frère,Positive,0.908663809299469
Armand Jean du Plessis dont on connaît la fragile complexion physique aurait été en équilibre instable sur le plan mental son frère se prenait pour Dieu sa sœur se croyait en cristal et lui même par moments s identifiait à un cheval,https://www.lemonde.fr/archives/article/1968/01/10/le-richelieu-de-philippe-erlanger_2513411_1819218.html,1968.0,frère,Negative,0.9622614979743958
Dans cette famille dont les membres restèrent tendrement attachés la mère très cultivée encourageait plus ou moins directement les penchants littéraires de Marcel que le père ne comprenait ni n approuvait mais les parents souffraient des prodigalités fastueuses de leur fils et de son refus de se choisir une carrière tandis qu entre l écrivain et son frère Robert voué aux études de médecine existait une amitié profonde,https://www.lemonde.fr/archives/article/1968/01/10/un-fils-de-famille_2511548_1819218.html,1968.0,frère,Neutral,0.580504834651947
L église Saint Pierre et Paul qu il a construite avec un clocher en dalles de verre et décoré d une mosaïque de son frère Jean Lurçat ainsi que d une curieuse sculpture en médaillon est du style monumental,https://www.lemonde.fr/archives/article/1968/01/12/la-rectitude-d-andre-lurcat_2512506_1819218.html,1968.0,frère,Positive,0.6826688051223755
Il est important toutefois de noter dès 1879 il a dix neuf ans ses goûts littéraires exprimés dans les conseils de lecture qu il donne à son frère cadet Michel Don Quichotte Shakespeare Gontcharov,https://www.lemonde.fr/archives/article/1968/01/17/la-correspondance-de-tchekhov_2512838_1819218.html,1968.0,frère,Neutral,0.5841384530067444
Brundage m avait accordé un assez long entretien Comme on lui fit remarquer deux Jours plus tard que J étais le frère d un sportif professionnel il me demanda Votre frère était il réellement un champion Je crois pouvoir l affirmer,https://www.lemonde.fr/archives/article/1968/01/18/i-le-dernier-des-amateurs-karim-aga-khan_2512646_1819218.html,1968.0,"frère', 'frère","Neutral', 'Neutral","0.7653067111968994, 0.7653067111968994"
Alors Jeune homme Je suis rassuré votre frère était forcément un amateur,https://www.lemonde.fr/archives/article/1968/01/18/i-le-dernier-des-amateurs-karim-aga-khan_2512646_1819218.html,1968.0,frère,Negative,0.8060499429702759
Léon Pomathios administrateur au Val de Saône et frère de l ancien rugbyman Michel Pomathios ainsi que le professeur Keilling,https://www.lemonde.fr/archives/article/1968/01/18/les-dirigeants-de-la-societe-laitiere-du-val-de-saone-repondent-d-une-banqueroute-et-d-un-deficit-de-7-millions_2510860_1819218.html,1968.0,frère,Positive,0.6946315765380859
Michel Debatisse exploite 90 hectares dans cette commune en association avec deux autres familles dont celle de son frère,https://www.lemonde.fr/archives/article/1968/01/19/m-michel-debatisse-est-elu-secretaire-general-de-la-f-n-s-e-a_2510918_1819218.html,1968.0,frère,Neutral,0.9069762825965881
Il exploite maintenant 90 hectares à Palladuc dans le Puy de Dôme en association avec deux autres familles dont celle de son frère s attachant par là à prouver que l on peut vivre de l agriculture même à 750 mètres d altitude et au milieu des bois pour peu que l on s adapte,https://www.lemonde.fr/archives/article/1968/01/20/portrait-michel-debatisse-le-revolutionnaire-silencieux_3067624_1819218.html,1968.0,frère,Neutral,0.9409062266349792
Ce n était pas le cas de celles qui l imitèrent en foule en premier lieu de Madeleine de Scudéry dont le lit à baldaquin et le reste du mobilier sont fidèlement reconstitués et qui formait avec son frère Georges un redoutable tandem littéraire,https://www.lemonde.fr/archives/article/1968/01/22/precieuses-et-salons-litteraires-au-xviie-siecle_2510997_1819218.html,1968.0,frère,Neutral,0.6189525723457336
tandis que son frère critique les dirigeants de Saigon Interviewé à l émission télévisée Face the nation M,https://www.lemonde.fr/archives/article/1968/01/30/m-robert-kennedy-expose-un-plan-de-paix_2511664_1819218.html,1968.0,frère,Neutral,0.7729939818382263
Le frère du sénateur de New York qui rentre d une tournée d inspection au Vietnam du Sud a notamment affirmé qu il considérait comme inutile de sacrifier dix mille Américains par an pour porter le fardeau de la guerre alors que le gouvernement de Saigon se refuse à tout effort supplémentaire,https://www.lemonde.fr/archives/article/1968/01/30/m-robert-kennedy-expose-un-plan-de-paix_2511664_1819218.html,1968.0,frère,Neutral,0.8759942650794983
L une des autres personnes jugées a parlé enfin du demi frère du président Nasser et de l ancien chef des forces égyptiennes du Sinaï le général Mortagui qui auraient pu servir d intermédiaires entre le président et le maréchal Amer pour expliquer au chef de l État que l armée voulait le retour de l ancien numéro deux du régime,https://www.lemonde.fr/archives/article/1968/01/31/le-marechal-amer-craignait-que-le-president-nasser-n-accepte-une-solution-politique-au-conflit-avec-israel_2511589_1819218.html,1968.0,frère,Neutral,0.9456837177276611
Johnson et le frère de son prédécesseur évincé du gouvernement et de la vice présidence sur les conseils de l homme qui vient d être appelé à remplacer M,https://www.lemonde.fr/archives/article/1968/02/01/l-opposition-republicaine-parait-incapable-de-tirer-parti-des-multiples-difficultes-qu-affronte-m-johnson_2480396_1819218.html,1968.0,frère,Negative,0.7555649280548096
Mais combien ses objections paraissent aujourd hui abstraites et conjecturales comparées au dossier écrasant que son frère Edward sénateur du Massachusetts vient de ramener d une enquête sur place au Vietnam,https://www.lemonde.fr/archives/article/1968/02/01/l-opposition-republicaine-parait-incapable-de-tirer-parti-des-multiples-difficultes-qu-affronte-m-johnson_2480396_1819218.html,1968.0,frère,Negative,0.47484713792800903
Comme quoi ils peuvent ne pas toujours bien interpréter les intentions d un autre pays frère,https://www.lemonde.fr/archives/article/1968/02/03/washington-accepte-la-proposition-de-pyongyang-de-traiter-l-affaire-du-pueblo-a-panmunjom_2480019_1819218.html,1968.0,frère,Negative,0.5292348265647888
Et en plaçant ainsi côte à côte le frère chrétien et la sœur païenne le critique a peut être éclairé celle ci d une lumière plus fascinante qu il ne voulait,https://www.lemonde.fr/archives/article/1968/02/07/trois-ecrivains-devant-dieu_2480463_1819218.html,1968.0,frère,Negative,0.5750588774681091
Raul Castro frère du premier ministre afin d obtenir de l armement lourd de fabrication britannique ainsi que des avions de combat,https://www.lemonde.fr/archives/article/1968/02/08/le-gouvernement-cubain-aurait-souhaite-acheter-du-materiel-militaire-en-grande-bretagne_2478236_1819218.html,1968.0,frère,Neutral,0.8282986879348755
En 1964 à l occasion d une grave maladie de son frère César qui avait été directeur du journal communiste Hoy Anibal Escalante reçut l autorisation de rentrer à Cuba,https://www.lemonde.fr/archives/article/1968/02/08/le-gouvernement-cubain-aurait-souhaite-acheter-du-materiel-militaire-en-grande-bretagne_2478236_1819218.html,1968.0,frère,Negative,0.9031133651733398
La première salle salle II comporte une sélection de ces peintures antérieures à la Révolution en bout de cimaise les deux portraits par Chandler 1747 1790 de son frère et de sa belle sœur où un vernis d élégance est plaqué sur un métier encore peu sûr sont postérieurs numéros 15 et 16,https://www.lemonde.fr/archives/article/1968/02/16/l-amerique-de-naguere-a-travers-ses-naifs_2478044_1819218.html,1968.0,frère,Neutral,0.9066499471664429
L accident s est produit alors que la jeune victime en compagnie de son frère tentait de creuser un tunnel,https://www.lemonde.fr/archives/article/1968/02/19/dans-une-carriere-non-cloturee-un-enfant-meurt-enseveli-sous-le-sable_2479826_1819218.html,1968.0,frère,Neutral,0.965390682220459
Au sein du groupe il y aurait Guido Peredo Leigue Bolivien frère de Roberto Peredo qui fut le chef en titre de la guérilla jusqu à sa mort près de Valle grande fin septembre dernier une semaine avant celle de Che Guevara David Adriazola surnommé Dario Bolivien Arturo Fernandez Martinez surnommé Pombo Cubain officier de l armée cubaine qui aurait été garde du corps de Guevara en Bolivie Urbano Tamayo Nunez Urbano secrétaire de Guevara pendant la conférence économique interaméricaine de Punta del Este en 1961 Benigno Soberon Perez Benigno capitaine de l armée cubaine,https://www.lemonde.fr/archives/article/1968/02/20/les-survivants-du-groupe-de-guerilla-commande-par-che-guevara-seraient-arrives-de-bolivie_2478157_1819218.html,1968.0,frère,Positive,0.6406078934669495
Mir Crampagne Dourthe qui a joué mercredi son premier match depuis sa blessure à l épaule ainsi que de joueurs cotés tels que Coudeyre Puig Andrieux Guitter et Herrero frère de l international,https://www.lemonde.fr/archives/article/1968/02/23/dourthe-dans-l-equipe-de-france-universitaire_2480451_1819218.html,1968.0,frère,Positive,0.6666840314865112
Le socialisme islamique du Pakistan ressemble en cela comme un frère au socialisme africain,https://www.lemonde.fr/archives/article/1968/02/24/iii-amities-et-aides-exterieures_2478953_1819218.html,1968.0,frère,Positive,0.6244575381278992
Ce sont encore une fois des anecdotes qui parlent d elles mêmes l écolière de quatorze ans que son frère aîné veut forcer à se voiler les frères jouent encore volontiers dans l Algérie d aujourd hui le rôle sourcilleux de gardiens des traditions et qui préfère ne plus aller en classe plutôt que d accepter cette contrainte l étudiant en psychologie qui épouse une jeune élève de seconde et l oblige à quitter le lycée le père de famille qui vient à la consultation de nourrissons avec son fils et,https://www.lemonde.fr/archives/article/1969/01/04/ii-les-ambiguites-algeriennes_2421285_1819218.html,1969.0,"frère', 'frère","Negative', 'Negative","0.856124997138977, 0.856124997138977"
Et toutes les couleurs se rassemblent autour du vêtement de fantôme de la sœur qui en réalité survivra au frère elle se suicidera trois ans après lui mais qui dans les poèmes est rejetée loin de lui comme un être qui ne serait déjà plus de ce monde,https://www.lemonde.fr/archives/article/1969/01/04/poemes-en-prose-de-georg-trakl_2422302_1819218.html,1969.0,frère,Negative,0.7975885272026062
Le chef major en était Lucien Divard trente et un ans originaire de Brest sergent de carrière à la base aérienne de Tours secondé par son frère Lionel Divard vingt cinq ans né à Brest dessinateur à Nantes qui avait la responsabilité du groupe nantais,https://www.lemonde.fr/archives/article/1969/01/06/un-sergent-de-la-base-aerienne-de-tours-aurait-ete-a-la-tete-du-groupe-incarcere_2421376_1819218.html,1969.0,frère,Positive,0.9660014510154724
Alexandre Markovitch qui s est constitué partie civile dans l information ouverte sur l assassinat de Stevan son frère a été entendu longuement par M,https://www.lemonde.fr/archives/article/1969/01/11/le-frere-de-stevan-markovitch-est-entendu-par-le-juge-d-instruction_2423422_1819218.html,1969.0,frère,Neutral,0.5479186773300171
Au cours de cette audition qui a duré plus de six heures le frère de la victime par le truchement d un interprète a évoqué la nombreuse correspondance qu il avait eue avec Stevan Markovitch dans laquelle celui ci portait des accusations,https://www.lemonde.fr/archives/article/1969/01/11/le-frere-de-stevan-markovitch-est-entendu-par-le-juge-d-instruction_2423422_1819218.html,1969.0,frère,Negative,0.9470421671867371
LE frère DE STEVAN MARKOVITCH EST ENTENDU PAR LE JUGE D INSTRUCTION Article réservé aux abonnés,https://www.lemonde.fr/archives/article/1969/01/11/le-frere-de-stevan-markovitch-est-entendu-par-le-juge-d-instruction_2423422_1819218.html,1969.0,frère,Negative,0.8735558390617371
Alexandre Markovitch qui s est constitué partie civile dans l information ouverte sur l assassinat de Stévan son frère a été mis vendredi après midi en présence de deux yougoslaves actuellement détenus à la prison de la Santé et qui avaient connu la victime Lioubomire Milochévitch et Victor Markovitch simple homonyme de Stévan Markovitch,https://www.lemonde.fr/archives/article/1969/01/13/quatorze-heures-d-auditions-chez-le-magistrat-instructeur_2422944_1819218.html,1969.0,frère,Negative,0.8355346322059631
Alexandre Markovitch il se confirme que le frère de la victime qui s est constitué partie civile a déclaré au magistrat instructeur qu il avait bien vu chez Stévan des photographies et une lettre de vingt quatre pages que Mme Nathalie Delon avait adressée à celui ci,https://www.lemonde.fr/archives/article/1969/01/15/auditions-a-paris-confrontation-a-belgrade_2421979_1819218.html,1969.0,frère,Neutral,0.7959938049316406
Sur ce dernier point le témoin affirme avoir tout remis au frère de la victime,https://www.lemonde.fr/archives/article/1969/01/15/auditions-a-paris-confrontation-a-belgrade_2421979_1819218.html,1969.0,frère,Negative,0.8505136966705322
Sachant que dans cet établissement on joignait à la tradition des bonnes et fortes études de l ancienne Université celle des habitudes et des sentiments religieux Napoléon lui confia en 1796 son frère cadet Jérôme qui y fit ses études,https://www.lemonde.fr/archives/article/1969/01/16/detruira-t-on-la-pension-savouret_2423252_1819218.html,1969.0,frère,Positive,0.9467471837997437
Ils avaient commencé par faire valoir que leur frère n était pas domicilié légalement en France et qu en conséquence il restait soumis à la loi syrienne qui interdit à un musulman de léguer ses biens à une non musulmane,https://www.lemonde.fr/archives/article/1969/01/17/bataille-civile-a-propos-du-testament-de-m-nachat-martini_2421775_1819218.html,1969.0,frère,Negative,0.9837017059326172
Nachat Martini leur frère était bien en possession d un titre de séjour régulier en France au moment où il rédigea son testament et que dès lors justiciable de la loi française ils ne pouvaient invoquer un droit d origine coutumière fondé sur des discriminations raciales ou religieuses que notre pays n admet pas les deux frères demandeurs abandonnèrent ce terrain de combat pour en choisir un autre qui pouvait paraître plus solide,https://www.lemonde.fr/archives/article/1969/01/17/bataille-civile-a-propos-du-testament-de-m-nachat-martini_2421775_1819218.html,1969.0,"frère', 'frère","Neutral', 'Neutral","0.5192322731018066, 0.5192322731018066"
