Text,link,year,aspect,sentiment,prob
Selon des informations dignes de foi il avait basculé dans l illégalité totale à la fin de 1982 à la suite de la mort d un de ses frères tué dans un accrochage avec les forces de sécurité après un vol d explosifs à Cap Djinet 70 km à l est d Alger,https://www.lemonde.fr/archives/article/1987/01/06/algerie-le-chef-de-l-activisme-integriste-a-ete-tue-au-cours-d-un-accrochage-avec-la-police_4020124_1819218.html,1987.0,frères,Negative,0.9957386255264282
Jusqu à sa mort en 1937 il restera aux yeux de ses frères de race qui se font un devoir de voir ses tableaux ou de lui rendre visite rue Saint Jacques la preuve même du mérite noir récompensé par une France cultivée et généreuse,https://www.lemonde.fr/archives/article/1987/01/10/harlem-rive-gauche-par-michel-fabre_4022241_1819218.html,1987.0,frères,Positive,0.587441086769104
Doubin dans l Orne ont ouvert une période de flottement dans les rangs des radicaux de gauche les uns ayant parlé de ralliement au PS les autres ayant lorgné sur leurs frères séparés de la place de Valois,https://www.lemonde.fr/archives/article/1987/01/11/le-congres-du-mrg-a-montpellier-m-doubin-veut-faire-oublier-les-derniers-resultats-electoraux-des-radicaux-de-gauche_4021613_1819218.html,1987.0,frères,Negative,0.9619863033294678
La volonté des FAP a t il conclu est de continuer sans relâche aux côtés des autres frères des Forces armées nationales tchadiennes FANT à bouter hors du Tchad l envahisseur libyen,https://www.lemonde.fr/archives/article/1987/01/13/le-conflit-du-tchad-raid-libyen-au-dessous-du-16e-parallele_4022271_1819218.html,1987.0,frères,Positive,0.6553341746330261
Fabio Testori peintre critique d art passionné et redoutable écrivain auteur de Rocco et ses frères a choisi le moment où tombe le rideau Hérodiade abandonnée inutile entreprend un long soliloque destiné aux ombres aux fantômes et où le public remplace la tête de Jean Baptiste,https://www.lemonde.fr/archives/article/1987/01/18/herodiade-et-la-tete-du-prophete_4024963_1819218.html,1987.0,frères,Neutral,0.9797345995903015
Une mystérieuse organisation Les partisans de Dieu a menacé mardi d entreprendre des actions terrotistes si deux de ses frères n étaient pas rapidement libérés,https://www.lemonde.fr/archives/article/1987/01/22/un-second-ressortissant-allemand-aurait-ete-enleve-a-beyrouth_4026910_1819218.html,1987.0,frères,Neutral,0.8226696848869324
L affaire de Paribas en 1981 et celle des frères Willot sont là entre autres pour le prouver,https://www.lemonde.fr/archives/article/1987/01/25/les-magistrats-parisiens-repondent-aux-attaques-visant-le-juge-michau-branle-bas-au-palais-de-justice_4028315_1819218.html,1987.0,frères,Positive,0.9121057391166687
Souvenons nous de leurs frères jumeaux sur lesquels des psychanalystes s étaient penchés naguère,https://www.lemonde.fr/archives/article/1987/01/29/le-robot-et-l-enfant_4029698_1819218.html,1987.0,frères,Negative,0.7691125273704529
Michel Pezet et Philippe Sanmarco les frères ennemis du courant mitterrandiste marseillais les Bouches du Rhône constitueront peut être _ c est peu probable _ la tête de pont de Socialisme et République pour la recomposition du PS que M,https://www.lemonde.fr/archives/article/1987/01/30/m-chevenement-dans-le-var-et-les-bouches-du-rhone-c-est-avec-des-civils-qu-on-fait-des-militaires_4019740_1819218.html,1987.0,frères,Negative,0.8824564218521118
L obligation dans laquelle se trouva le 8 décembre dernier la cour d assises ordinaire de Paris de renvoyer le procès de Régis Schleicher et des frères Claude et Nicolas Halfen en raison d une défection des jurés avait conduit le gouvernement à solliciter du Parlement une modification du texte pour qu il devienne applicable à des hommes accusés d avoir agi même antérieurement au 9 décembre 1986,https://www.lemonde.fr/archives/article/1987/01/30/renvoye-devant-la-cour-d-assises-de-paris-georges-ibrahim-abdallah-pourrait-etre-juge-dans-la-seconde-quinzaine-de-fevrier_4019784_1819218.html,1987.0,frères,Neutral,0.6809812188148499
Les trois frères Stasis étaient inventé une soeur Anna,https://www.lemonde.fr/archives/article/1987/02/01/en-champagne-ardenne-le-miracle-stasi_4020971_1819218.html,1987.0,frères,Neutral,0.39192554354667664
On y retrouve comme dans les suivants My Brother et My Executioner cette quête de justice sociale qui soustend toute l oeuvre de l auteur et anime le dialogue entre deux frères l intellectuel humaniste et le marxiste chef d une rébellion armée,https://www.lemonde.fr/archives/article/1987/02/06/tout-le-monde-l-appelle-frankie_4022479_1819218.html,1987.0,frères,Neutral,0.9488987922668457
Et GMF c est aussi deux vignobles dont le Château Beychevelle Achille Fould une maison de négoce de vins Barrière frères et des filiales étrangères d assurances GMF en RFA Civil Serpant Employees CSE Life et Safeguard Inc,https://www.lemonde.fr/archives/article/1987/02/07/la-mort-de-michel-baroin-le-ministre-de-l-influence_4023046_1819218.html,1987.0,frères,Neutral,0.9117006659507751
Walid Joumblatt a déclaré dimanche à Damas qu il allait expliquer aux Palestiniens _ en l occurrence les dissidents anti arafatistes mais qui s opposent toujours au secours de leurs frères ennemis arafatistes quand la guerre des camps est réactivée _ qu il ne leur servait à rien de pilonner la banlieue sud de Beyrouth,https://www.lemonde.fr/archives/article/1987/02/11/a-beyrouth-ouest-l-attentat-a-la-voiture-piegee-a-fait-15-morts-et-pres-de-80-blesses_4024418_1819218.html,1987.0,frères,Negative,0.8631903529167175
Reste enfin l inconnue que constituent les frères musulmans qui ne disposent pas d un parti légal,https://www.lemonde.fr/archives/article/1987/02/13/egypte-le-resultat-du-referendum-sur-la-dissolution-du-parlement-semble-acquis-d-avance_4025119_1819218.html,1987.0,frères,Neutral,0.8195716738700867
En effet si le nouveau guide suprême le cheikh Mohamed Aboul Nasr soutient les revendications de l opposition il ne s est pas encore prononcé en ce qui concerne une éventuelle alliance les frères musulmans pouvant toujours en dernier recours se présenter comme candidats indépendants et briguer les 48 sièges pourvus au scrutin nominal majoritaire,https://www.lemonde.fr/archives/article/1987/02/13/egypte-le-resultat-du-referendum-sur-la-dissolution-du-parlement-semble-acquis-d-avance_4025119_1819218.html,1987.0,frères,Neutral,0.9457151889801025
Comme toujours chez Mocky _ lequel donna au monde cinéphilique ébloui ne l oublions pas mes frères en 1964 la Cité de l indicible peur ce chef d oeuvre du fantastique bizarre avec déjà Jean Poiret Francis Blanche Bourvil Raymond Rouleau et Noël Roquevert ce qui suffira à son salut éternel _ le meilleur côtoie le moins bon avec une parfaite aisance une absence totale de complexes les idées saugrenues le goût de l excès de la poésie burlesque de la provocation grossière du calembour parviennent à élever la loufoquerie en un système explosif très singulier bien particulier de l art de Mocky,https://www.lemonde.fr/archives/article/1987/02/19/le-miracule-de-jean-pierre-mocky-dans-le-train-de-lourdes_4027825_1819218.html,1987.0,frères,Positive,0.9971644282341003
TFM en profite pour préciser que son capital serait pour moitié réservé aux professionnels de la musique et du cinéma et pour l autre moitié partagé entre un pool bancaire 25 et une société holding appartenant aux frères Defforey les dirigeants du groupe Carrefour 20,https://www.lemonde.fr/archives/article/1987/02/19/les-candidats-aux-televisions-privees-devant-la-cncl-les-sages-s-interrogent-sur-la-vocation-de-la-sixieme-chaine_4027804_1819218.html,1987.0,frères,Neutral,0.9575910568237305
Patrice Bigel est enfin metteur en scène dans la tradition des grands amoureux du travail bien fait aimant ses comédiens comme des frères au point de les réunir en une troupe cellule de base des entreprises artistiques ambitieuses,https://www.lemonde.fr/archives/article/1987/02/20/circuits-clandestins-aux-athevains-naissance-d-une-passion_4028450_1819218.html,1987.0,frères,Positive,0.9974464178085327
Jacqueline Esber que l on retrouvera était de ce commando avec deux frères de Georges Ibrahim Emile et Maurice et elle exposa non sans fierté au diplomate qu Abdallah au sein des FARL était un gros poisson,https://www.lemonde.fr/archives/article/1987/02/21/georges-ibrahim-abdallah-devant-les-assises-de-paris-la-genese-d-un-proces-a-haut-risque_4029145_1819218.html,1987.0,frères,Neutral,0.9466212391853333
En substance elle a constaté que celui ci n est pas le gérant de A Merenda que d autres destinataires recevaient ces tracts et que enfin un des frères de l inculpé a indiqué que M,https://www.lemonde.fr/archives/article/1987/02/21/la-decision-de-la-chambre-d-accusation-de-paris-des-charges-insuffisantes-contre-m-alain-orsoni_4029152_1819218.html,1987.0,frères,Negative,0.787502646446228
Avant guerre _ il y a tout un pan de sa carrière qu on connait mal _ il tourne deux bons films avec Robert Montgomery un polar d angoisse connu comme un classique Night Must Fall et une insolite comédie british The Earl of Chicago ensuite il y a un curieux film sur la Mafia où Gene Kelly tient un rôle sérieux la Main noire 1950 un polar de tribunal The Unknown Man avec Walter Pidgeon un western original sur l inventeur de la carabine Carbine Williams enfin un film produit par Pandro Berman sur la pêche à la baleine et l affrontement entre deux frères All the Brothers Were Valiant,https://www.lemonde.fr/archives/article/1987/02/22/richard-thorpe-homme-a-tout-faire-de-la-mgm_4020485_1819218.html,1987.0,frères,Neutral,0.9221117496490479
Chirac aime le piment de la force Puis Mmme Michaux Chevry s est adressée exclusivement à ses frères et soeurs Décolonisons nous perdons nos complexes,https://www.lemonde.fr/archives/article/1987/02/24/controverses-sur-l-outre-mer-c-est-le-president-de-la-republique-qui-met-le-feu-aux-poudres-affirme-mme-lucette-michaux-chevry_4029859_1819218.html,1987.0,frères,Neutral,0.5626901984214783
et j ajouterai les porte absence des six millions de nos frères dont le rêve a été brutalement étranglé,https://www.lemonde.fr/archives/article/1987/02/24/un-accord-entre-juifs-et-catholiques-le-carmel-d-auschwitz-sera-ferme-dans-deux-ans_4019789_1819218.html,1987.0,frères,Negative,0.7916978001594543
Onze mois entre ce jour maudit _ c était le lendemain du Kippour _ où poussé d un wagon plombé après voir été séparé de ses parents et de ses frères qui tous périront à Treblinka il respira pour la première fois l odeur de la mort et ce jour bénit le 2 août 1943 _ qu il accueillit comme le jour du Jugement _ où à la faveur de la révolte des détenus il parvint à s enfuir à travers bois et à quitter la Pologne après des semaines d errance misérable,https://www.lemonde.fr/archives/article/1987/02/25/israel-le-proces-de-john-demanjuk-c-est-bien-lui-ivan-de-treblinka_4019850_1819218.html,1987.0,frères,Positive,0.5994535684585571
L inventeur le Père Bartolomeu docteur en mathématiques à la célèbre université de Coimbra sera lui aussi obligé de mettre fin à ses expériences il aura pourtant fait voler sa passarola de passaro oiseau au dessus de Lisbonne le 5 août 1709 plus de soixante dix ans avant les frères Montgolfier,https://www.lemonde.fr/archives/article/1987/02/27/au-temps-de-joao-v-le-roi-soleil-du-portugal_4021303_1819218.html,1987.0,frères,Negative,0.6940003037452698
bref tout ce qui fait la badieh a résisté à l installation en ville est resté bien ancré sous les keffiehs rouges _ à ne pas confondre avec le voile de préférence blanc des Palestiniens ces frères qu on ne quitte pas mais c est du coin de l oeil,https://www.lemonde.fr/archives/article/1987/02/28/la-jordanie-patrie-bedouine-fideles-sujets-d-un-descendant-de-mahomet-les-bedouins-de-jordanie-ne-font-qu-honorer-leurs-plus-anciennes-coutumes-en-vivant-leur-islam-d-une-maniere-d_4022506_1819218.html,1987.0,frères,Positive,0.9253481030464172
Pâtisserie Jérusalem En plein centre au dessus de la pâtisserie Jérusalem un panonceau parmi d autres sur un balcon fatigué Association des frères musulmans,https://www.lemonde.fr/archives/article/1987/02/28/la-jordanie-patrie-bedouine-fideles-sujets-d-un-descendant-de-mahomet-les-bedouins-de-jordanie-ne-font-qu-honorer-leurs-plus-anciennes-coutumes-en-vivant-leur-islam-d-une-maniere-d_4022506_1819218.html,1987.0,frères,Neutral,0.8198063969612122
C est ainsi qu une fois libéré il devait reconnaitre sur photographies que se trouvaient parmi eux Maurice et Robert Abdallah deux frères de Georges ainsi qu une jeune femme qui correspondait au signalement de Jacqueline Esber sans qu il pût être absolument formel,https://www.lemonde.fr/archives/article/1987/02/28/le-proces-de-georges-ibrahim-abdallah-deux-rescapes-a-la-barre_4021279_1819218.html,1987.0,frères,Neutral,0.9800281524658203
Dans une lettre ouverte Mme Ben Youssef réclame la réhabilitation politique de son mari une révision de l histoire du mouvement national avec les corrections et les modifications qui s imposent et le rapatriement de la dépouille de Ben Youssef enterré au Caire après son assassinat en 1961 à Francfort avec tous les honneurs qui lui sont dus afin qu il repose aux côtés de ses frères martyrs,https://www.lemonde.fr/archives/article/1988/01/05/tunisie-la-veuve-de-salah-ben-youssef-recue-par-le-president-ben-ali_4076582_1819218.html,1988.0,frères,Positive,0.9466784000396729
Jindo Industries Ltd regroupe cinq entreprises fourrures conteneurs construction d automobiles de sports _ Panther _ en Angleterre location et entretien de véhicules pour le personnel militaire américain en Corée et revêtements abrasifs à la tête desquels se trouvent cinq frères,https://www.lemonde.fr/archives/article/1988/01/05/un-patronat-pragmatique_4076594_1819218.html,1988.0,frères,Positive,0.9849986433982849
Abbas Ali Hamadei vingt neuf ans est le premier des deux frères d une famille chiite du Liban sud incarcérés en RFA à être jugé,https://www.lemonde.fr/archives/article/1988/01/07/rfa-l-intervention-surprenante-d-abbas-ali-hamadei_4069239_1819218.html,1988.0,frères,Neutral,0.8876718282699585
Comme il se doit on se donnait des rendez vous discrets au cimetière du Père Lachaise par exemple les frères Halfen se rendant volontiers parmi les sépultures juives d autres préférant la tombe du mage Allan Kardec,https://www.lemonde.fr/archives/article/1988/01/10/deux-semaines-de-proces-pour-action-directe-le-sang-et-les-confitures_4070549_1819218.html,1988.0,frères,Neutral,0.6373743414878845
Moubarak a appelé l Iran à répondre favorablement aux offres de paix avertissant Téhéran que au cas où il s obstinerait à poursuivre la guerre contre l Irak l Egypte ne pourra en aucune façon lâcher ses frères arabes,https://www.lemonde.fr/archives/article/1988/01/12/le-conflit-du-golfe-chasse-croise-diplomatique_4071136_1819218.html,1988.0,frères,Positive,0.9705733060836792
Milos Jakes venu en visite de travail à Moscou comme le veut l usage pour les dirigeants des pays frères fraichement intronisés,https://www.lemonde.fr/archives/article/1988/01/13/urss-recevant-au-kremlin-m-milos-jakes-m-gorbatchev-souligne-l-unite-de-vues-entre-les-pc-sovietique-et-tchecoslovaque_4071855_1819218.html,1988.0,frères,Positive,0.9519882202148438
Dans une virulente critique de l intérêt hypertrophié de la presse occidentale pour les affaires tchécoslovaques un commentateur de l agence Tass citait le 5 janvier à titre d exemple trois différences fondamentales entre les deux démarches le rôle du parti affaibli et incapable d avancer un programme d actions sociale économiques et culturelles en 1968 à Prague ce rôle moteur s est en revanche accru en URSS de nos jours les relations au sein du bloc socialiste la perestroika a resserré les liens et accru les échanges tandis que l attitude de la Tchécoslovaquie il y a vingt ans suscitait l inquiétude et l opprobre de ses frères socialistes et enfin la presse assistante active du PCUS dans la perestroika véritable force d opposition à Prague en 1968,https://www.lemonde.fr/archives/article/1988/01/13/urss-recevant-au-kremlin-m-milos-jakes-m-gorbatchev-souligne-l-unite-de-vues-entre-les-pc-sovietique-et-tchecoslovaque_4071855_1819218.html,1988.0,frères,Negative,0.9877112507820129
Sans qu il ne le dise jamais ses proches savaient également que Louis Gomis avait à coeur de mettre à l abri son père et cinq de ses frères et soeurs,https://www.lemonde.fr/archives/article/1988/01/16/boxe-le-depart-de-louis-gomis-aux-portes-de-la-nuit_4063192_1819218.html,1988.0,frères,Neutral,0.5313964486122131
En sont témoins les frères Claude et Bernard Marreau qui au volant de leur Mitsubishi classé onzième sont repassés quatre fois devant la même pierre comme les Dupont au Pays de l or noir,https://www.lemonde.fr/archives/article/1988/01/16/le-rallye-paris-alger-dakar-les-amateurs-montrent-le-cap_4063193_1819218.html,1988.0,frères,Positive,0.9344494938850403
C est le cas du deuxième holding du pays le groupe Bruxelles Lambert d Albert frères dont les responsables affirment qu ils n ont pour le moment participé à aucun mouvement sur les titres de la Générale et qu ils comptent ne pas se départir de cette neutralité,https://www.lemonde.fr/archives/article/1988/01/20/le-tribunal-de-commerce-de-bruxelles-refuse-une-augmentation-de-capital_4063884_1819218.html,1988.0,frères,Neutral,0.9869136214256287
On peut dire sans exagération que nous sommes devenus des peuples frères,https://www.lemonde.fr/archives/article/1988/01/20/les-negociations-sur-le-desarmement-et-le-25e-anniversaire-du-traite-de-l-elysee-le-chancelier-kohl-expose-au-monde-sa-conception-de-la-securite-europeenne-on-ne-peut-defendre-stra_4063993_1819218.html,1988.0,frères,Positive,0.9933732748031616
Un des fils de l ayatollah Sayed Mohsen el Hakim décédé en 1970 qui fut le chef spirituel du clergé chiite irakien l hodjatoleslam Mehdi el Hakim était considéré comme plus modéré que ses frères qui dirigent depuis Téhéran l Assemblée suprême de la révolution islamique irakienne SAIRI l organe de coordination des différents mouvements de l opposition irakienne,https://www.lemonde.fr/archives/article/1988/01/20/soudan-l-assassinat-d-un-opposant-irakien-les-services-de-renseignements-de-bagdad-mis-en-cause_4063932_1819218.html,1988.0,frères,Neutral,0.615623950958252
Dans le but de faire pression sur les frères en exil le régime de Bagdad a commencé par exécuter en mai 1983 six membres de la famille Hakim,https://www.lemonde.fr/archives/article/1988/01/20/soudan-l-assassinat-d-un-opposant-irakien-les-services-de-renseignements-de-bagdad-mis-en-cause_4063932_1819218.html,1988.0,frères,Neutral,0.8703144788742065
Bernard Arnault président de la Financière Agache et PDG de Boussac Saint frères le désinvestissement de Peaudouce 2 6 milliards de chiffre d affaires trois mille personnes douze usines est parfaitement logique,https://www.lemonde.fr/archives/article/1988/01/21/en-cedant-peaudouce-aux-suedois-boussac-renonce-aux-couches-et-vise-le-luxe_4064515_1819218.html,1988.0,frères,Neutral,0.9903287291526794
Le PDG de Boussac Saint frères nous a indiqué que ces fonds seront utilisés dans deux directions la consolidation du secteur textile et le développement du secteur du luxe,https://www.lemonde.fr/archives/article/1988/01/21/en-cedant-peaudouce-aux-suedois-boussac-renonce-aux-couches-et-vise-le-luxe_4064515_1819218.html,1988.0,frères,Neutral,0.821941077709198
Le voyageur découvrira des instruments inusités au cours de soirées chez les meilleurs musiciens les frères Misra Rajan et Sajan qui représentent le plus pur style vocal de l école de Bénarès Ustad Asad Ali Khan dernier fils d une famille de musiciens qui jouaient dans les cours des maharadjahs de Jaipur un maitre du Dtanpad traditionnel Sri Armanath Misra et son sitar le pandit Kisham Maharaj spécialiste du tabla un instrument à percussion traditionnel le maitre Pt Hanuman Misra spécialiste du sarangi Buddhadev Das Gupta maitre du sarod un instrument à cordes de l Inde du Nord enfin Deboo Prasad Banerjee à la flûte,https://www.lemonde.fr/archives/article/1988/01/23/l-inde-et-ses-musiques_4066629_1819218.html,1988.0,frères,Positive,0.9979585409164429
Comme déjà fin décembre il s agissait de témoigner la solidarité des Arabes israéliens envers leurs frères des territoires,https://www.lemonde.fr/archives/article/1988/01/26/le-parti-travailliste-sort-affaibli-de-la-crise-en-cisjordanie-et-a-gaza_4066649_1819218.html,1988.0,frères,Positive,0.9824124574661255
Quand deux frères de la même famille se méfient et se font violence jusqu à envisager la mort l un de l autre c est qu ils n ont rien compris à leurs parents ou que leurs parents n ont rien compris à leurs enfants,https://www.lemonde.fr/archives/article/1988/01/26/si-l-un-veut-dominer-l-autre_4066636_1819218.html,1988.0,frères,Negative,0.993721604347229
Mais entre frères c est différent,https://www.lemonde.fr/archives/article/1988/01/26/si-l-un-veut-dominer-l-autre_4066636_1819218.html,1988.0,frères,Negative,0.8462778329849243
Et frères orientaux particulièrement,https://www.lemonde.fr/archives/article/1988/01/26/si-l-un-veut-dominer-l-autre_4066636_1819218.html,1988.0,frères,Positive,0.9904839992523193
Le courant ne passe pas en revanche avec les frères ennemis algériens qui se souviennent toujours du François Mitterrand ministre de la justice du gouvernement Guy Mollet pendant la guerre d Agérie,https://www.lemonde.fr/archives/article/1988/01/28/une-image-consistante_4067385_1819218.html,1988.0,frères,Negative,0.9691205024719238
Mais les frères Ayache sont prudents,https://www.lemonde.fr/archives/article/1988/01/30/l-halogene-en-famille_4069389_1819218.html,1988.0,frères,Neutral,0.6584303975105286
Entre les deux frères la confiance est la règle le compte bancaire est un compte joint à leur double nom,https://www.lemonde.fr/archives/article/1988/01/30/l-halogene-en-famille_4069389_1819218.html,1988.0,frères,Positive,0.9194009900093079
Mais les cadeaux et les halogènes ne constituent pas la totalité de l activité des frères Ayache,https://www.lemonde.fr/archives/article/1988/01/30/l-halogene-en-famille_4069389_1819218.html,1988.0,frères,Neutral,0.9391811490058899
Voilà donc les frères Ayache à la tête d un circuit de distribution qui dépasse largement les fondations familiales sur lesquelles il avait été bâti,https://www.lemonde.fr/archives/article/1988/01/30/l-halogene-en-famille_4069389_1819218.html,1988.0,frères,Positive,0.9269877672195435
Côté juridique et financier les deux frères étudient la manière de transformer leur complicité en un holding,https://www.lemonde.fr/archives/article/1988/01/30/l-halogene-en-famille_4069389_1819218.html,1988.0,frères,Neutral,0.6438343524932861
Tout en saluant nos frères au pouvoir en Algérie qui ont déployé des efforts sincères et fait état de leur disposition à contribuer au transport des deux petites filles à Alger il a déclaré que l Algérie agissait à la demande des autorités françaises,https://www.lemonde.fr/archives/article/1988/02/03/les-otages-du-groupe-d-abou-nidal-m-bitterlin-en-panne_4070096_1819218.html,1988.0,frères,Positive,0.9974023699760437
Riches et sensibles en particulier Danuta Salska Francesca Mario Muraro Paolo ainsi que les terribles frères James Diestch et Kenneth Garrison,https://www.lemonde.fr/archives/article/1988/02/05/francesca-da-rimini-de-zandonai-a-nancy-romantisme-troubadour_3543897_1819218.html,1988.0,frères,Positive,0.9656636118888855
Les soins l alphabétisation les cours primaires sont donnés par des religieuses du Sacré Coeur et des frères des écoles chrétiennes,https://www.lemonde.fr/archives/article/1988/02/06/les-sages-femmes-de-bayadeya_4072053_1819218.html,1988.0,frères,Positive,0.9949581027030945
Dès le 7 août sur l insistance de Me Labori et des frères Clemenceau il gagne Londres en fugitif amer et indigné,https://www.lemonde.fr/archives/article/1988/02/07/il-y-a-quatre-vingt-dix-ans-zola-devant-ses-juges_4072110_1819218.html,1988.0,frères,Negative,0.8566769361495972
Autant en effet les partis frères et autres mouvements assimilés ne peuvent se permettre au nom du principe de la non ingérence de critiquer la perestroika interne autant ils pourraient choisir l angle d attaque de l internationalisme prolétarien pour dénoncer ses retombées à l extérieur,https://www.lemonde.fr/archives/article/1989/01/05/la-pensee-diplomatique-de-m-gorbatchev-une-nouvelle-coexistence-pacifique_4117715_1819218.html,1989.0,frères,Negative,0.841193437576294
Depuis vingt ans elle suit la petite troupe des frères catholiques et protestants en aube blanche chante les mêmes mélopées en latin obsédantes à force d être répétées recherche un même sens à la vie,https://www.lemonde.fr/archives/article/1989/01/05/trente-trois-mille-jeunes-reunis-a-paris-par-la-communaute-de-taize-l-europe-a-mains-jointes_4117671_1819218.html,1989.0,frères,Neutral,0.9547332525253296
Alertés par de régulières et discrètes visites à Budapest de Roger Schutz prieur de la communauté et d autres frères de Taizé ce sont les jeunes eux mêmes qui ont préparé ce voyage,https://www.lemonde.fr/archives/article/1989/01/05/trente-trois-mille-jeunes-reunis-a-paris-par-la-communaute-de-taize-l-europe-a-mains-jointes_4117671_1819218.html,1989.0,frères,Positive,0.614748477935791
