Text,date,link,year
"Steinmetz a confié à ces élus qu'il n'y a pas de « tensions graves » dans la gendarmerie et que le mouvement revendicatif, notamment celui des épouses de gendarmes, qui se sont un temps organisées en association, voire celui des retraités, s'est « fortement atténué »",2001-11-07,https://www.lemonde.fr/archives/article/2001/11/07/alain-richard-doit-faire-face-a-la-grogne-des-gendarmes_242988_1819218.html,2001
"Ainsi, le président de la Commission européenne, Romano Prodi, et le chancelier autrichien, Wolfgang Schüssel, iront, ensemble, acheter à Vienne des bouquets de fleurs pour leurs épouses, quelques minutes après minuit",2001-12-24,https://www.lemonde.fr/archives/article/2001/12/24/l-euro-arrivera-en-fetes-et-en-decalages_256026_1819218.html,2001
"Les épouses turques ont désormais un pouvoir égal au sein du mariage, peuvent travailler sans demander l'autorisation de leur mari et prennent part à toutes les décisions concernant les enfants ou le lieu de résidence",2002-01-05,https://www.lemonde.fr/archives/article/2002/01/05/la-loi-turque-reconnait-aux-femmes-l-egalite-dans-le-mariage_257052_1819218.html,2002
" Lionel Jospin n'a pas éludé non plus la question sur la place des femmes de candidat, en estimant que c'était ""celle que déterminent les épouses, surtout quand (elles) existent par ailleurs""",2002-01-15,https://www.lemonde.fr/archives/article/2002/01/15/lionel-jospin-dissipe-tout-suspense-sur-sa-candidature_258631_1819218.html,2002
"C'est la fille dans le cas de mères trop vouées à être épouses, amantes, ou obnubilées par leur réussite professionnelle",2002-02-07,https://www.lemonde.fr/archives/article/2002/02/07/sur-un-couple-turbulent_261843_1819218.html,2002
"À ELLES CINQ, elles forment un petit club informel, s'entraidant et luttant contre les coups durs : Djeneba, Djenebou, Minata, Nakani et Penda sont toutes des deuxièmes épouses de maris polygames",2002-02-10,https://www.lemonde.fr/archives/article/2002/02/10/djeneba-djenebou-minata-nakani-et-penda-soeurs-de-galere_4214036_1819218.html,2002
", les femmes ont longtemps exercé leur métier dans l'ombre de leur mari, recensées par exemple comme aides familiales quand elles étaient agricultrices et à l'écart des statistiques qui préféraient y voir des épouses au foyer",2002-02-11,https://www.lemonde.fr/archives/article/2002/02/11/autres-parutions_262357_1819218.html,2002
"Les 2 500 chasseurs, et quelques-unes de leurs épouses, venus soutenir le candidat à la présidentielle de Chasse, pêche, nature et traditions (CPNT) dans la Somme, où ce parti, créé en 1989, a réalisé 27 % des suffrages aux élections européennes de 1999, le lui manifestent bruyamment",2002-03-01,https://www.lemonde.fr/archives/article/2002/03/01/m-saint-josse-en-terrain-conquis-chez-les-chasseurs-de-la-somme_264925_1819218.html,2002
"« Quand les maris travaillent à Soissons, les épouses ne vont pas leur dire de les suivre pour être chômeurs », explique Corinne Cloatre, ancienne représentante syndicale CGT de Wolber",2002-03-04,https://www.lemonde.fr/archives/article/2002/03/04/les-salaries-licencies-se-mefient-des-reclassements-internes_265287_1819218.html,2002
"Ou de constater le rôle de plus en plus significatif joué par les épouses des candidats, ou du moins des deux principaux d'entre eux, tant l'affrontement entre Jacques Chirac et Lionel Jospin se double d'une compétition d'image, de style ou de génération entre Bernadette et Sylviane",2002-03-08,https://www.lemonde.fr/archives/article/2002/03/08/femmes-en-politique_265858_1819218.html,2002
" Sur place, les deux épouses de Mahamadou Diawara niaient être intervenues dans l'excision de Koumba mais reconnaissaient avoir fait exciser leurs six filles, toutes âgées de quelques mois, entre 1985 et 1989 au Mali et à Noisy-Le-Grand",2002-03-15,https://www.lemonde.fr/archives/article/2002/03/15/proces-de-l-excision-prison-avec-sursis-pour-les-cinq-maliens_266931_1819218.html,2002
"Il y a une semaine, il envoyait aux journalistes un communiqué dans lequel il se plaignait de Jacques Chirac et Lionel Jospin qui « monopolisent » la campagne et « font de leurs épouses leurs covedettes médiatiques »",2002-03-19,https://www.lemonde.fr/archives/article/2002/03/19/jany-le-pen-et-catherine-megret-font-aussi-campagne_267336_1819218.html,2002
"De quoi séduire les femmes - épouses successives du candidat, ses filles (l'une ""clone"", l'autre ""félone""), suivantes pâmées, militantes dévouées, qui sans doute trouvent en lui le maître - père idéal d'une domination masculine supposée inhérente à l'ordre du monde",2002-04-30,https://www.lemonde.fr/archives/article/2002/04/30/agir-femmes-encore-un-effort-par-michelle-perrot_273844_1819218.html,2002
"Et quand pour obtenir un supplément d'humanité, les deux principaux candidats présumés ont fait intervenir leurs épouses respectives, avant le premier tour, ils ont pratiqué la méthode Paris-Match : le rendez-vous pris à l'avance et la photo soigneusement calibrée",2002-05-12,https://www.lemonde.fr/archives/article/2002/05/12/la-television-nous-a-renvoye-une-image-floue-et-un-discours-confus_4238531_1819218.html,2002
"Les prêtres folkloriques, les épouses que l'on croyait soumises au point de vous laisser partir presque sans récriminations, sont prêts à tout pour vous mettre aux fers",2002-05-19,https://www.lemonde.fr/archives/article/2002/05/19/bataille-cauchemardesque-dans-la-sphere-intime-de-la-religion_4243372_1819218.html,2002
"Sous les applaudissements, les deux présidents suivis de leurs épouses ont ensuite gagné le mémorial, dont la colonnade est ornée d'une statue monumentale symbolisant ""l'âme de la jeunesse américaine""",2002-05-27,https://www.lemonde.fr/archives/article/2002/05/27/mm-bush-et-chirac-honorent-les-soldats-americains-morts-pour-la-liberte_277539_1819218.html,2002
"Tant qu'elle ne prendra pas sérieusement en considération ceux qui ont combattu pour la France en Algérie, leurs épouses et leurs enfants, leurs voix iront principalement à droite »",2002-05-29,https://www.lemonde.fr/archives/article/2002/05/29/le-comportement-de-la-gauche-avec-les-harkis-est-dramatique_277840_1819218.html,2002
Une poignée de cadres japonais en costume cravate accompagnés de leurs épouses partagent les tables avec quelques jeunes fans de football,2002-05-31,https://www.lemonde.fr/archives/article/2002/05/31/reportage-france-senegal-sans-passion-dans-un-bar-de-tokyo_278304_1819218.html,2002
Une poignée de cadres japonais en costume-cravate accompagnés de leurs épouses partagent les tables avec quelques jeunes fans de football,2002-06-01,https://www.lemonde.fr/archives/article/2002/06/01/ambiance-policee-dans-un-bar-de-tokyo_278417_1819218.html,2002
" Agents, business, épouses, médias, tout était codifié, organisé, voire écarté, pour ne pas crever la « bulle »",2002-06-04,https://www.lemonde.fr/archives/article/2002/06/04/regles-du-jeu-adoucies-pour-les-bleus_278805_1819218.html,2002
"Les épouses et leurs progénitures ont investi un étage, dans le même hôtel que leurs maris",2002-06-19,https://www.lemonde.fr/archives/article/2002/06/19/l-equipe-americaine-s-est-installee-avec-femmes-et-enfants_281456_1819218.html,2002
"Sans se soucier des ennemis qu'elle ferait naître, l'égérie pessimiste et provocatrice des Années folles a dressé un portrait au vitriol des différents types humains, en fonction de leur place dans l'organisation sociale (le terrible ""Les épouses""), de certaines particularités comportementales (""Les raseurs"", ""Les jeunes loups"", ""Les bohèmes"") ou même de quelques productions sociales particulièrement assommantes",2002-06-20,https://www.lemonde.fr/archives/article/2002/06/20/livraisons-poesie_281600_1819218.html,2002
"Non seulement la procédure est rendue difficile pour les épouses, mais les femmes se retrouvent à la rue, sans domicile, après une séparation, même si elles se voient attribuer la garde des enfants",2002-06-30,https://www.lemonde.fr/archives/article/2002/06/30/une-crise-d-identite_4226998_1819218.html,2002
"A la fin des années 1950, les paysans se firent embaucher dans les usines qui ouvraient, leurs épouses continuant de cultiver leur lopin de terre",2002-07-17,https://www.lemonde.fr/archives/article/2002/07/17/a-latina-la-ville-nouvelle-creee-par-le-duce_285079_1819218.html,2002
"Les épouses des joueurs étaient du voyage, elles aussi",2002-07-28,https://www.lemonde.fr/archives/article/2002/07/28/3-la-folle-aventure-des-bleus_4259133_1819218.html,2002
"Toutes font à un moment ou l'autre l'objet d'un troc où elles n'ont pas leur mot à dire, notamment les filles de citoyens, qu'elles soient vierges à ""labourer"", veuves à recaser, épouses dont on se lasse et qu'il faut passer d'un lit à l'autre",2002-07-30,https://www.lemonde.fr/archives/article/2002/07/30/les-femmes-dans-l-antiquite-par-pierre-brule-danielle-gourevitch-et-marie-therese-raepsaet-charlier_286207_1819218.html,2002
 Les épouses prenaient la suite,2002-08-15,https://www.lemonde.fr/archives/article/2002/08/15/la-saison-de-la-sardine-a-gouverne-les-vies-de-plusieurs-generations_287393_1819218.html,2002
"Les hommes ont laissé leurs épouses venir car nous sommes une association de femmes », explique Simin Azimi",2002-09-02,https://www.lemonde.fr/archives/article/2002/09/02/des-femmes-pour-l-emploi_288861_1819218.html,2002
"Outre la cohorte des spys girls, filles de bar, journalistes, secrétaires, épouses de l'attaché militaire du IIIe Reich ou du directeur de Siemens, deux femmes avaient joué un grand rôle dans la vie de Sorge : Hanako Miyake, l'hôtesse habile à chanter pour ses hôtes et servir le saké, et Eta Harich- Schneider, une harpiste, son dernier amour",2002-09-26,https://www.lemonde.fr/archives/article/2002/09/26/l-espion-qui-vivait-l-effroi_291986_1819218.html,2002
"« Les comptes individuels permettent de garantir les droits des épouses divorcées, par exemple",2002-09-30,https://www.lemonde.fr/archives/article/2002/09/30/la-retraite-europeenne-n-aura-pas-lieu_292445_1819218.html,2002
"Les principaux protagonistes du livre ont été consultés, mais ce sont leurs ex- épouses et ex-maîtresses qui s'expriment à leur place, avec une profusion de détails qui donnent une vision partielle et partiale des faits",2002-10-10,https://www.lemonde.fr/archives/article/2002/10/10/hollywood-entre-parentheses_293771_1819218.html,2002
" A Palerme (Sicile), ce sont les épouses et compagnes des 1 800 employés de l'usine Fiat de Termini Imerese, qui doit être fermée avant la fin de l'année, qui ont pris la tête du cortège comptant, toujours selon la CGIL, 30 000 personnes",2002-10-18,https://www.lemonde.fr/archives/article/2002/10/18/deux-millions-d-italiens-dans-les-rues_294811_1819218.html,2002
"Le nouveau fermier prend la route avec toute sa famille, soit une tribu de sept épouses et de quelque soixante rejetons",2003-01-03,https://www.lemonde.fr/archives/article/2003/01/03/chenjerai-hove-l-afrique-entre-les-lignes_304221_1819218.html,2003
" Pendant quatre ans, le juge Guariniello a multiplié les auditions de joueurs et ex-joueurs, transformant son bureau en confessionnal où des dizaines d'épouses se sont précipitées pour raconter, en larmes, les drames vécus par leurs maris, dénonçant ""les pratiques illicites"" des clubs, ""l'obligation de jouer même blessé"" ou encore les ""pastilles avalées avant les matches""",2003-01-15,https://www.lemonde.fr/archives/article/2003/01/15/l-inquietant-taux-de-mortalite-des-footballeurs-italiens_305567_1819218.html,2003
"Celle des mères et des épouses, celle des soldats, celle de l'auteur et les interpellations de leurs ennemis",2003-01-24,https://www.lemonde.fr/archives/article/2003/01/24/les-cercueils-de-zinc-troix-voix-dans-le-silence-de-mort-de-la-russie_306751_1819218.html,2003
"Elle raconte aujourd'hui ce que lui enseignèrent ces témoignages effarants d'épouses de hauts dirigeants du parti ou de paysannes du fin fond de la Chine, conséquences de siècles de soumission au père, au mari ou au fils, d'années de terreur et de répression sous le régime communiste",2003-01-30,https://www.lemonde.fr/archives/article/2003/01/30/audaces-et-non-dits-de-la-vie-intime-des-chinoises_307440_1819218.html,2003
" UN VOILE SE LÈVE Un voile se lève sur la façon dont les étudiantes pauvres se payent cachemire et bijoux, sur le cahier des charges des ""secrétaires privées"" des hommes d'affaires, sur le surnom que les hommes mariés donnent à leurs épouses (""Morue salée""), sur les viols perpétrés par les soldats pendant les tremblements de terre ou sur les homosexuelles, sur cette militante mariée de force par la révolution, sur cette femme qui attendit quarante-cinq ans le retour de son amoureux, sur cette handicapée mentale dont abusa tout un village, sur cette prétendue ""petite bourgeoise"" martyrisée par les gardes rouges",2003-01-30,https://www.lemonde.fr/archives/article/2003/01/30/audaces-et-non-dits-de-la-vie-intime-des-chinoises_307440_1819218.html,2003
"Très vite, les commérages s'emballent, les bourgeois et leurs épouses désœuvrées n'ont plus qu'une obsession : pourquoi Ponza a-t-il installé les deux femmes dans des appartements séparés, et pourquoi interdit-il, visiblement, à son épouse de voir sa mère",2003-02-24,https://www.lemonde.fr/archives/article/2003/02/24/pirandello-prive-d-ambiguite-dans-sa-peinture-de-la-folie_310478_1819218.html,2003
"Même si un doute persiste, on a coutume de dire que Léopold Sédar Senghor est né dans celle de Joal, autre demeure que possédait son père, un commerçant aisé qui avait cinq épouses et quarante et un enfants",2003-03-19,https://www.lemonde.fr/archives/article/2003/03/19/en-pirogue-dans-le-delta-du-saloum_313494_1819218.html,2003
" Gérard Courtois MOI, VIVANTE, de Michel Richard Voilà un roman, bref et cruel, que l'on recommandera à toutes les épouses de ministrables ou de ""premier-ministrables""de ne pas lire",2003-04-03,https://www.lemonde.fr/archives/article/2003/04/03/et-aussi_315444_1819218.html,2003
"Elle était de ces lesbiennes impardonnables, conquérantes, envahissantes, prenant volontiers aux maris leurs épouses et proclamant leur détestation du masculin : ""Tristesse",2003-04-03,https://www.lemonde.fr/archives/article/2003/04/03/mireille-havet-enfant-perdue-du-xxe-siecle_315429_1819218.html,2003
"Selon Marie-Claire Huot, qui signe la préface de ce recueil de deux nouvelles, son succès vient du fait que ses récits ""sont des témoignages fictifs de la perpétuation, dans la Chine de Mao, de la vieille Chine dans ce qu'elle a de plus irrésistiblement défendu : la sexualité hors des normes et, qui plus est, la sexualité de femmes loin d'être de bonnes épouses et mères de famille sans histoire""",2003-05-22,https://www.lemonde.fr/archives/article/2003/05/22/et-aussi_321151_1819218.html,2003
"Deux pères de famille, leurs épouses et leurs enfants, âgés de 18 mois à 17 ans, ont été assassinés par balles par un groupe armé",2003-05-27,https://www.lemonde.fr/archives/article/2003/05/27/un-massacre-en-algerie-fait-quatorze-victimes_321782_1819218.html,2003
Même les épouses restaient à l'écart,2003-07-11,https://www.lemonde.fr/archives/article/2003/07/11/teddy-chapatte-premiere-femme-a-avoir-suivi-le-tour_327493_1819218.html,2003
"Suivaient des épouses de prisonniers qui portaient des portraits de leurs maris et d'élus de Corsica Nazione, qui ont annoncé, jeudi, qu'ils ne siègeraient plus à l'assemblée territoriale ""jusqu'à nouvel ordre""",2003-07-19,https://www.lemonde.fr/archives/article/2003/07/19/des-milliers-de-nationalistes-manifestent-a-ajaccio_328369_1819218.html,2003
"Le soir, c'est soirée de gala avec les épouses, distribution des prix sur scène, remerciements, applaudissements sur l'air du Blues du businessman",2003-07-26,https://www.lemonde.fr/archives/article/2003/07/26/intime-conviction-de-paule-constant_329041_1819218.html,2003
" Le dernier cliché où le groupe est au complet est pris à Las Vegas, où Annie-et-Nicolas ont réuni les cadres et leurs épouses pour une super-parade qui doit, en les récompensant pour des résultats exceptionnels, leur montrer tout ce qui reste à faire pour atteindre le niveau américain",2003-07-26,https://www.lemonde.fr/archives/article/2003/07/26/intime-conviction-de-paule-constant_329041_1819218.html,2003
" Valérie aurait du mal à figurer encore sur la photo des cadres dynamiques et de leurs pimpantes épouses, elle vit dans un mobile home, dans une sorte de décharge au milieu d'épaves de voitures",2003-07-26,https://www.lemonde.fr/archives/article/2003/07/26/intime-conviction-de-paule-constant_329041_1819218.html,2003
"Le soir, c'est soirée de gala avec les épouses, distribution des prix sur scène, remerciements, applaudissements sur l'air du Blues du businessman",2003-07-27,https://www.lemonde.fr/archives/article/2003/07/27/intime-conviction_4277867_1819218.html,2003
" Le dernier cliché où le groupe est au complet est pris à Las Vegas, où Annie-et-Nicolas ont réuni les cadres et leurs épouses pour une super-parade qui doit, en les récompensant pour des résultats exceptionnels, leur montrer tout ce qui reste à faire pour atteindre le niveau américain",2003-07-27,https://www.lemonde.fr/archives/article/2003/07/27/intime-conviction_4277867_1819218.html,2003
" Valérie aurait du mal à figurer encore sur la photo des cadres dynamiques et de leurs pimpantes épouses, elle vit dans un mobile home, dans une sorte de décharge au milieu d'épaves de voitures",2003-07-27,https://www.lemonde.fr/archives/article/2003/07/27/intime-conviction_4277867_1819218.html,2003
"Ici, les goûts comme les siens se portent discrets, avec épouses aux premiers rangs",2003-08-09,https://www.lemonde.fr/archives/article/2003/08/09/attentat-sous-la-coupole-de-bertrand-poirot-delpech_330216_1819218.html,2003
"En 1920, le héros accepte de déposer les armes et se retire en compagnie de ses nombreuses épouses dans une ferme",2003-09-11,https://www.lemonde.fr/archives/article/2003/09/11/de-moctezuma-ii-a-jorge-luis-borges_333596_1819218.html,2003
"Il lui fit une tête de politicien menteur et impitoyable, ce que devait être en effet le duc, oncle de deux des épouses et victimes d'Henry VIII, Anne Boleyn et Catherine Howard",2003-09-12,https://www.lemonde.fr/archives/article/2003/09/12/exposition-les-enquetes-picturales-de-hans-holbein-implacable-portraitiste-des-puissants_333738_1819218.html,2003
Commence alors le ballet des ex-épouses ou anciennes maîtresses venues réclamer leur part du magot,2003-09-25,https://www.lemonde.fr/archives/article/2003/09/25/l-ile-aux-mensonges-d-elizabeth-george_335446_1819218.html,2003
"Réunies dans le collectif des ""femmes d'arsenalistes"", les épouses de salariés de GIAT Industries sont de toutes les manifs et de toutes les actions aux côtés de leurs maris et compagnons, pour affirmer leur opposition aux 600 suppressions d'emplois",2003-10-27,https://www.lemonde.fr/archives/article/2003/10/27/les-femmes-d-arsenalistes-disent-stop-a-la-casse_339661_1819218.html,2003
"On est loin des témoignages relatés par ses proches, ses ex-épouses notamment, sur le climat empoisonné qui régnait entre Anne-Marie Pignal et son fils",2003-11-01,https://www.lemonde.fr/archives/article/2003/11/01/depensier-et-instable-l-heritier-jure-qu-il-n-a-pas-tue-sa-mere-adoptive_340395_1819218.html,2003
"Elles ont été placées en garde à vue, tout comme cinq épouses ou compagnes",2003-11-17,https://www.lemonde.fr/archives/article/2003/11/17/la-police-antiterroriste-a-arrete-douze-personnes-en-corse_342305_1819218.html,2003
Leurs épouses et leurs bambins ont d'habitude le droit de rester dans l'hôtel,2003-11-19,https://www.lemonde.fr/archives/article/2003/11/19/les-australiens-se-preparent-au-calme-loin-de-sydney_342569_1819218.html,2003
"Drôle d'idée aussi, pour ces épouses réunies au sein de la commission féminine de la Fédération départementale des groupes d'étude et de développement agricole de la Haute-Vienne (FDGEDA), de s'affranchir de la discrétion de rigueur chez les femmes d'agriculteurs pour aller à la rencontre de l'extérieur",2003-11-19,https://www.lemonde.fr/archives/article/2003/11/19/theatre-le-malaise-paysan-traduit-sur-scene-avec-humour-et-par-ses-victimes_342582_1819218.html,2003
"Sympathie mutuelle des épouses, week-end au château de Mormaire, à Grosrouvre (Yvelines), propriété de M",2003-11-22,https://www.lemonde.fr/archives/article/2003/11/22/entre-francois-pinault-et-jacques-chirac-une-longue-et-puissante-amitie_342994_1819218.html,2003
"C'est ainsi qu'elle a annoncé, mercredi, avoir capturé la fille et l'une des épouses du numéro deux du régime déchu, Ezzat Ibrahim",2003-11-26,https://www.lemonde.fr/archives/article/2003/11/26/les-forces-americaines-multiplient-traques-et-ratissages-en-irak_343554_1819218.html,2003
"Lorsque les épouses flanchent, les mères volent à leur secours",2004-01-08,https://www.lemonde.fr/archives/article/2004/01/08/un-triple-feydeau-pour-pietiner-l-amour_348424_1819218.html,2004
"La famille reproche au magistrat d'avoir « refusé d'informer sur des faits de recels aggravés », ce qui a eu pour effet la libération des épouses de David Hotyat, assassin présumé de la famille Flactif, et de Stéphane Haremza, son complice présumé",2004-01-25,https://www.lemonde.fr/archives/article/2004/01/25/justice-une-requete-en-suspicion-legitime-visant-le-juge-d-instruction-d-annecy-a-ete-deposee-apres-la-liberation-des-epouses-de-david-hotyat-et-stephane-haremza_4285588_1819218.html,2004
"La virilité du Prophète, le plaisir donné à ses neuf épouses sont exaltés dans la tradition musulmane, autant que ses exploits militaires",2004-01-29,https://www.lemonde.fr/archives/article/2004/01/29/et-aussi_351011_1819218.html,2004
 Alma : Le Prophète aidait ses épouses dans leurs tâches ménagères,2004-02-14,https://www.lemonde.fr/archives/article/2004/02/14/alma-et-lila-a-decouvert_353005_1819218.html,2004
"Destiné avant tout aux épouses abandonnées par leur mari, le film d'Audrey Wells adapte un roman autobiographique qui fut un succès de librairie",2004-03-02,https://www.lemonde.fr/archives/article/2004/03/02/nouveaux-films_355185_1819218.html,2004
"Femmes d'affaires ou épouses en retour de shopping, le spectacle est dans la salle",2004-03-05,https://www.lemonde.fr/archives/article/2004/03/05/guide_355683_1819218.html,2004
"Très vite, il devient le couturier officiel de l'empire soviétique, réalisant aussi bien les robes des épouses des hauts membres du parti que les uniformes des ouvriers agricoles ou les tenues des athlètes soviétiques pour les Jeux olympiques de 1980",2004-03-05,https://www.lemonde.fr/archives/article/2004/03/05/pere-de-la-mode-russe_355682_1819218.html,2004
" ""Certains ont des frères, d'autres des enfants, des épouses ou des époux de l'autre côté"", explique Jean Bosco Rusthatsi, chef de la sous délégation du HCR à Tindouf",2004-03-06,https://www.lemonde.fr/archives/article/2004/03/06/des-familles-sahraouies-se-retrouvent-apres-30-ans-de-separation_355832_1819218.html,2004
"Le substantif, qu'une condescendance virile jette aux épouses, désigne ici des femmes poussées vers la folie, mères, filles et petites-filles porteuses de la même ""grimace"" de génération en génération, comme si elles étaient vouées à illustrer sans fin les attendus d'une malédiction ancestrale",2004-03-17,https://www.lemonde.fr/archives/article/2004/03/17/entre-alger-et-marseille-le-cercueil-ou-la-valise_357126_1819218.html,2004
" Ces femmes étaient incarcérées parce qu'elles étaient républicaines ou simplement mères, sœurs ou épouses de militants communistes ou anarchistes",2004-04-15,https://www.lemonde.fr/archives/article/2004/04/15/un-documentaire-sur-les-enfants-perdus-du-franquisme-est-montre-sur-odyssee_361260_1819218.html,2004
"Envers les ex-épouses âgées de plus de 50 ans, la rente viagère est toutefois prépondérante",2004-04-18,https://www.lemonde.fr/archives/article/2004/04/18/la-vie-financiere-apres-le-divorce_4298444_1819218.html,2004
" Depuis toujours, il y a une pression sociale sur les femmes pour que l'ordre qu'elles donnent à voir soit conforme à ce que l'on attend d'elles, en tant que mères et épouses",2004-04-20,https://www.lemonde.fr/archives/article/2004/04/20/m-welzer-lang-dans-chaque-couple-les-memes-frictions_361827_1819218.html,2004
" LES ÉPOUSES À LA CUISINE Braquer le projecteur sur l'environnement festif lié au tournoi, offre l'avantage de s'extraire des aléas de la compétition",2004-06-01,https://www.lemonde.fr/archives/article/2004/06/01/les-marques-jouent-la-connivence-avec-les-supporteurs-de-football_367103_1819218.html,2004
"Intéressant et révélateur, que certains aient fustigé la chorégraphe, non sans mauvaise foi politicienne, pour une vision simpliste faite ""de toilette au hammam, d'épouses vouées à la conception et d'époux machos""",2004-06-03,https://www.lemonde.fr/archives/article/2004/06/03/pina-bausch-trace-le-fil-rouge-de-la-vie-contre-la-barbarie_367394_1819218.html,2004
" Bien protégés, bien logés, les joueurs suisses ont pu, après leur premier match, disputé dimanche 13 juin contre la Croatie (0-0), retrouver dans leur hôtel de luxe épouses, compagnes et enfants, invités par la Fédération pour soutenir le moral des troupes",2004-06-16,https://www.lemonde.fr/archives/article/2004/06/16/face-a-l-angleterre-les-suisses-veulent-chasser-leur-complexe-d-inferiorite_369230_1819218.html,2004
