Text,link,year,aspect,sentiment,prob
Le Le Moyne d Iberville est le bateau frère du Cavelier de la Salle lancé en février dernier,https://www.lemonde.fr/archives/article/1949/01/19/m-andre-colin-assiste-a-bordeaux-au-lancement-du-le-moyne-d-iberville_1922952_1819218.html,1949.0,frère,Positive,0.9323781132698059
Le petit Italien Silvio Alvera souple comme un chat a effectué deux bons parcours il est quatrième tandis que son frère Albino est quinzième,https://www.lemonde.fr/archives/article/1949/01/21/brillant-succes-du-ski-francais-au-slalom-de-megeve-rochebrune_1923564_1819218.html,1949.0,frère,Positive,0.9472574591636658
Soung beau frère du généralissime Tchiang Kaï Chek a remis sa démission de gouverneur du Kouang Toung,https://www.lemonde.fr/archives/article/1949/01/24/pekin-a-capitule_1922828_1819218.html,1949.0,frère,Positive,0.966084361076355
Saelens et Mauduit puis les tandems Trevoux Lesurque habitués de l épreuve et Lecot Senfftleben le premier détient le record de la distance kilométrique 100 000 kilomètres le second est le frère du fameux sprinter cycliste,https://www.lemonde.fr/archives/article/1949/01/28/le-19e-rallye-international-de-monte-carlo_1923050_1819218.html,1949.0,frère,Positive,0.8647192120552063
Les hommes s y attrapent souvent mais pas la nature et devant elle Duhamel est incomparable contemplateur exact attentif à n être pas dupe chercheur infatigable de leçons et d avertissements très différent en cela de Jean Jacques son frère à tant d autres égards Jean Jacques pour qui la botanique était une étude oiseuse propre à remplir le vide de ses loisirs,https://www.lemonde.fr/archives/article/1949/02/02/dans-un-jardin_1936921_1819218.html,1949.0,frère,Negative,0.9536064267158508
Marié à Léopoldine archiduchesse d Autriche il se trouvait donc le beau frère de Napoléon,https://www.lemonde.fr/archives/article/1949/02/02/la-formation-de-l-empire-du-bresil_1936821_1819218.html,1949.0,frère,Positive,0.9931631088256836
D un ton uni sérieux avec de temps en temps des notes hautes d une extraordinaire douceur Olga Marchenko raconte son histoire déporté en Sibérie son frère y avait fini son temps,https://www.lemonde.fr/archives/article/1949/02/02/les-temoins-russes-de-m-kravchenko-pourraient-etre-des-personnages-de-son-livre_1936570_1819218.html,1949.0,frère,Positive,0.41825926303863525
Mais le frère de M,https://www.lemonde.fr/archives/article/1949/02/05/faits-divers_1937086_1819218.html,1949.0,frère,Negative,0.7970470786094666
La scène où le frère abandonné numéro 1 rallume sa douleur à celle de l abandonné numéro 2 et rouge de refoulement d appétit charnel veut savoir si le premier soir de set amours avec Jacques Lucie était intacte est le meilleur aspect bien qu un peu mélodramatique de cette pièce caméléon,https://www.lemonde.fr/archives/article/1949/02/10/une-femme-libre-au-theatre-saint-georges_1937141_1819218.html,1949.0,frère,Positive,0.3474081754684448
D où la nécessité de recourir à la psychanalyse pour en éclairer les faits les plus troublants en des pages remarquables sur la philosophie des stades d existence et l analyse du frère Taciturne Mesnard l utilise de main de maître,https://www.lemonde.fr/archives/article/1949/02/11/de-kierkegaard-a-l-existentialisme_1935860_1819218.html,1949.0,frère,Positive,0.8758732080459595
Mais Mon frère Yves demeure très vivant et très vrai avec des pages admirables comme celle de l immersion de Barazère et Pêcheur d Islande reste un très grand livre comme il apparut dans sa nouveauté,https://www.lemonde.fr/archives/article/1949/02/16/a-propos-d-un-livre-sur-loti_1936111_1819218.html,1949.0,frère,Positive,0.998124897480011
Plus que son frère Yves que son spahi que son Yann c est lui qui intéresse dans ses livres et plus que son jugement sa faculté d émotion sa sensibilité d artiste et sa rêverie de poète son infini tourment de l ailleurs et de l au delà sa pitié profonde et révoltée devant ce qui soutire devant tout ce qui est condamné à mourir dans un monde sans explication,https://www.lemonde.fr/archives/article/1949/02/16/a-propos-d-un-livre-sur-loti_1936111_1819218.html,1949.0,frère,Positive,0.9931825995445251
Baurès juge d instruction a inculpé de provocation au meurtre l écrivain Maurice Bardèche beau frère de Robert Brasillach à raison de certains passages de son livre Nuremberg ou la terre promise,https://www.lemonde.fr/archives/article/1949/02/17/m-maurice-bardeche-est-ecroue-a-fresnes_1937222_1819218.html,1949.0,frère,Negative,0.7685192823410034
Pour le Yémen c est le propre frère du souverain qui quotidiennement nous manifeste sa sympathie prolonge son séjour à Paris,https://www.lemonde.fr/archives/article/1949/02/28/l-orient-arabe-revient-progressivement-a-la-culture-francaise_1936912_1819218.html,1949.0,frère,Positive,0.9742484092712402
Le Caire 26 février Le frère du ministre des communications Abdel Aziz Seif et Nasr bey a été arrêté hier vendredi annonce la revue Akhpar et Yom pour menées communistes,https://www.lemonde.fr/archives/article/1949/02/28/le-frere-du-ministre-egyptien-des-communications-arrete-pour-menees-communistes_1936764_1819218.html,1949.0,frère,Negative,0.9919947385787964
Selon le journal Al Misri qui rapporte la même nouvelle ce serait le ministre lui même qui aurait remis son frère aux mains de la police après avoir été averti de l accusation qui pesait sur lui,https://www.lemonde.fr/archives/article/1949/02/28/le-frere-du-ministre-egyptien-des-communications-arrete-pour-menees-communistes_1936764_1819218.html,1949.0,frère,Negative,0.9181337356567383
Le frère de Frieda survenu un sourire mielleux aux lèvres et les poches pleines de croix gammées se trouve démasqué par une de ses victimes comme un bourreau de l univers concentrationnaire,https://www.lemonde.fr/archives/article/1949/03/05/frieda-le-chapelier-et-son-chateau_1920710_1819218.html,1949.0,frère,Negative,0.9956992864608765
Tous deux s aiment se réfugient à Paris auprès du frère de Manon jeune gouape sans scrupules garde du corps dans le roman et mauvais surveillant ici de celui de sa sœur,https://www.lemonde.fr/archives/article/1949/03/10/en-sortant-de-manon-de-h-g-clouzot_1920934_1819218.html,1949.0,frère,Negative,0.46111005544662476
Un meurtre celui du frère Lescaut par Descrieux excédé contraint le couple de fuir Paris passagers clandestins sur un cargo de sionistes mêlés à leur cohorte d émigrants décimée par les Arabes ils mourront dans un désert de Palestine qui remplacera le Nouvel Orléans des exilés du roman,https://www.lemonde.fr/archives/article/1949/03/10/en-sortant-de-manon-de-h-g-clouzot_1920934_1819218.html,1949.0,frère,Negative,0.9960893392562866
Mlle Adélaïde est amoureuse de son frère cadet qu elle a bercé soigné débarbouillé,https://www.lemonde.fr/archives/article/1949/03/10/mlle-adelaide-au-gymnase_1921419_1819218.html,1949.0,frère,Positive,0.6375882029533386
Mansare Mourikandian William Mensah Moktar ben Chenir N Gombe Sassara Jacques Nguyen van Ky le pasteur Nguyen Van Qui Henri N Jave Jean Marie Ogaruwe frère coadjuteur mission catholique de N Djolé Gabon Ooualddou Souleyinanc Paye l ogba Topou Quam Dessou Kponton,https://www.lemonde.fr/archives/article/1949/03/21/nouvelles-du-jour_1921546_1819218.html,1949.0,frère,Neutral,0.6024993658065796
L Aubade du boulanger qu il nous apportait a pour auteur Rodolfo Halffter frère d Ernesto plus connu en France Rodolfo Halffter s est réfugié au Mexique la suite d orchestre qu il y a écrite est un ouvrage alerte plein d heureuses trouvailles de rythme et d orchestration et qui fait souhaiter d entendre tout entier le ballet dont elle est tirée,https://www.lemonde.fr/archives/article/1949/03/22/deux-chef-d-orchestre-j-y-limantour-et-alphonse-stallaert-premieres-auditions_3045507_1819218.html,1949.0,frère,Positive,0.5806381106376648
Si l on tient pour byzantin tout ce qui présente les caractères d un extrême raffinement de forme de pensée de sentiment certes Henry James l était et l on comprend que son pays lui ait préféré son frère William le philosophe pragmatiste,https://www.lemonde.fr/archives/article/1949/03/22/le-retour-d-henry-james_1920955_1819218.html,1949.0,frère,Positive,0.9374783635139465
En revanche il ne faisait pas allusion à son demi frère et à sa demi sœur au nom desquels l ambassade de Pologne a introduit l instance,https://www.lemonde.fr/archives/article/1949/03/30/un-nouveau-refere-aujourd-hui-sur-l-ouverture-du-testament-de-paderewski_1920944_1819218.html,1949.0,frère,Neutral,0.7277026772499084
De même le verbe frat qui veut dire fraterniser avec l ennemi l ennemi étant d ailleurs plutôt une sœur qu un frère,https://www.lemonde.fr/archives/article/1949/04/04/la-guerre-et-l-argot_1933137_1819218.html,1949.0,frère,Negative,0.8754096627235413
Albert Bormann aide de camp personnel d Hitler et frère du Reichsleiter Martin Bormann s est présenté volontairement au ministère de l épuration,https://www.lemonde.fr/archives/article/1949/04/07/petites-nouvelles_1932779_1819218.html,1949.0,frère,Neutral,0.5273602604866028
Dans un pays sud américain où la révolution est quotidienne une jeune Française arrive pour y retrouver son frère qui est propriétaire d un élevage,https://www.lemonde.fr/archives/article/1949/04/09/les-demoiselles-de-san-carlos_1933600_1819218.html,1949.0,frère,Positive,0.9736326932907104
Goossens que les critiques d outre Manche appellent le plus grand spécialiste de hautbois des temps modernes descend d une grande famille de musiciens son père était un chef d orchestre connu son frère Eugène est également l un des meilleurs chefs d orchestre britanniques de l heure et ses sœurs Victoria et Marie sont toutes deux d excellentes harpistes,https://www.lemonde.fr/archives/article/1950/01/04/nouvelles_2048723_1819218.html,1950.0,frère,Positive,0.9985658526420593
L ancien champion du monde universitaire Jean Duval a créé en 1915 un challenge destiné à perpétuer la mémoire de son frère aviateur tué en 1940,https://www.lemonde.fr/archives/article/1950/01/06/le-sixieme-fleurettiste-pour-rome-sera-designe-dimanche-a-l-issue-du-challenge-duval_2049231_1819218.html,1950.0,frère,Negative,0.563084065914154
Antoine Arts conseiller communal social chrétien d Anvers et frère de l avocat de M,https://www.lemonde.fr/archives/article/1950/01/06/un-scandale-financier-et-politique-est-sur-le-point-d-eclater-en-belgique_2048107_1819218.html,1950.0,frère,Positive,0.877234160900116
Leurs condisciples eux mêmes doivent oublier leur rang et ils n y manquent pas s amusant à chaque récréation à tomber à bras raccourcis sur Aumale et son frère Nemours,https://www.lemonde.fr/archives/article/1950/01/07/la-jeunesse-du-duc-d-aumale_2047847_1819218.html,1950.0,frère,Positive,0.5791932940483093
Deux êtres seuls ont percé cet affreux secret Bernard mis par hasard sur la piste de cette scandaleuse cousine qu il s offre à épouser parce qu elle a été reconnaissante à Charlotte qui avait été bonne pour elle et n avait jamais pardonné à son beau frère à sa belle sœur l inique abandon de leur fille,https://www.lemonde.fr/archives/article/1950/01/11/vertu-du-desordre_2048677_1819218.html,1950.0,frère,Positive,0.889366865158081
Celui ci s est borné à renouveler ses déclarations antérieures rejetant sur son beau frère la responsabilité,https://www.lemonde.fr/archives/article/1950/01/14/m-malafosse-est-inculpe-de-complicite-dans-l-affaire-de-sucrage-des-vins-de-l-aude_2048201_1819218.html,1950.0,frère,Positive,0.50651615858078
Des Bulgares je ne vois aucun des grands chefs Dimitrov et Kolarov mais seulement le beau frère du premier autre Anton quoique un peu moins médiocre et qui rit constamment,https://www.lemonde.fr/archives/article/1950/01/16/tous-les-chemins-sont-fermes_2047686_1819218.html,1950.0,frère,Positive,0.9733577370643616
Jusqu ici le gouvernement polonais n a pas répondu à la demande d information des États Unis concernant Hermann Field frère du précédent disparu en Pologne le 22 août au moment où il allait prendre l avion pour rejoindre sa belle sœur a Prague,https://www.lemonde.fr/archives/article/1950/01/17/le-mystere-field-demeure_2049387_1819218.html,1950.0,frère,Negative,0.5362403392791748
Rapportant devant Bertrand ce qu il disait un jour à son frère Joseph qui se croyait un grand militaire Tu ne vaux pas le capitaine de voltigeurs qui est à la porte,https://www.lemonde.fr/archives/article/1950/01/18/le-journal-du-general-bertrand_2048243_1819218.html,1950.0,frère,Negative,0.8012995719909668
Une enfance délicieuse entre des parents âgés un frère et une sœur de beaucoup ses aînés et tout attentifs à lui plaire une adolescence exaltée par le rêve à l ombre des bois et au bord de l Océan puis quelques années de jeunesse pauvre comme pour rendre plus charmant le premier sourire de la fortune entre vingt et trente ans de longs voyages en mer les plus beaux sites du monde visités l offrande des plus romanesques amours autour de la trentaine pour quelques pages de journal nonchalamment publiées la gloire littéraire survenant comme par surprise et substituant en quelques années au matelot Pierre le personnage de Pierre Loti lu par un immense public académicien à quarante ans adulé par le monde ami de deux reines et jusqu à la vieillesse la même existence agitée de voyageur et de prince des lettres de pèlerin et de poète des paysages grandioses,https://www.lemonde.fr/archives/article/1950/01/21/situation-de-loti_2048623_1819218.html,1950.0,frère,Positive,0.9917593598365784
Et voilà ce qu il faut voir en définitive dans l auteur de Mon frère Yves et de Vers Ispahan un classique du cœur,https://www.lemonde.fr/archives/article/1950/01/21/situation-de-loti_2048623_1819218.html,1950.0,frère,Positive,0.9500637650489807
A peine rentrés de Marseilles les policiers parisiens de la sûreté nationale appréhendèrent gare de Lyon deux suspects qui avaient voyagé dans le même train qu eux Antoine Cordoleani et Jean Paul Carbone le frère du gangster marseillais,https://www.lemonde.fr/archives/article/1950/01/24/lindsay-watson-ecroue-a-marseille-refuse-de-repondre-au-juge-d-instruction_2048727_1819218.html,1950.0,frère,Negative,0.674321174621582
Renzo Nostini son frère et c est étrange est un tireur classique le plus classique des six Transalpins,https://www.lemonde.fr/archives/article/1950/01/26/fleurettistes-francais-et-fleurettistes-italiens-vont-s-affronter-a-rome-dans-la-coupe-gaudini_2048374_1819218.html,1950.0,frère,Neutral,0.6033183336257935
Le frère du chef du R,https://www.lemonde.fr/archives/article/1950/01/26/rendez-vous-de-janvier_2047762_1819218.html,1950.0,frère,Neutral,0.5024291276931763
En fait depuis l assassinat de Nokrachy pacha par un frère musulman la politique égyptienne s est engagée dans une nouvelle orientation,https://www.lemonde.fr/archives/article/1950/01/28/m-bevin-au-caire-fait-connaissance-avec-le-programme-social-du-wafd_2048321_1819218.html,1950.0,frère,Negative,0.9552867412567139
Le dernier coup de force a mis fin aux agissements du généralissime Hinnaouï et de son beau frère Assad Talass secrétaire général des affaires étrangères,https://www.lemonde.fr/archives/article/1950/01/31/ii-la-cause-profonde-du-malaise-syrien-est-la-mevente-des-textiles_2048026_1819218.html,1950.0,frère,Positive,0.9746454954147339
On affirme qu il a trouvé asile chez son autre beau frère Ibrahim Alussi Jusque récemment ministre d Irak à Damas,https://www.lemonde.fr/archives/article/1950/01/31/ii-la-cause-profonde-du-malaise-syrien-est-la-mevente-des-textiles_2048026_1819218.html,1950.0,frère,Positive,0.980682373046875
beau frère de M,https://www.lemonde.fr/archives/article/1950/02/01/le-gang-des-j-3-de-valence-comparaitre-jeudi-devant-les-assises-de-la-drome_2040187_1819218.html,1950.0,frère,Positive,0.9982008934020996
Jacques Grève savait en effet que son beau frère était porteur ce soir là d une somme importante,https://www.lemonde.fr/archives/article/1950/02/01/le-gang-des-j-3-de-valence-comparaitre-jeudi-devant-les-assises-de-la-drome_2040187_1819218.html,1950.0,frère,Positive,0.7642101645469666
Vernier Paillez demi frère de Joas Da Silva Ramos,https://www.lemonde.fr/archives/article/1950/02/02/le-juge-procede-aujourd-hui-a-une-serie-d-auditions_2039859_1819218.html,1950.0,frère,Positive,0.8973124623298645
Me Fabre rappelle les bienfaits dont l accabla la victime son propre beau frère et précise qu après l assassinat de M,https://www.lemonde.fr/archives/article/1950/02/03/le-gang-des-j-3-fait-triste-contenance-devant-la-cour-d-assises-de-la-drome_2040348_1819218.html,1950.0,frère,Positive,0.9526652097702026
Tchervenkov qui est le beau frère de feu Georges Dlmitrov était considéré comme étant le maître réel de la Bulgarie dès avant le décès de G,https://www.lemonde.fr/archives/article/1950/02/03/valko-tchervenkov-succede-a-kolarov-a-la-tete-du-gouvernement-bulgare_2039837_1819218.html,1950.0,frère,Positive,0.9978041052818298
Avec un tel programme c est un frère ennemi qui se dresse ainsi près du parti tory,https://www.lemonde.fr/archives/article/1950/02/08/clement-davies-le-troisieme-homme_2040058_1819218.html,1950.0,frère,Negative,0.9931364059448242
Les sonorités du Martenot s élèvent des profondeurs de l abîme jusqu au sommet de l aigu passent par tous les effets que l on demande ordinairement aux cordes et aux bois staccato trilles vibrato legato il n est rien qui semble impossible à Mme Ginette Martenot grande virtuose de l instrument inventé par son frère et dont elle joue en artiste accomplie,https://www.lemonde.fr/archives/article/1950/02/08/premieres-auditions-de-maxime-belliard-jean-rivier-et-andre-jolivet_2039406_1819218.html,1950.0,frère,Positive,0.9917107820510864
Le beau frère de Giuliano qui a réussi il y,https://www.lemonde.fr/archives/article/1950/02/10/giuliano-partirait-pour-l-amerique_2039265_1819218.html,1950.0,frère,Positive,0.9921398758888245
Marius Nessi père de la fillette et frère de Mme Nessi est indemne,https://www.lemonde.fr/archives/article/1950/02/13/a-tignes-et-a-araches_2040222_1819218.html,1950.0,frère,Neutral,0.6135063767433167
Pollone propriétaire d un chalet hôtel et son beau frère M,https://www.lemonde.fr/archives/article/1950/02/14/faits-divers_2039227_1819218.html,1950.0,frère,Positive,0.9970441460609436
avait cependant signalé qu une partie de la légende de l ascension de Mahomet au paradis avait été traduite au temps de Dante par le frère prêcheur Ricoldo de Monte Croce dans son Contra legem Saracenorum,https://www.lemonde.fr/archives/article/1951/01/04/l-eschiele-mahomet_2067690_1819218.html,1951.0,frère,Neutral,0.588161826133728
Louis Aletti ancien directeur de l hôtel d Alger ancien administrateur de la Société des grands hôtels de Vichy et propre frère de M,https://www.lemonde.fr/archives/article/1951/01/06/les-dirigeants-de-la-societe-des-grands-hotels-de-vichy-contre-attaquent_2067420_1819218.html,1951.0,frère,Neutral,0.6978342533111572
William Stanley né en 1561 devenu par la mort de son frère aîné comte de Derby avait après son temps d Oxford effectué de nombreux voyages sur le continent visité la France l Italie séjourné à Rome et à la petite cour de Navarre,https://www.lemonde.fr/archives/article/1951/01/10/le-vrai-shakespeare_2068162_1819218.html,1951.0,frère,Neutral,0.5377833843231201
Le malheur est que le château où étaient conservés ses papiers ayant brûlé au milieu du XVIIe siècle aucun manuscrit n est demeuré qui eût renseigné sur la nature de son talent et mis sur la piste de sa collaboration avec le nommé Shakespeare un des comédiens de la troupe de théâtre patronnée par le frère aîné de Stanley,https://www.lemonde.fr/archives/article/1951/01/10/le-vrai-shakespeare_2068162_1819218.html,1951.0,frère,Negative,0.6134238839149475
En 1591 William Stanley se fiançait avec Elizabeth de Vere fille du comte d Oxford mais sa situation médiocre de cadet l obligea de marquer le pas avant de pouvoir prétendre raisonnablement à une telle union qui ne fut consommée que lorsque Stanley devint le chef de la famille après la disparition de son frère,https://www.lemonde.fr/archives/article/1951/01/10/le-vrai-shakespeare_2068162_1819218.html,1951.0,frère,Negative,0.9303415417671204
de passage à Paris avec son frère Domingo,https://www.lemonde.fr/archives/article/1951/01/12/le-club-taurin-de-paris-a-recu-le-premier-matador-d-espagne_2066926_1819218.html,1951.0,frère,Positive,0.5054420828819275
La 9e chambre de la cour réformant cette décision a infligé dix huit mois de prison et 2 millions de francs d amende à Henri Maatalani un an de prison et 1 million d amende à son frère six mois avec sursis et 100 000 francs d amende à Riand un an et 200 000 francs d amende à Coustillas,https://www.lemonde.fr/archives/article/1951/01/12/relaxes-par-le-tribunal-correctionnel-les-trafiquants-d-or-d-orly-sont-severement-condamnes-en-appel_2068079_1819218.html,1951.0,frère,Negative,0.9621500372886658
Samedi et dimanche se tirera a Huyghens la cinquième épreuve du challenge Duvai généreusement doté de prix magnifiques par le frère de l escrimeur abattu en plein ciel en 1940,https://www.lemonde.fr/archives/article/1951/01/13/le-challenge-duval-prelude-a-la-coupe-gaudini_2066842_1819218.html,1951.0,frère,Positive,0.5567800998687744
A ma grande confusion le toréro était à ma droite à ma gauche la délicieuse partenaire de François Périer dans Bobosse Lucienne Granier qui a connu Luis Miguel à Madrid et me servit d interprète puis répartis au hasard Domingo Dominguin le frère aîné notre excellent confrère Miguel Guerra deux journalistes mexicains etc,https://www.lemonde.fr/archives/article/1951/01/13/luis-miguel-dominguin-le-successeur-de-manolete-va-se-preparer-a-une-rentree-spectaculaire-dans-les-arenes-d-espagne_3140622_1819218.html,1951.0,"frère', 'frère","Positive', 'Positive","0.8756376504898071, 0.8756376504898071"
Fils et frère de toreros de famille riche qui sait diriger ses affaires,https://www.lemonde.fr/archives/article/1951/01/13/luis-miguel-dominguin-le-successeur-de-manolete-va-se-preparer-a-une-rentree-spectaculaire-dans-les-arenes-d-espagne_3140622_1819218.html,1951.0,frère,Positive,0.8491514921188354
Avec mon frère Pepe,https://www.lemonde.fr/archives/article/1951/01/13/luis-miguel-dominguin-le-successeur-de-manolete-va-se-preparer-a-une-rentree-spectaculaire-dans-les-arenes-d-espagne_3140622_1819218.html,1951.0,frère,Positive,0.7365332841873169
Le trouble observé peut être enfin psychogène c est à dire engendré par l esprit lui même l enfant par exemple s interdisant de façon plus ou moins inconsciente tout effort mental parce qu un petit frère est né dans la maison et qu il ne se console pas d avoir à partager la tendresse maternelle c est au psychanalyste qu il faut alors s adresser,https://www.lemonde.fr/archives/article/1951/01/18/pedagogie-et-psychanalyse_2067790_1819218.html,1951.0,frère,Negative,0.9932841062545776
La silhouette du frère cadet de l adolescente imprudente est fort drôlement campée en quelques traits savoureux il tape du poing centre les cloisons lorsqu on trouble son sommeil I need my rest dit il egoïstement avant de réclamer le droit de dévorer du chocolat,https://www.lemonde.fr/archives/article/1951/01/24/les-desempares-l-obsede_2067226_1819218.html,1951.0,frère,Negative,0.8695985674858093
Il s étend entre son frère et moi,https://www.lemonde.fr/archives/article/1951/01/25/ii-un-fantastique-ballet-de-descentes-et-de-montees_2068316_1819218.html,1951.0,frère,Neutral,0.8572273850440979
Alors lui qui avait observé pendant l occupation une position attentiste à qui il n y avait rien à reprocher il a appris que son beau frère Robert Brasillach avait été fusillé,https://www.lemonde.fr/archives/article/1951/01/25/le-substitut-gonet-a-prononce-un-requisitoire-tres-modere_2066565_1819218.html,1951.0,frère,Negative,0.7402408719062805
Une ancienne prostituée que le frère de la victime avait connue dans une maison close de Morlaix,https://www.lemonde.fr/archives/article/1951/01/26/aux-assises-d-eure-et-loir-les-debats-revelent-les-responsabilites-morales-de-la-mere-de-jacques-de-kerviller_2068309_1819218.html,1951.0,frère,Negative,0.9731987118721008
Savoir ménager sa monture Maintenant que les voitures commencent à se ressentir des fatigues du voyage ce genre de mésaventure paraît devoir se produire plus fréquemment et c est ainsi que Fort Lamy a vu en vingt quatre heures une 4 CV portée par son grand frère de 5 tonnes et une jeep revenir en remorque le lendemain de son départ pour Fort Archambault,https://www.lemonde.fr/archives/article/1951/01/27/fort-lamy-point-de-convergence-de-fous-les-itineraires-sahariens_2067603_1819218.html,1951.0,frère,Negative,0.7041003108024597
Parmi les libérés figure encore l ex général d aviation Wilhelm Speidel frère du général Hans Speidel qui participe actuellement aux conversations militaires germano alliées à Bonn,https://www.lemonde.fr/archives/article/1951/02/01/alfred-krupp-est-libere_2065903_1819218.html,1951.0,frère,Positive,0.8802312016487122
Francisco qui a pu être arrêté cette nuit est actuellement interrogé à la police judiciaire son frère a réussi à s enfuir,https://www.lemonde.fr/archives/article/1951/02/02/un-second-bandit-est-arrete-un-troisieme-est-identifie_2065252_1819218.html,1951.0,frère,Negative,0.9798195958137512
