Text,link,year,aspect,sentiment,prob
de Rothschild frères agissant pour le compte d A,https://www.lemonde.fr/archives/article/1967/01/28/la-societe-americaine-a-h-robins-fait-une-offre-publique-d-achat-de-quatre-vingt-mille-actions-des-parfums-caron_2609205_1819218.html,1967.0,frères,Neutral,0.9393161535263062
Une part doit être faite également aux formes intermédiaires ou occasionnelles de groupement celles qui réunissent un père et ses fils c était le cas pour 79 groupements ou des frères entre ceux 84 groupements,https://www.lemonde.fr/archives/article/1967/02/03/cinq-cents-cultivateurs-gerent-en-commun-leurs-exploitations_2622099_1819218.html,1967.0,frères,Neutral,0.9322220683097839
Kiesinger l absence de pression pour retenir les partis frères sur la voie d une normalisation des relations avec Bonn l acceptation entrevue d une participation de l Allemagne fédérale au comité McNamara de planification nucléaire ont fait fâcheuse impression à Varsovie,https://www.lemonde.fr/archives/article/1967/02/06/la-crainte-de-l-isolement-semble-apparaitre-en-pologne_2622054_1819218.html,1967.0,frères,Negative,0.598418653011322
Quant aux frères Camberabero il y a beau temps que Jean Prat et certains autres sélectionneurs sont convaincus de leur grand talent,https://www.lemonde.fr/archives/article/1967/02/07/du-nouveau-en-equipe-de-france-gachassin-a-l-arriere-les-camberabero-en-demis_2623013_1819218.html,1967.0,frères,Positive,0.9210314750671387
Suivant une légende sottement répandue certains prétendaient que les deux frères ne pouvaient pas être sélectionnés l un sans l autre,https://www.lemonde.fr/archives/article/1967/02/07/du-nouveau-en-equipe-de-france-gachassin-a-l-arriere-les-camberabero-en-demis_2623013_1819218.html,1967.0,frères,Negative,0.6589157581329346
Voilà levé l ostracisme dont les deux frères étaient frappés depuis une dizaine d années qu ils sont candidats à l équipe de France,https://www.lemonde.fr/archives/article/1967/02/07/du-nouveau-en-equipe-de-france-gachassin-a-l-arriere-les-camberabero-en-demis_2623013_1819218.html,1967.0,frères,Positive,0.8335027098655701
C était le cas des frères Saussez Bernard vingt sept ans et Fabrice vingt ans et de leur complice Gabriel Potier trente quatre ans,https://www.lemonde.fr/archives/article/1967/02/10/les-vols-de-chequiers_2622533_1819218.html,1967.0,frères,Neutral,0.9509294629096985
Le professeur Ernesto Rossi s était lancé à Florence dans l opposition au fascisme dès ses débuts et il avait créé le premier journal clandestin avec les frères Rosselli et Gaetano Salve mini,https://www.lemonde.fr/archives/article/1967/02/11/mort-d-ernesto-rossi-antifasciste-de-la-premiere-heure_2621991_1819218.html,1967.0,frères,Positive,0.4990360140800476
Pour l automne prochain est prévue l installation d une cimenterie la société dont le chef de file est le groupe Lambert frères s est réservé une superficie de 40 hectares en bordure du futur canal maritime au sud est de l usine Renault,https://www.lemonde.fr/archives/article/1967/02/22/trois-nouveaux-ensembles-industriels-vont-s-installer-dans-le-port-du-havre_2621608_1819218.html,1967.0,frères,Neutral,0.8927351236343384
On affirme que la Jordanie aura tout fait pour semer la discorde au sein de la Ligue arabe et pour consacrer les dissensions entre les États frères,https://www.lemonde.fr/archives/article/1967/03/01/la-decision-jordanienne-risque-de-compromettre-les-efforts-de-la-ligue-arabe_2614602_1819218.html,1967.0,frères,Negative,0.7928895354270935
Sauf dépression profonde de l activité dans l Europe industrielle on peut s attendre qu une part seulement de la main d œuvre étrangère flottante quitte les pays où elle travaille il est probable aussi que le départ de quantité de frères ou de cousins qui au delà des Pyrénées et des Alpes n attendent qu un signal pour tenter l aventure sera différé ou supprimé,https://www.lemonde.fr/archives/article/1967/03/06/retour-aux-douars-d-origine_2615660_1819218.html,1967.0,frères,Negative,0.9699116945266724
Parallèlement le Raïs a fait libérer un millier de frères musulmans dont l organisation clandestine avait maintes fois tenté de l assassiner,https://www.lemonde.fr/archives/article/1968/01/01/v-le-repli_2613842_1819218.html,1968.0,frères,Positive,0.8699646592140198
C est plutôt dans le camp conservateur notamment parmi les frères musulmans les seuls jusqu ici à entretenir une organisation clandestine que l on peut offrir une formule de rechange,https://www.lemonde.fr/archives/article/1968/01/01/v-le-repli_2613842_1819218.html,1968.0,frères,Negative,0.6640641689300537
Ottini et Mattiya Kambona sont les deux jeunes frères d Oscar Kambona ancien ministre de l administration régionale qui vit à Londres après s être enfui de Tanzanie,https://www.lemonde.fr/archives/article/1968/01/02/arrestation-de-trois-personnalites-politiques_2511647_1819218.html,1968.0,frères,Positive,0.8882650136947632
Le sort du Cachemire n est pour lui qu un petit problème car son but véritable consiste à réconcilier les frères ennemis de l Inde et du Pakistan,https://www.lemonde.fr/archives/article/1968/01/04/le-cheikh-abdullah-du-cachemire-a-ete-salue-par-le-president-hussein-et-mme-gandhi_2513074_1819218.html,1968.0,frères,Negative,0.7755501866340637
Il a ajouté qu il se refusait à faire passer devant les tribunaux algériens des hommes qui avaient été des frères durant la lutte de libération afin de leur éviter une condamnation infamante,https://www.lemonde.fr/archives/article/1968/01/04/le-ministre-de-la-justice-reaffirme-que-m-ben-bella-est-en-bonne-sante_2512344_1819218.html,1968.0,frères,Positive,0.7626563310623169
A Montpellier une fillette de quatre ans Marina Santiago Arriba qui avec ses frères et sœurs ainsi que ses parents vivait dans une vieille fourgonnette stationnée dans le quartier gitan de Celleneuve a péri brûlée vive mardi matin dans l incendie du véhicule,https://www.lemonde.fr/archives/article/1968/01/04/trois-morts_2512513_1819218.html,1968.0,frères,Neutral,0.9883043766021729
Cette dernière lui a été apportée en 1965 par Saint frères à la suite de l absorption de la branche tapis de cette entreprise,https://www.lemonde.fr/archives/article/1968/01/06/la-societe-saint-freres-fait-une-offre-publique-d-achat-d-actions-de-la-manufacture-francaise-de-tapis-et-couvertures_2513069_1819218.html,1968.0,frères,Neutral,0.6495363712310791
La société Saint frères dans ses neuf usines situées dans le Nord assure 45 de la production française dans la branche toiles de jute et 20 dans le secteur corderie,https://www.lemonde.fr/archives/article/1968/01/06/la-societe-saint-freres-fait-une-offre-publique-d-achat-d-actions-de-la-manufacture-francaise-de-tapis-et-couvertures_2513069_1819218.html,1968.0,frères,Neutral,0.5653151869773865
Le capital de Saint frères s élève à 64 928 550 francs,https://www.lemonde.fr/archives/article/1968/01/06/la-societe-saint-freres-fait-une-offre-publique-d-achat-d-actions-de-la-manufacture-francaise-de-tapis-et-couvertures_2513069_1819218.html,1968.0,frères,Neutral,0.7364264726638794
C est également le seul match que les deux frères Camberabero n aient pas disputé Avec les demis voultains la France s est classée première du tournoi international après avoir battu l Angleterre le Pays de Galles l Irlande et l Australie,https://www.lemonde.fr/archives/article/1968/01/10/a-quatre-jours-de-france-ecosse-les-selectionneurs-sont-toujours-dans-l-incertitude_2511510_1819218.html,1968.0,frères,Neutral,0.7576881647109985
Les deux frères seront ils titularisés de préférence à Mir et Maso,https://www.lemonde.fr/archives/article/1968/01/10/a-quatre-jours-de-france-ecosse-les-selectionneurs-sont-toujours-dans-l-incertitude_2511510_1819218.html,1968.0,frères,Neutral,0.4181438684463501
Samedi à Murrayfield le retour de Duprat et des frères Camberabero n a pas été très concluant mais celui de Cester en revanche a certainement aidé Spanghero à retrouver toute son efficacité et Dauga une partie de la sienne,https://www.lemonde.fr/archives/article/1968/01/16/la-victoire-de-l-equipe-de-france-n-a-pas-cache-bien-des-faiblesses_2513064_1819218.html,1968.0,frères,Neutral,0.5077054500579834
Il faisait partie de l ordre des frères mineurs,https://www.lemonde.fr/archives/article/1968/01/16/mort-de-mgr-lefevre-archeveque-de-rabat_2513279_1819218.html,1968.0,frères,Positive,0.7525743246078491
Ayant écarté les deux frères Camberabero qui avaient demandé à ne pas être retenus sauf besoin impératif les sélectionneurs ont fait glisser le trois quarts centre Maso à l ouverture et le jeune Fouroux a été titularisé derrière la mêlée,https://www.lemonde.fr/archives/article/1968/01/19/gachassin-et-les-freres-camberabero-ne-joueront-pas-contre-l-irlande_2512461_1819218.html,1968.0,frères,Negative,0.8924446702003479
10 pour le préposé de la Socotec Delpierre 20 pour Tourry 10 pour chacun des frères Moinault,https://www.lemonde.fr/archives/article/1968/01/19/le-tribunal-souligne-dans-son-jugement-le-defaut-de-controle-et-de-coordination-des-travaux_2512228_1819218.html,1968.0,frères,Neutral,0.9677392840385437
Cependant dès 1894 les frères Pathé qui furent longtemps pour le cylindre avaient installé une usine à Chatou où travaillaient cent cinquante ouvriers,https://www.lemonde.fr/archives/article/1968/01/22/de-la-feuille-d-rsquo-etain-au-33-tours_2511526_1819218.html,1968.0,frères,Neutral,0.8517301082611084
En 1902 une compagnie américaine de Philadelphie enregistrait la voix de Caruso tandis que les frères Pathé enregistraient celle de S a r a h Bernhardt,https://www.lemonde.fr/archives/article/1968/01/22/de-la-feuille-d-rsquo-etain-au-33-tours_2511526_1819218.html,1968.0,frères,Neutral,0.9782667756080627
Mir et le rappel des frères Camberabero,https://www.lemonde.fr/archives/article/1968/01/23/j-h-mir-et-gachassin-joueront-contre-l-irlande_2511998_1819218.html,1968.0,frères,Positive,0.6396056413650513
Les clients les frères et sœurs sont nombreux des intellectuels bien sûr mais aussi des jeunes garçons et filles des ménagères de passage des hommes en bleu de travail qu on imaginerait plus facilement accoudés au bar voisin ou commentant une partie au billard d à côté,https://www.lemonde.fr/archives/article/1968/01/24/ii-penser-noir_2511653_1819218.html,1968.0,frères,Positive,0.687415361404419
2 Théoricien noir au début du siècle qui engageait ses frères de race à faire la preuve de leurs capacités dans les métiers manuels avant de réclamer l intégration,https://www.lemonde.fr/archives/article/1968/01/26/iv-des-emigrants-pas-comme-les-autres_2512624_1819218.html,1968.0,frères,Neutral,0.7422346472740173
Une fois de plus le président Johnson semble avoir choisi un délicat jeu de balance qui passe par une distinction subtile entre les Noirs bons citoyens et les mauvais Noirs qui ne songent qu à dévoyer leurs frères de race,https://www.lemonde.fr/archives/article/1968/01/27/v-la-tentation-de-la-repression_2512099_1819218.html,1968.0,frères,Negative,0.8855507373809814
Le jeu des frères Kennedy Dans le camp démocrate le président semble pour l instant n avoir rien à craindre,https://www.lemonde.fr/archives/article/1968/02/01/l-opposition-republicaine-parait-incapable-de-tirer-parti-des-multiples-difficultes-qu-affronte-m-johnson_2480396_1819218.html,1968.0,frères,Neutral,0.7297399044036865
Dans une telle hypothèse ces représentants entameront directement des négociations avec leurs frères du F,https://www.lemonde.fr/archives/article/1968/02/10/thieu-et-ky-ne-representent-qu-eux-memes-declarent-a-paris-deux-dirigeants-du-bouddhisme-vietnamien_2480439_1819218.html,1968.0,frères,Neutral,0.6400747895240784
Notre père a perdu ses trois frères et deux de ses enfants issus d un premier mariage lors de la première guerre de Palestine en 1949,https://www.lemonde.fr/archives/article/1968/02/10/vi-avec-ceux-qui-viennent-de-partir_2478627_1819218.html,1968.0,frères,Negative,0.9810402393341064
Suivent des chefs indiens des portraits de couples de frères et sœurs ou d enfants des maternités touchantes profils roides tuyautés sans souplesse visages de bois mais la dentelle ondulant autour des visages allège tout comme la fleur ou l oiseau que tient le bébé chauve,https://www.lemonde.fr/archives/article/1968/02/16/l-amerique-de-naguere-a-travers-ses-naifs_2478044_1819218.html,1968.0,frères,Neutral,0.8814474940299988
Non seulement on n y trouve plus ces avants qui furent longtemps inamovibles Dauga Gruarin et Cabanier mais aussi la composition de ses lignes arrière a été bouleversée avec le rappel des frères Camberabero en demis et le glissement de Gachassin au centre des trois quarts,https://www.lemonde.fr/archives/article/1968/02/16/le-bouleversement-du-quinze-de-france-des-innovations-justifiees_2480109_1819218.html,1968.0,frères,Negative,0.6049961447715759
En ce qui concerne les lignes arrière les sélectionneurs n ont pas eu tort de rappeler les frères Camberabero qui tous deux ont prouvé leur retour en forme notamment en dominant J,https://www.lemonde.fr/archives/article/1968/02/16/le-bouleversement-du-quinze-de-france-des-innovations-justifiees_2480109_1819218.html,1968.0,frères,Positive,0.9978364109992981
Naturellement on va douter que les frères Camberabero lui donnent de bonnes balles s ils jouent derrière un pack battu,https://www.lemonde.fr/archives/article/1968/02/16/le-bouleversement-du-quinze-de-france-des-innovations-justifiees_2480109_1819218.html,1968.0,frères,Negative,0.7262998223304749
Ils ont raté leur match à Grenoble alors que les frères Camberabero ont maintes fois prouvé qu ils sont aussi capables de sauver des avants en péril que de faire jouer des attaquants bien disposés,https://www.lemonde.fr/archives/article/1968/02/16/le-bouleversement-du-quinze-de-france-des-innovations-justifiees_2480109_1819218.html,1968.0,frères,Positive,0.9467717409133911
Le gouvernement a simplement voulu faire savoir qu étant données les lourdes responsabilités qui lui incombent à la suite de l agression de juin dernier pour l assistance aux pays arabes frères il se trouve dans l impossibilité jusqu à nouvel ordre d envisager de nouveaux prêts par l intermédiaire du Fonds,https://www.lemonde.fr/archives/article/1968/02/19/le-koweit-ralentit-son-aide-aux-pays-arabes_2480553_1819218.html,1968.0,frères,Neutral,0.867438018321991
entre 1961 et 1966 325 frères et 430 religieuses proies ont quitté leur congrégation en 1965 30 prêtres se sont démis de leur ministère en 1967 145 ont fait de même sans pour autant quitter l Église,https://www.lemonde.fr/archives/article/1969/01/01/redige-a-la-demande-de-l-episcopat-neerlandais-un-rapport-montre-que-l-eglise-catholique-est-aux-pays-bas-une-institution-puissante-mais-menacee-de-sclerose_2422262_1819218.html,1969.0,frères,Negative,0.5499141812324524
Dans quel autre pays aurait on assisté au spectacle insolite de policiers et manifestants sortant ensanglantés d une violente échauffourée et reprenant ensemble le soir de la grande manifestation du mois d octobre le traditionnel Chant des adieux Oui nous nous reverrons mes frères,https://www.lemonde.fr/archives/article/1969/01/01/revenons-a-l-heure-britannique_2423197_1819218.html,1969.0,frères,Positive,0.5031044483184814
Ce sont encore une fois des anecdotes qui parlent d elles mêmes l écolière de quatorze ans que son frère aîné veut forcer à se voiler les frères jouent encore volontiers dans l Algérie d aujourd hui le rôle sourcilleux de gardiens des traditions et qui préfère ne plus aller en classe plutôt que d accepter cette contrainte l étudiant en psychologie qui épouse une jeune élève de seconde et l oblige à quitter le lycée le père de famille qui vient à la consultation de nourrissons avec son fils et,https://www.lemonde.fr/archives/article/1969/01/04/ii-les-ambiguites-algeriennes_2421285_1819218.html,1969.0,frères,Negative,0.9027864933013916
Le nouveau code de la famille est resté à l état de projet ni la polygamie ni la répudiation n ont été officiellement abolies la femme n a toujours pas de majorité légale les filles continuent à hériter deux fois moins que leurs frères etc,https://www.lemonde.fr/archives/article/1969/01/04/ii-les-ambiguites-algeriennes_2421285_1819218.html,1969.0,frères,Negative,0.8547846078872681
Ainsi tout récemment lorsque la mixité a été décrétée pour l ensemble de l enseignement les éducateurs n ont pas eu trop de mal à faire admettre aux parents que puisque dans une même famille il y a des frères et des sœurs il est bien normal qu ils aillent à l école ensemble,https://www.lemonde.fr/archives/article/1969/01/06/iii-l-experience-sans-complexes-de-la-tunisie_2421597_1819218.html,1969.0,frères,Neutral,0.6384679079055786
En outre bien qu il ait laissé de leur vivant la vedette à ses frères il incarne à trente sept ans la jeunesse d un pays qui en désertant massivement le parti démocrate pour l émigration intérieure a contribué à la défaite de M,https://www.lemonde.fr/archives/article/1969/01/06/m-edward-kennedy-est-elu-leader-adjoint-de-la-majorite-democrate-au-senat_2422128_1819218.html,1969.0,frères,Positive,0.6100664734840393
Les frères Divard et quelques hommes qui avaient reçu mission de se rendre en forêt de La Motte dans les Côtes du Nord assurèrent la protection de l opération effectuée par six hommes en treillis,https://www.lemonde.fr/archives/article/1969/01/06/un-sergent-de-la-base-aerienne-de-tours-aurait-ete-a-la-tete-du-groupe-incarcere_2421376_1819218.html,1969.0,frères,Neutral,0.9455585479736328
Ainsi les Hongrois sont à la tête des réformateurs mais contrairement à certains pays frères ne se comportent pas en apologistes de l intégration à tout prix,https://www.lemonde.fr/archives/article/1969/01/07/moscou-voudrait-modifier-ses-relations-commerciales-avec-les-pays-de-l-est_2424384_1819218.html,1969.0,frères,Negative,0.4822584092617035
La succession alla à son fils cadet Nour ed din qui sut rapidement s imposer à ses frères et après le vain orage de la deuxième croisade établir son autorité sur Damas à la fin d avril 1 154,https://www.lemonde.fr/archives/article/1969/01/08/la-reaction-musulmane-face-aux-premieres-croisades_2422693_1819218.html,1969.0,frères,Neutral,0.8015007376670837
Grâce aux maigres salaires de sa mère et de ses frères aînés le jeune Sirhan fréquenta un moment l enseignement secondaire puis l abandonna pour réaliser un rêve que sa petite taille rendait possible il voulait être jockey L expérience se solda par un fiasco total et se termina en 1966 par une assez grave chute de cheval,https://www.lemonde.fr/archives/article/1969/01/08/ouverture-du-proces-de-sirhan-sirhan-meurtrier-de-robert-kennedy_2422815_1819218.html,1969.0,frères,Neutral,0.4587312936782837
Nous sommes dans l épreuve avec nos frères israéliens,https://www.lemonde.fr/archives/article/1969/01/11/le-grand-rabbin-de-france-nous-partageons-l-amertume-d-israel_2423754_1819218.html,1969.0,frères,Positive,0.9714979529380798
Elle avait suggéré que la signature d un traité par lequel les frères ennemis renonceraient à la guerre coïncide avec la mise en place d un mécanisme permettant à l Inde et au Pakistan de discuter tous leurs différends,https://www.lemonde.fr/archives/article/1969/01/13/l-inde-demande-au-pakistan-la-reprise-de-contacts-bilateraux_2421313_1819218.html,1969.0,frères,Neutral,0.4670303165912628
Fondée et longtemps dirigée par les frères Sarraut la Dépêche de Toulouse devenue après la guerre de 1939 1945 la Dépêche du Midi était jadis l organe quotidien du radicalisme,https://www.lemonde.fr/archives/article/1969/01/15/la-depeche-du-midi-ouvre-ses-colonnes-a-un-elu-gaulliste_2422026_1819218.html,1969.0,frères,Neutral,0.5213091373443604
C est ce que soutiennent ses deux frères dont l un est avocat et l autre notaire,https://www.lemonde.fr/archives/article/1969/01/17/bataille-civile-a-propos-du-testament-de-m-nachat-martini_2421775_1819218.html,1969.0,frères,Positive,0.8952632546424866
Nachat Martini leur frère était bien en possession d un titre de séjour régulier en France au moment où il rédigea son testament et que dès lors justiciable de la loi française ils ne pouvaient invoquer un droit d origine coutumière fondé sur des discriminations raciales ou religieuses que notre pays n admet pas les deux frères demandeurs abandonnèrent ce terrain de combat pour en choisir un autre qui pouvait paraître plus solide,https://www.lemonde.fr/archives/article/1969/01/17/bataille-civile-a-propos-du-testament-de-m-nachat-martini_2421775_1819218.html,1969.0,frères,Neutral,0.6601898074150085
C est donc en se fondant essentiellement sur cette condamnation et ses conséquences que Me Georges Izard avocat des frères Martini demandeurs a soutenu que M,https://www.lemonde.fr/archives/article/1969/01/17/bataille-civile-a-propos-du-testament-de-m-nachat-martini_2421775_1819218.html,1969.0,frères,Neutral,0.8390838503837585
Il n en a pas moins parlé de la violence de l attaque alors a t il dit que les frères de M,https://www.lemonde.fr/archives/article/1969/01/17/bataille-civile-a-propos-du-testament-de-m-nachat-martini_2421775_1819218.html,1969.0,frères,Negative,0.6554555296897888
Ces singuliers frères musulmans Et puis il y eut Me Jean Louis Tixier Vignancour,https://www.lemonde.fr/archives/article/1969/01/17/bataille-civile-a-propos-du-testament-de-m-nachat-martini_2421775_1819218.html,1969.0,frères,Positive,0.7953727841377258
D emblée le bouillant et pétulant avocat politique s en prit à ce qu il a appelé ces singuliers frères musulmans qui n hésitent pas à se servir de la condamnation infamante prononcée contre leur propre frère pour tenter de mettre la main sur son héritage,https://www.lemonde.fr/archives/article/1969/01/17/bataille-civile-a-propos-du-testament-de-m-nachat-martini_2421775_1819218.html,1969.0,frères,Negative,0.9833202958106995
Puisque le gouvernement français a délibérément choisi la voie du désarmement pour tenter de mettre fin au combat nous lui demandons solennellement de tout mettre en œuvre dans le même temps pour assurer la protection de nos frères d armes en incitant les grandes puissances à faire de même,https://www.lemonde.fr/archives/article/1969/01/17/le-comite-d-action-de-la-resistance-denonce-l-inspiration-nazie-du-terrorisme-arabe_2421668_1819218.html,1969.0,frères,Positive,0.9810248613357544
Les frères Stiner sont membres de l organisation noire U,https://www.lemonde.fr/archives/article/1969/01/22/los-angeles-l-un-des-auteurs-de-l-attentat-contre-deux-membres-des-pantheres-noires-s-est-rendu-a-la-police_2421737_1819218.html,1969.0,frères,Neutral,0.8164345026016235
La Grande Loge des maçons l ordre de l Etoile orientale d Afrique la Grande Loge des frères unis de l amitié se partagent une clientèle dont les préférences vont au rite écossais,https://www.lemonde.fr/archives/article/1969/01/23/soixante-noirs-revenus-d-amerique_2422190_1819218.html,1969.0,frères,Positive,0.9709877371788025
Karamé qui passe pour avoir la bénédiction de l armée devait sévir contre les fedayin le trio chrétien aurait réussi à démontrer en outre que le deuxième bureau ne nourrit pas comme il en a la réputation des sympathies désintéressées à l égard des peuples frères,https://www.lemonde.fr/archives/article/1969/01/24/le-gouvernement-libanais-adopterait-une-attitude-prudente-a-l-egard-des-palestiniens_2423220_1819218.html,1969.0,frères,Positive,0.5807520151138306
en même temps prendrait le risque d ouvrir à nouveau la grande crise du mouvement communiste international alors que les partis frères ont consenti à taire leurs querelles avec Moscou et à participer à la conférence mondiale fixée en mai,https://www.lemonde.fr/archives/article/1969/01/24/un-peuple-en-effervescence_2423941_1819218.html,1969.0,frères,Neutral,0.8224577903747559
De par leurs traditions spirituelles et leurs avatars historiques les juifs me paraissent être dans l ensemble plus portés à rechercher une solution humaine au drame des réfugiés que les politiciens des pays frères qui n ont fait jusqu à présent que l exploiter,https://www.lemonde.fr/archives/article/1969/01/25/un-conflit-messianique_2422870_1819218.html,1969.0,frères,Negative,0.9669349193572998
Et maintenant cette terre est pour nos frères un bagne sur lequel se profile l ombre des potences,https://www.lemonde.fr/archives/article/1969/01/29/m-eshkol-il-faut-sauver-ce-qui-reste-des-communautes-juives-dans-le-monde-arabe_2421163_1819218.html,1969.0,frères,Negative,0.979769229888916
Cette mesure pourrait favoriser une relance du dialogue brutalement interrompu entre les deux États frères en octobre dernier,https://www.lemonde.fr/archives/article/1969/01/31/optimisme-en-afrique-centrale_2421509_1819218.html,1969.0,frères,Positive,0.5903499126434326
Machines Bull Meci Labinal parmi les textiles Saint frères Dollfus Mieg et les coupons S,https://www.lemonde.fr/archives/article/1969/02/06/marche-mieux-dispose-nouvelle-hausse-de-l-or_2430963_1819218.html,1969.0,frères,Positive,0.7005730271339417
Kadar il est aisé de prévoir qu elles toucheront aux principaux sujets habituellement abordés dans ce genre de consultations la situation en Tchécoslovaquie la conférence des partis frères pour laquelle le prochain rendez vous préparatoire reste fixé au 17 mars à Moscou et le projet dont on parle toujours bien qu il tarde à se matérialiser d une réunion des chefs des pays membres du pacte de Varsovie,https://www.lemonde.fr/archives/article/1969/02/07/visite-d-amitie-de-m-kadar-a-moscou_2428213_1819218.html,1969.0,frères,Neutral,0.7227569222450256
