Text,date,link,year
"Ils professent que les réfugiés constituent pour la Bavière une "" humiliation insupportable "", qu'une femme bavaroise qui épouse un "" Prussien "" se commet plus gravement que lorsqu'elle s'abandonne dans les bras d'un nègre (on compte déjà, à Munich seulement, une bonne cinquantaine de petits moricauds nés des amours fugitives de femmes du clos avec des noirs de- l'occupation américaine) ; que l'occupation américaine est infiniment plus douce que ne le fut celle des Prussiens (",1948-01-05,https://www.lemonde.fr/archives/article/1948/01/05/munich-ou-la-nouvelle-babylone_1911892_1819218.html,1948
"Si l'on compte déjà, pour l'ensemble du territoire allemand, trente-quatre partis politiques constitués, il y en a, en Bavière seulement, dix-sept, auxquels il convient d'ajouter un mouvement créé par Mathilde Ludendorf, la femme du vaincu de la première guerre mondiale, celui-là même qui fut aussi l'inventeur de la terrible guerre totale mise en pratique par Hitler",1948-01-06,https://www.lemonde.fr/archives/article/1948/01/06/dans-munich-nouvelle-babylone-s-agitent-ligues-et-partis_1911551_1819218.html,1948
Sa femme est dans un état désespéré,1948-01-06,https://www.lemonde.fr/archives/article/1948/01/06/deux-bijoutiers-assassines-a-troyes_1912477_1819218.html,1948
", vient d'être victime d'un grave accident d'automobile consécutif à l'éclatement d'un pneu alors qu'il se rendait de Beni-Mellal à Marrakech en compagnie de sa femme et de deux autres personnes",1948-01-06,https://www.lemonde.fr/archives/article/1948/01/06/le-metteur-en-scene-leon-poirier-grievement-blesse-dans-un-accident-d-auto_1912436_1819218.html,1948
"Non sans avoir d'abord éprouvé les premiers émois de l'amour dans sa petite ville de province, devant un portrait de femme exotique exposé à la devanture d'un antiquaire",1948-01-06,https://www.lemonde.fr/archives/article/1948/01/06/salut-au-kentucky_1912364_1819218.html,1948
"Ayant fait la connaissance du modèle, femme légitime de l'artiste qui l'a ramenée du Brésil, le coquebin (nommé Wilfrid Darne) en sera pour ses frais d'imagination et de timidité, et, ayant légèrement conclu que cette Agnès n'était pas pour lui, il trouvera des consolations d'expérience à Paris, dans les milieux bohèmes où le conduit sa fantaisie, "" escam quærens """,1948-01-06,https://www.lemonde.fr/archives/article/1948/01/06/salut-au-kentucky_1912364_1819218.html,1948
"Mais il ne le sera pas longtemps, car, la guerre ayant éclaté, Wilfrid est emporté dans le torrent de la débâcle (celle de 1870), et les hasards de la bataille le remettront un moment, entre l'évacuation d'un village et sa reprise, en face de cette belle Catherine : d'ailleurs pour apprendre sa mort émouvante, la jeune femme ayant été tuée d'un coup de sabre par un officier allemand",1948-01-06,https://www.lemonde.fr/archives/article/1948/01/06/salut-au-kentucky_1912364_1819218.html,1948
"Entre temps, hommages rendus ou tentés à quelques belles de passage, occasion de portraits savoureux, Wilfrid retrouvera la femme de sa vie, Catherine, qu'il croyait depuis longtemps morte; mais il y avait erreur sur la personne, c'était une autre qui avait été massacrée par le soudard teuton, lequel se trouve être aussi le professeur de musique wagnérien",1948-01-06,https://www.lemonde.fr/archives/article/1948/01/06/salut-au-kentucky_1912364_1819218.html,1948
"Henri Heine aimait "" aussi "" des femmes peintes, et Nerval des personnes qui n'existaient pas",1948-01-06,https://www.lemonde.fr/archives/article/1948/01/06/salut-au-kentucky_1912364_1819218.html,1948
"On se souvient de cet "" uppercut "" que nous assena Citizen Kane, ses éclairages contrastés, les photos profondes et belles d'une caméra douée d'ubiquité enregistrant avec une égale précision les premiers et les arrière-plans, enchaînant champs et contre-champs; on se souvient aussi, et plus encore peut-être que de ces recherches techniques, de quelques inventions géniales : cette introduction qui projetait toute la vie de Kane en quelques images de magazine filmé, l'étonnant visage d'une femme défaite, un envol criard de coq aux plumes hérissées",1948-01-07,https://www.lemonde.fr/archives/article/1948/01/07/la-dame-de-shanghai_1912001_1819218.html,1948
"Les villageois enrichis, et l'Espérance, "" la femme en vert "", appelant en vain la paix sur la place de la Concorde",1948-01-07,https://www.lemonde.fr/archives/article/1948/01/07/la-revue-de-rip-au-theatre-de-l-etoile_1912353_1819218.html,1948
"Les personnages : Joseph Coste, un vieux paysan riche, honorable et considéré ; son fils, Albert, quarante ans, très épris de sa femme, Etiennette ; la belle-mère et la belle-sœur, qui ne pardonnent pas à Etiennette ses mœurs légères et son lourd passé",1948-01-09,https://www.lemonde.fr/archives/article/1948/01/09/le-drame-du-mas-d-aragon-garde-son-mystere_1912016_1819218.html,1948
"Selon lui, la jeune femme est montée pour l'assassiner dans sa chambre où il faisait la sieste, et il s'est blessé en lui arrachant le fusil",1948-01-09,https://www.lemonde.fr/archives/article/1948/01/09/le-drame-du-mas-d-aragon-garde-son-mystere_1912016_1819218.html,1948
Mais il n'est aucunement prouvé qu'il ne s'est pas volontairement blessé lui-même pour expliquer l'histoire du fusil arraché à la jeune femme,1948-01-09,https://www.lemonde.fr/archives/article/1948/01/09/le-drame-du-mas-d-aragon-garde-son-mystere_1912016_1819218.html,1948
Le fait est que la femme et la fille du beau-père n'oubliaient pas que sa jolie bru avait eu avec l'occupant des relations au sujet desquelles la chambre civique avait ouvert une instruction,1948-01-09,https://www.lemonde.fr/archives/article/1948/01/09/le-drame-du-mas-d-aragon-garde-son-mystere_1912016_1819218.html,1948
"L'accusé, sa femme, ses enfants, tiraillés entre des sentiments et des intérêts divers, se composent des attitudes; derrière leurs traits rudes, leurs visages impénétrables, on cherche en vain à saisir le signe qui permettrait de classer le crime dans une catégorie toute faite",1948-01-10,https://www.lemonde.fr/archives/article/1948/01/10/aujourd-hui-verdict-dans-l-affaire-du-mas-d-aragon_1912686_1819218.html,1948
" Quant à l'ambassadrice, si l'on ne nous a pas affirmé qu'elle sacrifierait à la tradition en rendant aux magasins et aux couturiers parisiens la visite dont toute femme rêve, on ne nous a pas non plus assuré du contraire",1948-01-10,https://www.lemonde.fr/archives/article/1948/01/10/premiere-journee-parisienne-de-sir-oliver-harvey_1911555_1819218.html,1948
"J'ai été cet homme, cette femme, j'ai stationné des heures sur le débarcadère d'Auckland",1948-01-12,https://www.lemonde.fr/archives/article/1948/01/12/les-preludes-de-katherine-mansfield_1911373_1819218.html,1948
Je les relie à deux souvenirs qui sont aussi nets dans la mémoire de ma femme que dans la mienne,1948-01-16,https://www.lemonde.fr/archives/article/1948/01/16/mm-leon-blum-et-paul-reynaud-nous-parlent-des-documents-de-nuremberg-tous-deux-pensaient-qu-ils-subiraient-le-sort-de-georges-mandel_3037029_1819218.html,1948
"Il s'agit d'une anomalie anatomique ou fonctionnelle, soit du mari, soit de la femme",1948-01-17,https://www.lemonde.fr/archives/article/1948/01/17/la-fecondation-artificielle_1911934_1819218.html,1948
", les lignes suivantes : "" L'Église n'a pas attendu les sexologues contemporains pour savoir que l'instinct sexuel était un instinct social, et pour elle l'acte sexuel complet n'est permis que dans l'union charnelle entre mari et femme, étant bien entendu d'autre part que l'on doit laisser à ce rapprochement toutes les chances de fécondité qu'il peut avoir",1948-01-17,https://www.lemonde.fr/archives/article/1948/01/17/la-fecondation-artificielle_1911934_1819218.html,1948
"Au point de vue technique, la femme doit être fonctionnellement et anatomiquement normale",1948-01-17,https://www.lemonde.fr/archives/article/1948/01/17/la-fecondation-artificielle_1911934_1819218.html,1948
"Les deux membres du ménage - l'homme qui en s'effaçant a reconnu son infériorité, et la femme qui a porté l'enfant - sont dans une position profondément différente",1948-01-17,https://www.lemonde.fr/archives/article/1948/01/17/la-fecondation-artificielle_1911934_1819218.html,1948
" Seymour et Weisman estiment que des précautions juridiques rigoureuses doivent être prises, tant pour protéger la mère et l'enfant, que le donneur lui-même et le médecin : consentement écrit de la femme et du mari, du donneur et même de la femme de celui-ci, stipulation particulière dégageant le donneur de toute responsabilité éventuelle etc",1948-01-17,https://www.lemonde.fr/archives/article/1948/01/17/la-fecondation-artificielle_1911934_1819218.html,1948
Ils conseillent même de faire accoucher la femme par un médecin qui ignorera que la grossesse est le résultat d'une fécondation artificielle,1948-01-17,https://www.lemonde.fr/archives/article/1948/01/17/la-fecondation-artificielle_1911934_1819218.html,1948
" A ces divers aspects de la question s'ajoute un élément tout différent, s'il s'agit d'une insémination artificielle demandée par une femme non mariée",1948-01-17,https://www.lemonde.fr/archives/article/1948/01/17/la-fecondation-artificielle_1911934_1819218.html,1948
"La maternité, en dehors du mariage, est rarement souhaitée par les femmes; c'est le moins qu'on en puisse dire, et la situation des enfants nés d'une fille-mère n'est généralement pas enviable",1948-01-17,https://www.lemonde.fr/archives/article/1948/01/17/la-fecondation-artificielle_1911934_1819218.html,1948
"A l'inverse, on n'imagine pas, sans évoquer un concours de circonstances exceptionnelles, le cas d'une femme ne trouvant à satisfaire son désir de maternité qu'au prix d'une fécondation artificielle",1948-01-17,https://www.lemonde.fr/archives/article/1948/01/17/la-fecondation-artificielle_1911934_1819218.html,1948
"Acquittement d'une femme qui avait étranglé son mari Avec la nouvelle procédure de la cour d'assises, qui fait délibérer ensemble les trois magistrats et les sept jurés tant sur la question de culpabilité que sur le taux de la peine, les acquittements sont très rares",1949-01-03,https://www.lemonde.fr/archives/article/1949/01/03/tribunaux_1922925_1819218.html,1949
 Il dormait et sa femme n'hésita pas à associer au crime son fils Robert,1949-01-03,https://www.lemonde.fr/archives/article/1949/01/03/tribunaux_1922925_1819218.html,1949
"Karsten Willumson, propriétaire du yacht, sa femme et ses trois enfants sont parmi les victimes",1949-01-03,https://www.lemonde.fr/archives/article/1949/01/03/un-yacht-sombre-au-large-des-cotes-espagnoles-quatorze-morts_3045587_1819218.html,1949
" Et Gontchar de décrire avec complaisance, pour ses lecteurs ukrainiens et russes, une famille de pauvres gens : la femme et les enfants sous-alimentés, le mari, qui, sombre et silencieux, serre entre ses dents une pipe vide",1949-01-03,https://www.lemonde.fr/archives/article/1949/01/03/une-trilogie-sur-l-armee-rouge_1922508_1819218.html,1949
" On se souvient de ses créations dans Marius, la Femme du boulanger, et nous le verrons vue dernière fois à l'écran dans Signal rouge et Branquignol",1949-01-06,https://www.lemonde.fr/archives/article/1949/01/06/marcel-maupi-est-mort_1923529_1819218.html,1949
Mais là comme partout ailleurs la femme se veut élégante,1949-01-06,https://www.lemonde.fr/archives/article/1949/01/06/tenues-hivernales_1922583_1819218.html,1949
"Hubert Delam, trente-cinq ans épicier à Saint-Ouen, a blesse grièvement de plusieurs coups de revolver sa femme Mathilde et tué un jeune homme de vingt-cinq ans, Roger Le Cam, chiffonnier, avec qui elle était partie il y a quelques jours en emportant les économies du ménage",1949-01-07,https://www.lemonde.fr/archives/article/1949/01/07/un-epicier-tue-son-rival_1922615_1819218.html,1949
Sa femme a été transportée à l'hôpital Beaujon,1949-01-07,https://www.lemonde.fr/archives/article/1949/01/07/un-epicier-tue-son-rival_1922615_1819218.html,1949
"Sa femme avait succombé en déportation; son fils, héroïque volontaire des Forces françaises libres, cillait périr tragiquement en Allemagne",1949-01-10,https://www.lemonde.fr/archives/article/1949/01/10/la-ive-republique-naissance-ou-avortement-d-un-regime_3045550_1819218.html,1949
"Il aura vu son élection chez les Goncourt, connaîtra ce soir à la Comédie-Française, salle Luxembourg, l'entrée au répertoire de la maison de l'Inconnue d'Arras, et très bientôt, au théâtre Saint-Georges, la reprise d'Une femme libre",1949-01-12,https://www.lemonde.fr/archives/article/1949/01/12/au-matin-de-l-inconnue-d-arras_1922856_1819218.html,1949
Un de nos lecteurs nous écrit à ce sujet : Il y a deux mois j'ai eu la douleur de perdre ma femme,1949-01-13,https://www.lemonde.fr/archives/article/1949/01/13/a-propos-d-ossements-humains-epars-dans-un-cimetiere-de-paris_1923090_1819218.html,1949
"Ils nous font souvenir d'une enquête dans un autre journal suisse, au cours de l'occupation, dont l'auteur citait le mot d'une femme qui se disait Française : "" Heureusement, déclarait cette pécore, heureusement nous avons été battus",1949-01-15,https://www.lemonde.fr/archives/article/1949/01/15/bons-conseils_1922986_1819218.html,1949
"; femme, garçonnet et fillette, sport (du 35 au 38), 700 francs (ancien prix, 790 fr",1949-01-19,https://www.lemonde.fr/archives/article/1949/01/19/de-nouveaux-appeles-de-baisse-des-prix-sont-publies_1923242_1819218.html,1949
"; femme ville (du 35 au 42), 600 francs (ancien prix, 615 fr",1949-01-19,https://www.lemonde.fr/archives/article/1949/01/19/de-nouveaux-appeles-de-baisse-des-prix-sont-publies_1923242_1819218.html,1949
", sous l'égide de laquelle il avait fondé avec Alexandre Ducoudray son organisation clandestine armée ; il avait ouvert son château de Lamballe à Roger Aurouet pour y dresse leurs plans de campagne, qu'il écrivit d'ailleurs de sa main : ancien résistant, chef de bataillon de réserve ; Le général Guillaudot, inspecteur de la gendarmerie, ancien déporte, qui semble avoir quitté le mouvement lorsqu'il le vit devenir trop compromettant, mais s'y intéressa d'abord de façon active (mis en liberté provisoire, il est actuellement en fuite) ; Roger Aurouet, dit de Mervelce, qui paraît avoir été l'animateur le plus dynamique ; c'st lui qui pour "" galvaniser "" les Bretons au jour J projetait un assaut contre la prison de Vannes afin de délivrer le maquisard Crété incarcéré pour meurtre d'une femme et d'un enfant",1949-01-19,https://www.lemonde.fr/archives/article/1949/01/19/le-proces-des-conjures-du-plan-bleu-s-ouvre-jeudi-en-correctionnelle_1923518_1819218.html,1949
"Pourquoi le vieux Malicroix a-t-il choisi pour successeur ce Mégremut, son petit-neveu par les femmes, à charge pour lui d'obéir à de si singulières prescriptions, jusqu'à changer de vie",1949-01-19,https://www.lemonde.fr/archives/article/1949/01/19/malicroix_1923315_1819218.html,1949
"Il y a eu autrefois un drame : Cornélius, jeune marié, emportant sa femme à travers le Rhône, sur un bac ; le filin rompu, le bac à la dérive est allé se briser sur un roc, et la femme a été noyée ; l'accident provoqué par quelque vengeance de voisin ; le passeur du bac compromis",1949-01-19,https://www.lemonde.fr/archives/article/1949/01/19/malicroix_1923315_1819218.html,1949
"C'est Martial de Mégremut qui raconte ces choses, mêlant à ces images, à ces impressions, ses insinuantes rêveries et ses infinitésimales analyses des transformations qui s'opèrent en lui, sensible à toutes influences, on ne sait quels dangers couvant sur l'île, aux nuits pleines d'allées et venues inquiétantes ; la peur montant ; une silhouette de femme entr'aperçue ; Balandran qui disparaît, puis ramené mourant par cette inconnue ; Martial épris d'elle, naturellement, et sauvé par elle dans un mauvais pas ; et le notaire Dromiols, à la cantonade, menant le Jeu",1949-01-19,https://www.lemonde.fr/archives/article/1949/01/19/malicroix_1923315_1819218.html,1949
"Le passeur criminel, qu'on avait cru mort dans l'accident voulu où périt la femme de Cornélius, est revenu tardivement dans le pays ; aveugle, il a repris le nouveau bac à traverser le Rhône, d'une rive à l'autre, au long d'un filin",1949-01-19,https://www.lemonde.fr/archives/article/1949/01/19/malicroix_1923315_1819218.html,1949
"Si ce n'est que le passeur mourra d'émotion au cours de la dérive, le livre finit bien : Mégremut maître de son île, ayant triomphé des obstacles, trouve le bonheur, l'amour et l'amitié l'attendant sur la berge avec la femme qui une fois déjà l'a sauvé et le fidèle Balandran",1949-01-19,https://www.lemonde.fr/archives/article/1949/01/19/malicroix_1923315_1819218.html,1949
" Le chauffeur, un certain Adrien, avait fait monter dans la voiture, dans Paris, une femme qu'il appelait Élise",1949-01-21,https://www.lemonde.fr/archives/article/1949/01/21/le-petit-alain-sadovic-a-ete-retrouve-sain-et-sauf_1923127_1819218.html,1949
L'homme et la femme conduisirent alors l'enfant vers la gare où ils prirent avec lui le train pour Paris,1949-01-21,https://www.lemonde.fr/archives/article/1949/01/21/le-petit-alain-sadovic-a-ete-retrouve-sain-et-sauf_1923127_1819218.html,1949
n'est pas un pays fermé (on entend une jeune femme rire dans la salle; le président la rappelle vertement à l'ordre),1949-01-26,https://www.lemonde.fr/archives/article/1949/01/26/les-premiers-temoins-sont-entendus-au-proces-kravchenko_1922665_1819218.html,1949
"La femme avait autant d'esprit que l'artiste de talent et d'intelligence ; et elle est morte supérieure à ce qu'elle a écrit, où elle n'a pas tout dit de ce qu'elle a su, ayant été de Mallarmé à Giraudoux et à Colette l'amie des plus hauts ou brillants esprits de ce temps",1949-01-26,https://www.lemonde.fr/archives/article/1949/01/26/souvenirs_1922279_1819218.html,1949
"Mais c'est une jeune femme de Musset, presque une fée",1949-01-27,https://www.lemonde.fr/archives/article/1949/01/27/on-reprend-bajazet-salle-richelieu_1923563_1819218.html,1949
"On rient d'apprendre de Moscou que Mme Gorlova, première femme de M",1949-01-28,https://www.lemonde.fr/archives/article/1949/01/28/la-premiere-femme-de-m-kravchenko-et-trois-autres-temoins-sovietiques-ont-demande-leurs-visas-pour-paris_1922668_1819218.html,1949
 La première femme de M,1949-01-28,https://www.lemonde.fr/archives/article/1949/01/28/la-premiere-femme-de-m-kravchenko-et-trois-autres-temoins-sovietiques-ont-demande-leurs-visas-pour-paris_1922668_1819218.html,1949
 Le drame et son bref épilogue s'étaient passés sous les yeux de sa femme,1949-01-31,https://www.lemonde.fr/archives/article/1949/01/31/jean-pierre-wimille-as-du-volant_1923092_1819218.html,1949
"Nous connaissons assez celle-ci - de son nom de jeune fille Nicole de La Freyssange, l'une des plus gracieuses championnes de ski de l'équipe de France d'avant guerre - pour être sûr que ces visions d'épouvante n'auront ébranlé son admirable vaillance que dans la mesure où la femme en elle, et la femme passionnément éprise de son mari, se sera laissée aller à sa douleur - devant laquelle il n'est pas un sportsman français qui ne s'incline",1949-01-31,https://www.lemonde.fr/archives/article/1949/01/31/jean-pierre-wimille-as-du-volant_1923092_1819218.html,1949
" Têtes brûlées à coup sûr que ces as du volant comme l'était jadis Bordino, comme le furent sur d'autres plans Nungesser ou Navarre, et hier Doret ou Détroyat, mais spectaculaires, créateurs du frisson dont vibrent les nerfs des foules et qui exercent une sorte de charme immédiat sur les femmes",1949-01-31,https://www.lemonde.fr/archives/article/1949/01/31/jean-pierre-wimille-as-du-volant_1923092_1819218.html,1949
"Loebl, qui a le malheur d'être apparenté par sa femme à une grande famille hollandaise, et qui a dirigé en maître absolu de nombreuses négociations commerciales avec l'étranger, serait accusé d'avoir laissé introduire, dans le traité de commerce hollando-tchécoslovaque du 10 mai dernier, des clauses désavantageuses pour la Tchécoslovaquie",1950-01-03,https://www.lemonde.fr/archives/article/1950/01/03/la-tchecoslovaquie-preparerait-son-proces-rajk_2048115_1819218.html,1950
"il y a le barman, son nègre, deux financiers qui jouent l'un à la baisse, l'autre à la hausse du blé, une femme lâchée, un philosophe pessimiste, deux mendiants",1950-01-03,https://www.lemonde.fr/archives/article/1950/01/03/le-deluge-au-studio-vendome_2048051_1819218.html,1950
" Quand le soleil brillera sur la ville, à peine humide et molle du déluge, le barman comptera les bouteilles vides et exigera des dollars; les mendiants seront jetés dehors, la femme ne sera plus réconciliée avec son amant, et pour le nègre recommenceront les coups de semelle aux reins",1950-01-03,https://www.lemonde.fr/archives/article/1950/01/03/le-deluge-au-studio-vendome_2048051_1819218.html,1950
" En février dernier Bernonville avait obtenu des autorités canadiennes l'autorisation de rester au Canada avec sa femme ri ses deux filles, au litre de réfugié politique",1950-01-03,https://www.lemonde.fr/archives/article/1950/01/03/nouvel-examen-du-cas-de-m-de-bernonville_2048760_1819218.html,1950
" Mme Suzan Folla, femme de M",1950-01-03,https://www.lemonde.fr/archives/article/1950/01/03/nouvelle-condamnation-a-mort_2047803_1819218.html,1950
"Da Silva Ramos ayant déclaré ne vouloir parler qu'en présence de son avocat, le juge Fa inculpé d'homicide sur la personne de sa femme et Fa placé sous mandat de dépôt",1950-01-04,https://www.lemonde.fr/archives/article/1950/01/04/joas-da-silva-ramos-est-ecroue-a-la-prison-de-bayonne_2049299_1819218.html,1950
"da Silva Ramos depuis la mort de son épouse, on fait état contre lui d'une lettre que la jeune femme aurait adressée, le jour de sa mort au cousin germain de son mari",1950-01-04,https://www.lemonde.fr/archives/article/1950/01/04/joas-da-silva-ramos-est-ecroue-a-la-prison-de-bayonne_2049299_1819218.html,1950
"LES femmes commencent à être un peu inquiètes : que restera-t-il de leurs cheveux si comme on le chuchote, le printemps décide de les raccourcir encore",1950-01-05,https://www.lemonde.fr/archives/article/1950/01/05/la-destinee-de-nos-cheveux_2049497_1819218.html,1950
" Rambaud, qui fait autorité en la matière, met en garde les femmes au seuil de cette nouvelle année sur le danger des coiffures exagérément raccourcies",1950-01-05,https://www.lemonde.fr/archives/article/1950/01/05/la-destinee-de-nos-cheveux_2049497_1819218.html,1950
 La majorité des femmes n'est pas oisive et ne peut passer ses journées chez le coiffeur,1950-01-05,https://www.lemonde.fr/archives/article/1950/01/05/la-destinee-de-nos-cheveux_2049497_1819218.html,1950
" Aubry, dont le maquillage "" œil de biche "" fut une des révélations de la saison, coiffe les femmes "" en brosse "", et les plus jolis visages n'ont rien à y gagner",1950-01-05,https://www.lemonde.fr/archives/article/1950/01/05/la-destinee-de-nos-cheveux_2049497_1819218.html,1950
Une femme mince ayant le cou long ne pourra être embellie par la même coiffure que celle qui aura la nuque épaisse ou inversement,1950-01-05,https://www.lemonde.fr/archives/article/1950/01/05/la-destinee-de-nos-cheveux_2049497_1819218.html,1950
"Une femme qui a une coupe bien faite doit pouvoir se coiffer sans épingles, d'un simple coup de brosse, nous affirme-t-il lui aussi",1950-01-05,https://www.lemonde.fr/archives/article/1950/01/05/la-destinee-de-nos-cheveux_2049497_1819218.html,1950
"J'ai reçu un télégramme de Mexico signé de Pilar Boves, la femme de Hernandez, ainsi conçu : "" Famille divisée",1950-01-07,https://www.lemonde.fr/archives/article/1950/01/07/le-triomphe-de-dolores_2048009_1819218.html,1950
Abandonner sa femme et ses enfants pour se marier de nouveau n'est pas considéré ici comme une chose très grave,1950-01-07,https://www.lemonde.fr/archives/article/1950/01/07/le-triomphe-de-dolores_2048009_1819218.html,1950
"Modesto, lui aussi, a abandonné sa femme et ses deux filles pour contracter un nouveau mariage",1950-01-07,https://www.lemonde.fr/archives/article/1950/01/07/le-triomphe-de-dolores_2048009_1819218.html,1950
Et Lister également a abandonné sa femme,1950-01-07,https://www.lemonde.fr/archives/article/1950/01/07/le-triomphe-de-dolores_2048009_1819218.html,1950
"Stepanov à ma droite, la femme aux cheveux blancs et a l'accent catalan à ma gauche, et devant moi, a coté du chauffeur, Leonid",1950-01-07,https://www.lemonde.fr/archives/article/1950/01/07/le-triomphe-de-dolores_2048009_1819218.html,1950
"Rentré dans ma chambre je pose sur la table les oranges et les bonbons que la-femme à cheveux blancs et à l'accent catalan a mis dans ma poche pour Esperanza, et je me couche",1950-01-07,https://www.lemonde.fr/archives/article/1950/01/07/le-triomphe-de-dolores_2048009_1819218.html,1950
"Da Silva Ramos n'aurait-il pas fait boire sa femme, pour pouvoir plus facilement l'empoisonner",1950-01-09,https://www.lemonde.fr/archives/article/1950/01/09/m-da-silva-ramos-proteste-contre-l-inculpation-de-meurtre-qui-lui-a-ete-notifiee-alors-que-le-crime-n-est-pas-etabli_2049408_1819218.html,1950
Le couple sans enfant disposant de deux salaires occupe une position privilégiée par rapport au ménage de deux ou trois enfants dans lequel la femme peut difficilement travailler,1950-01-09,https://www.lemonde.fr/archives/article/1950/01/09/minimum-vital_2048963_1819218.html,1950
