Text,link,year,aspect,sentiment,prob
Et les États arabes aussi qui manquent sinon du désir réel de venir en aide à leurs frères palestiniens du moins du sens de l organisation,https://www.lemonde.fr/archives/article/1949/02/18/a-la-treve-precaire-doit-succeder-une-paix-constructive-tout-depend-de-l-issue-des-negociations-de-rhodes_3046213_1819218.html,1949.0,frères,Negative,0.6067488193511963
Tran Van Huu a exprimé le vœu de la population du Sud Vietnam d être de nouveau unie à ses frères du Nord et du Centre dans le cadre historique de la communauté vietnamienne et sous l égide de S,https://www.lemonde.fr/archives/article/1949/02/18/bao-dai-affirme-qu-il-respectera-le-particularisme-cochinchinois-au-sein-du-vietnam-unifie_1936591_1819218.html,1949.0,frères,Positive,0.885982096195221
D aile à aile sa longueur est de 230 pieds distance sut laquelle les frères,https://www.lemonde.fr/archives/article/1949/03/05/un-geant-de-l-air-trop-onereux-le-brabazon-i_1920899_1819218.html,1949.0,frères,Positive,0.750898003578186
Kouznetsov dit il exprime par exemple une admiration exagérée pour les représentants typiques du cirque réactionnaire bourgeois que sont les frères Fratellini et en ne révélant pas le caractère bourgeois des clowneries occidentales il facilite l infiltration du cirque soviétique par les clowns occidentaux classiques,https://www.lemonde.fr/archives/article/1949/03/08/le-cirque-selon-la-doctrine-sovietique_1921771_1819218.html,1949.0,frères,Negative,0.9909891486167908
L Italie sera représentée par le champion olympique Cantone les frères Mangiarotti Mandruzzato Marini et Pavesi,https://www.lemonde.fr/archives/article/1949/03/14/la-coupe-molie-va-t-elle-rester-en-france_1920866_1819218.html,1949.0,frères,Positive,0.960834264755249
Elles forment un chœur dansant et pépiant qui s enfuit au palais du roi avec Poucet et ses frères elles s y gavent il est vrai de galantine et hument le piot jusqu à l ivresse,https://www.lemonde.fr/archives/article/1949/03/14/le-petit-poucet-au-palais-de-chaillot_1921102_1819218.html,1949.0,frères,Negative,0.9723600149154663
Des enfants perdus frères de ceux dont le cinéma nous faisait voir il y a peu la navrante et l extraordinaire existence volent des vêtements dans les vestiaires de dancings et de restaurants,https://www.lemonde.fr/archives/article/1949/03/16/ma-urs-et-caracteres-du-jour_1921426_1819218.html,1949.0,frères,Negative,0.9951512813568115
en allant à ces résistants Vanderputte a cherché à sortir de son isolement il a voulu être un homme parmi les autres hommes ses frères,https://www.lemonde.fr/archives/article/1949/03/16/ma-urs-et-caracteres-du-jour_1921426_1819218.html,1949.0,frères,Positive,0.9484654664993286
Les intéressés devront joindre à leur lettre les pièces justificatives bulletins de naissance des enfants bulletins de décès certificats de vie collective de frères et sœurs ou certificats de non remariage de la mère,https://www.lemonde.fr/archives/article/1949/03/22/les-exemptions-de-service-pour-les-jeunes-gens-de-la-classe-1949_1921530_1819218.html,1949.0,frères,Neutral,0.9736900925636292
Un caricaturiste le montrait récemment heureux apaisé dans un paysage où tous les êtres vivants le policeman le balayeur l homme d affaires le soldat jusqu au cheval du laitier lui ressemblaient comme des frères,https://www.lemonde.fr/archives/article/1949/03/22/visite-a-broadway_1921094_1819218.html,1949.0,frères,Positive,0.7149278521537781
Puis il reçut une suprême consécration à Lyon le 16 juillet suivant dans le couvent des dominicains de cette ville en présence de Philippe VI de Valois du nouveau dauphin et de l ancien qui veuf après 1346 et dégoûté du monde prit le lendemain même la robe blanche des frères prêcheurs,https://www.lemonde.fr/archives/article/1949/03/31/comment-humbert-ii-ceda-le-dauphine-a-la-france_1921456_1819218.html,1949.0,frères,Negative,0.7747042179107666
Mikhailov insista pour que les komsomols s appliquent davantage à jouer le rôle de grands frères auprès des pionniers garçons moins âgés que les komsomols,https://www.lemonde.fr/archives/article/1949/04/01/le-secretaire-des-komsomols-contre-la-religion_1932718_1819218.html,1949.0,frères,Positive,0.6859198808670044
aurait accès par des mers libres de glace à tous les océans sous la garantie de l organisation mondiale dont elle serait un des membres les plus importants qu elle pourrait se procurer sans restriction aucune les matières premières de toutes sortes c est d ailleurs ce qui se passe maintenant et que les Russes seraient partout accueillis comme des frères dans la grands famille du monde,https://www.lemonde.fr/archives/article/1949/04/02/m-churchill-declare-a-boston-la-guerre-n-est-pas-inevitable-l-ex-premier-anglais-accuse-les-treize-hommes-du-kremlin-de-viser-a-la-domination-du-monde_1932730_1819218.html,1949.0,frères,Positive,0.9943130016326904
Et dans la jeune génération nombre de nos bobby soxers du quartier Latin ont délaissé depuis longtemps les bergères romantiques de leurs grand mères pour les rag time épileptiques de leurs frères luthériens,https://www.lemonde.fr/archives/article/1949/04/07/l-exercice-physique-chez-la-femme_1934010_1819218.html,1949.0,frères,Negative,0.8186951279640198
Nous voulons parler de la pièce intitulée le Gouverneur de province dont les auteurs sont les frères Tour et L,https://www.lemonde.fr/archives/article/1949/04/07/la-rivalite-russo-americaine-en-allemagne_1933082_1819218.html,1949.0,frères,Neutral,0.8109133243560791
Malgré la consanguinité religieuse avec leurs frères musulmans de la péninsule hindoustane les peuples arabes avaient plutôt tendance autrefois à regarder vers Gandhi et son équipe considérés comme les véritables champions des nationalistes en rébellion contre les c impérialistes occidentaux,https://www.lemonde.fr/archives/article/1950/01/02/washington-examine-les-consequences-du-geste-indien_2048721_1819218.html,1950.0,frères,Neutral,0.5029372572898865
Il était alors en classe de septième et avec ses frères il se rendait chaque jour au lycée et en revenait dans un grand char à bancs bleu et jaune à la livrée royale que tout Paris connaissait bien,https://www.lemonde.fr/archives/article/1950/01/07/la-jeunesse-du-duc-d-aumale_2047847_1819218.html,1950.0,frères,Neutral,0.9200978875160217
En hiver on leur fait suivre les cours de gymnastique du fameux Amoros si à la mode à cette époque et Aumale comme ses frères doit chanter les complaintes qu Amoros a inventées et qui accompagnent chaque exercice,https://www.lemonde.fr/archives/article/1950/01/07/la-jeunesse-du-duc-d-aumale_2047847_1819218.html,1950.0,frères,Neutral,0.8029807806015015
Leur élévation sociale les séparait de leurs frères en religion et ils étaient amenés par exemple à envoyer leurs enfants non plus dans les collèges ou les universités catholiques mais dans les universités plus célèbres où ils pouvaient nouer des relations utiles pour leur avenir,https://www.lemonde.fr/archives/article/1950/01/12/iii-realite-sociale-et-realite-spirituelle_2048402_1819218.html,1950.0,frères,Negative,0.8266777396202087
A chaque recensement cette persistance de la mortalité masculine accusait un peu plus ce fléau méconnu qui sait prendre des aspects moins sombres que ses redoutables frères tuberculose taudis ignorance,https://www.lemonde.fr/archives/article/1950/01/13/la-population_2048656_1819218.html,1950.0,frères,Positive,0.8879823684692383
Il faut bien comprendre cependant que dans la situation présente un tel retour apparaîtra à l ensemble de nos frères séparés comme une chose impossible et qu ils ne pourraient accomplir qu en foulant aux pieds leurs convictions mêmes c est à dire en détruisant les conditions fondamentales d une adhésion loyale,https://www.lemonde.fr/archives/article/1950/01/21/l-annee-sainte-donne-a-la-semaine-de-l-unite-chretienne-un-interet-particulier-le-r-p-congar-nous-dit-son-optimisme_2049290_1819218.html,1950.0,frères,Negative,0.8938273191452026
Nos frères protestants de leur côté font de très considérables découvertes,https://www.lemonde.fr/archives/article/1950/01/21/l-annee-sainte-donne-a-la-semaine-de-l-unite-chretienne-un-interet-particulier-le-r-p-congar-nous-dit-son-optimisme_2049290_1819218.html,1950.0,frères,Positive,0.9971805810928345
Il le disait déjà en 1890 dans le Roman d un enfant et il le répète trente ans plus tard dans Prime Jeunesse Je prie ceux qui jetteront les yeux sur ce livre de l excusée comme la tentative désespérée d un de leurs frères qui va sombrer demain dans l abîme et voudrait au moins pour un temps sauver ses plus chers souvenirs,https://www.lemonde.fr/archives/article/1950/01/21/situation-de-loti_2048623_1819218.html,1950.0,frères,Negative,0.955637514591217
Le résultat fut que sur 114 sièges au sein de l Assemblée les populistes en détiennent 47 contre 10 aux frères musulmans et 40 aux indépendants,https://www.lemonde.fr/archives/article/1950/01/30/i-la-syrie-espere-mener-une-revolution-sans-guillotine_2049300_1819218.html,1950.0,frères,Neutral,0.570606529712677
On ne peut donc s étonner de l influence qu y détiennent les ulémas et les frères musulmans,https://www.lemonde.fr/archives/article/1950/01/30/i-la-syrie-espere-mener-une-revolution-sans-guillotine_2049300_1819218.html,1950.0,frères,Positive,0.9767852425575256
Qu il suffise de rappeler qu au lendemain des élections de 1947 les frères musulmans réclamaient l interdiction du port du short,https://www.lemonde.fr/archives/article/1950/01/30/i-la-syrie-espere-mener-une-revolution-sans-guillotine_2049300_1819218.html,1950.0,frères,Neutral,0.754999041557312
La destinée est curieuse de ce ministre modéré renié par ses frères et qui se voit à la tribune même décerner un brevet d homme de gauche pour avoir défendu obstinément l équilibre du budget et celui du Trésor contre ce qu il a un jour appelé les traites sur la lune,https://www.lemonde.fr/archives/article/1950/01/31/le-gouvernement-risquera-cinq-fois-son-existence-de-nouveaux-objectifs-s-offriront-ensuite-a-sa-majorite_3038742_1819218.html,1950.0,frères,Negative,0.9846959710121155
Les frères Amar eux viennent a Sfax de donner la millième des représentations de bienfaisante par lesquelles ils marquèrent leur passage tant en France qu à l étranger au cours de leurs grandes tournées de propagande,https://www.lemonde.fr/archives/article/1950/02/01/la-1-000eme-representation-de-bienfaisance-du-cirque-amar_2039632_1819218.html,1950.0,frères,Positive,0.9944331049919128
En apprenant hier la catastrophe de Paint Eloy les Mines les trois frères Amar ont en effet aussitôt décidé Alin de venir en aide aux familles des malheureuses victimes de prélever sur les recettes de la journée de dimanche une somme de 200 000 francs qu ils ont immédiatement adressée par chèque au maire de cette localité,https://www.lemonde.fr/archives/article/1950/02/01/la-1-000eme-representation-de-bienfaisance-du-cirque-amar_2039632_1819218.html,1950.0,frères,Neutral,0.955864429473877
Grandes et petites cités ont déjà pu apprécier la générosité des frères Amar,https://www.lemonde.fr/archives/article/1950/02/01/la-1-000eme-representation-de-bienfaisance-du-cirque-amar_2039632_1819218.html,1950.0,frères,Positive,0.9911386370658875
La petite commune d Aumont dont l un des frères est le maire n est pas la dernière à en connaître les effets il n est que d y entendre parler les enfants dont l admiration est sans bornes pour leurs grands bienfaiteurs,https://www.lemonde.fr/archives/article/1950/02/01/la-1-000eme-representation-de-bienfaisance-du-cirque-amar_2039632_1819218.html,1950.0,frères,Positive,0.8436483144760132
Roger Chatelet vingt trois ans et les frères Bressy ont été tués,https://www.lemonde.fr/archives/article/1950/02/07/faits-divers_2039581_1819218.html,1950.0,frères,Negative,0.9003400802612305
Nul ne doute que la réunion de vos pays à leurs frères comme vous le désirez élèvera la valeur des pays arabes et renforcera la Ligue qui cherche le bonheur de tous ses membres,https://www.lemonde.fr/archives/article/1950/02/07/nahas-pacha-envoie-ses-encouragements-a-messali-hadj_2040115_1819218.html,1950.0,frères,Positive,0.8651037812232971
Nous avons toutefois averti à plusieurs reprises les citadins nos frères que ces modes de propulsion essentiellement sportifs nécessitaient pas mal d entraînement ou d adresse de la part des usagers,https://www.lemonde.fr/archives/article/1950/02/08/telepheriques-et-monte-pentes_2039500_1819218.html,1950.0,frères,Negative,0.723390519618988
frères Jacques Jacques Cathy et Jacques Grello ont vraiment de rares trouvailles,https://www.lemonde.fr/archives/article/1950/02/09/caveaux-chantants_2039170_1819218.html,1950.0,frères,Positive,0.9972719550132751
Parce que cela nous permet de féliciter sans réserve les frères Bouglione du programme qu ils donnent au Cirque d Hiver,https://www.lemonde.fr/archives/article/1950/02/16/enfin-du-grand-cirque_2039496_1819218.html,1950.0,frères,Positive,0.8714011907577515
Pour finir on revient du coté de Saint Germain des Prés de Jacques Prévert et des frères Jacques atouts déjà éprouvés,https://www.lemonde.fr/archives/article/1950/02/21/varietes-en-tous-genres_2039879_1819218.html,1950.0,frères,Positive,0.9051592946052551
Sans s être donné le mot deux maisons d édition viennent de recueillir les meilleures pièces baladées depuis deux ou trois ans par les frères Jacques du théâtre Agnès Capri à l A,https://www.lemonde.fr/archives/article/1950/03/01/chansons-noires-chansons-roses_2052739_1819218.html,1950.0,frères,Positive,0.5538383722305298
La Boite à musique dont on connaît l effort dans le domaine classique inaugure une série de variétés par trois disques des frères Jacques d inspiration diverse,https://www.lemonde.fr/archives/article/1950/03/01/chansons-noires-chansons-roses_2052739_1819218.html,1950.0,frères,Positive,0.9905297160148621
Le goût des frères Jacques réussit à rendre leur fumet à des mélodies que l on aurait pu croire éventées sans remède,https://www.lemonde.fr/archives/article/1950/03/01/chansons-noires-chansons-roses_2052739_1819218.html,1950.0,frères,Positive,0.5050782561302185
C est dans l intelligence de la mise en scène musicale qu il faut chercher l essentiel du talent des frères Jacques,https://www.lemonde.fr/archives/article/1950/03/01/chansons-noires-chansons-roses_2052739_1819218.html,1950.0,frères,Positive,0.9967994689941406
Les syndicats communistes font appel à l unité d action en même temps que sur le plan politique le parti tend les bras aux frères ennemis du socialisme qu il vient de chercher à assommer proprement,https://www.lemonde.fr/archives/article/1950/03/01/debrayages-abusifs_2053029_1819218.html,1950.0,frères,Negative,0.9891113638877869
stipulant que les militaires remplissant actuellement les conditions pour être dispensés sur leur demande et qui n ont pas de frères puînés susceptibles de bénéficier de la dispense seront libérés au plus tard fin avril,https://www.lemonde.fr/archives/article/1950/03/04/l-assemblee-nationale-vote-le-projet-ne-loi-sur-l-appel-de-la-classe-1950_2051382_1819218.html,1950.0,frères,Negative,0.6534318923950195
Puis il refusa de saluer ses officiers car comme il le dit aujourd hui à la barre Jésus nous a dit que nous étions tous frères,https://www.lemonde.fr/archives/article/1950/03/04/l-objecteur-de-conscience-charles-meyer-est-condamne-a-deux-ans-de-prison_2051489_1819218.html,1950.0,frères,Positive,0.8517197370529175
Libéré avec l impératrice et ses frères et sœurs par le corps expéditionnaire du général Leclerc il a suivi sa mère quand elle s est installée au château de Thorenc près de Cannes en 1947 l empereur était à ce moment à Hong Kong,https://www.lemonde.fr/archives/article/1950/03/04/le-complot-a-ete-evente-et-le-jeune-prince-a-quitte-le-village-des-basses-pyrenees-ou-il-sejournait_2051361_1819218.html,1950.0,frères,Neutral,0.665672779083252
Ce document fait tout d abord allusion à la rivalité entre les deux frères qui est à l origine des événements actuels,https://www.lemonde.fr/archives/article/1951/01/06/les-dirigeants-de-la-societe-des-grands-hotels-de-vichy-contre-attaquent_2067420_1819218.html,1951.0,frères,Negative,0.994716465473175
Les premiers sont représentés par les frères Alsop qui passent pour développer dans le NEW YORK HERALD certaines des vues du Pentagone encore que ces derniers temps on ait l impression qu ils les accueillent avec réserve,https://www.lemonde.fr/archives/article/1951/01/12/les-imis-le-moscou-jaugees-a-washington_2067670_1819218.html,1951.0,frères,Positive,0.8370492458343506
Le Pentagone croit à une attaque russe Pour les frères Alsop et dans la mesure où ils expriment son opinion pour Je Pentagone la situation en Corée deviendra vite intenable et la seule question qui se pose est celle d une évacuation honorable,https://www.lemonde.fr/archives/article/1951/01/12/les-imis-le-moscou-jaugees-a-washington_2067670_1819218.html,1951.0,frères,Neutral,0.7823886871337891
Bref les frères Alsop du NEW YORK HERALD et du Pentagone tracent de la situation dans le Sud Est asiatique un tableau dont les analogies avec la Corée font penser que leurs conclusions sans être aujourd hui dévoilées pour l un comme pour l autre de ces théâtres d opérations ne doivent pas être sensiblement différentes,https://www.lemonde.fr/archives/article/1951/01/12/les-imis-le-moscou-jaugees-a-washington_2067670_1819218.html,1951.0,frères,Neutral,0.4073268473148346
Le contact avec d autres milieux que le Pentagone est il venu faire douter les frères Alsop de la rigueur de ces conclusions,https://www.lemonde.fr/archives/article/1951/01/12/les-imis-le-moscou-jaugees-a-washington_2067670_1819218.html,1951.0,frères,Negative,0.9176881909370422
Des valises contenant plus de 37 kilos d or apportées par les frères Henri et Albert Maatalani banquiers libanais étaient saisies le 10 décembre 1949 à l aéroport d Orly à bord d un appareil venant de Syrie,https://www.lemonde.fr/archives/article/1951/01/12/relaxes-par-le-tribunal-correctionnel-les-trafiquants-d-or-d-orly-sont-severement-condamnes-en-appel_2068079_1819218.html,1951.0,frères,Neutral,0.8463574051856995
C est la plainte de l exilé Nous avons tout perdu Père mère sœurs et frères,https://www.lemonde.fr/archives/article/1951/01/13/poemes-du-regret_2066662_1819218.html,1951.0,frères,Negative,0.9545950293540955
et de ses frères tombés à ses côtés dans le combat mené pour la défense de la France et de la liberté,https://www.lemonde.fr/archives/article/1951/01/16/le-monument-a-jean-moulin-a-ete-inaugure-a-beziers-par-m-gaston-monnerville_2066806_1819218.html,1951.0,frères,Positive,0.5665503740310669
Il serait alors du devoir de tous les chrétiens de ne rien faire qui pût induire leurs frères en tentation,https://www.lemonde.fr/archives/article/1951/01/20/le-dialogue-doit-continuer_2066750_1819218.html,1951.0,frères,Negative,0.8922814130783081
Flicoteaux père nourricier des gloires à naître de la Comédie humaine avec ses saladiers de pruneaux cuits la pension Vauquer aux murs ornés de gravures encadrées de bois noir qui ôtent l appétit l hôtel garni de l usurier Cérizet le marchand de vins de la rue de Charenton où sous la lumière des lampes à réflecteurs de fer blanc le jeune Balzac rencontra Facino Cane les frères provençaux le Bœuf à la mode aujourd hui déchu la Maison dorée ce sont les classiques de la série,https://www.lemonde.fr/archives/article/1951/01/20/les-restaurants-de-balzac_2067133_1819218.html,1951.0,frères,Neutral,0.7550482153892517
De Pékin à Canton en passant par Changhaï la Chine entière pense à ses frères coréens,https://www.lemonde.fr/archives/article/1951/01/26/les-nouveaux-russes-de-changhai-sont-partis-pour-la-mandchourie-des-que-mac-arthur-eut-franchi-le-38e-parallele_2068295_1819218.html,1951.0,frères,Positive,0.9309856295585632
Les syndicats décident que tous les salariés verseront volontairement la moitié de leur paye au gouvernement pour aider à secourir les frères coréens victimes de l impérialisme occidental,https://www.lemonde.fr/archives/article/1951/01/26/les-nouveaux-russes-de-changhai-sont-partis-pour-la-mandchourie-des-que-mac-arthur-eut-franchi-le-38e-parallele_2068295_1819218.html,1951.0,frères,Positive,0.9887545108795166
La seule dispense admise concerne les jeunes gens dont deux frères sont morts pour la France,https://www.lemonde.fr/archives/article/1951/01/27/le-premier-contingent-de-la-classe-1951-sera-incorpore-a-partir-du-15-avril_2068061_1819218.html,1951.0,frères,Negative,0.7700562477111816
Ligne 117 de Saint Maur gare de Champigny à la mairie de Bonneuil desserte du pont de Bonneuil en remplacement du tronçon gare de Champigny place Gambetta de la ligne 112 ligne 130 de la porte des Lilas à la porte de La Villette église et mairie de Pantin carrefour des Quatre Chemins à Aubervilliers ligne 138 de l église d Epinay à la porte de Clichy pont d Epinay Gennevilliers par l avenue Laurent Cély pont de Gennevilliers Clichy par la place de la République et le boulevard Victor Hugo ligne 167 de Nanterregare à Saint Denis église neuve par le Petit J Colombes Gennevilliers et l Ile Saint Denis ligne 178 de Courbevoie place des Trois frères Lebœuf à Saint Denis église neuve gare de Bois Colombes place Voltaire à Asnières avenue des Grésillons à Genevilliers boulevard Gallieni à Villeneuve La Garenne gare de Saint Denis ligne 184 de Cachan place Gambetta à la porte d Italie par l avenue Raspail itinéraire de la ligne 77 en remplacement du tronçon extra muros de l actuelle ligne 77,https://www.lemonde.fr/archives/article/1951/01/31/l-office-des-transports-examinera-le-mois-prochain-l-augmentation-eventuelle-des-tarifs_2067840_1819218.html,1951.0,frères,Neutral,0.7357602119445801
En outre si l on rendait Alfred Krupp responsable des actes commis dans ses entreprises on ne pouvait le considérer comme seul propriétaire puisqu il a plusieurs frères et sœurs qui partagent avec lui l héritage du père,https://www.lemonde.fr/archives/article/1951/02/02/le-cas-krupp_2065644_1819218.html,1951.0,frères,Positive,0.9909536838531494
En confisquant tous les biens de Krupp on prenait en même temps que ceux du fils aîné ceux de ses frères et sœurs qui n étaient l objet d aucune condamnation,https://www.lemonde.fr/archives/article/1951/02/02/le-cas-krupp_2065644_1819218.html,1951.0,frères,Positive,0.7682717442512512
Il s agit de deux frères,https://www.lemonde.fr/archives/article/1951/02/02/un-second-bandit-est-arrete-un-troisieme-est-identifie_2065252_1819218.html,1951.0,frères,Positive,0.889758825302124
Peut être serait il nécessaire si le projet était voté par l Assemblée car tout arrive de distribuer aux citoyens une brochure explicative sans quoi ils risqueraient de se perdre dans les parentés et les apparentements frères ou cousins oncles ou neveux,https://www.lemonde.fr/archives/article/1951/02/09/les-apparentements-terribles_2065439_1819218.html,1951.0,frères,Neutral,0.8103461861610413
Nous retiendrons simplement ses conseils inédits sur l hygiène du sédentaire inspirés à la lois par la philosophie d Alain et de Carrel qui nous semblent pleins de sens pour nos frères des villes Ne craignez pas d aller courir dehors par un jour de pluie de grand vent ou de froid si vous avez commis quelque excès de nourriture supprimez le repas suivant ou remplacez le par un repas composé exclusivement de fruits,https://www.lemonde.fr/archives/article/1951/02/13/la-condition-physique-et-la-forme_2065367_1819218.html,1951.0,frères,Neutral,0.7551247477531433
Chaque déporté est il ajouté revêtu de sa tenue rayée muni de son numéro matricule et de ses décorations manifestera par sa présence contre l injure faite à la mémoire des deux cent mille frères et sœurs assassinés dans les camps dont les photographies présentes à la manifestation seront une solennelle accusation,https://www.lemonde.fr/archives/article/1951/02/14/nouvelles-du-jour_2065579_1819218.html,1951.0,frères,Negative,0.9869595170021057
Charles Gentès a une belle voix et le tyrolien Yonal est drôle mais les Garçons de la rue s inspirent trop visiblement des frères Jacques,https://www.lemonde.fr/archives/article/1951/02/14/sidney-bechet-reste-fidele-a-l-a-b-c-du-jazz_2066240_1819218.html,1951.0,frères,Neutral,0.5779464840888977
Sa parfaite connaissance de l Espagne et de la langue espagnole elle est la grande camarade des frères Dominguin les fameux toreros qu elle connut dans son enfance à Madrid lui a permis d interpréter un rôle important dans le Marquis de Salamanca une bande du metteur en scène Edgar Neville,https://www.lemonde.fr/archives/article/1951/02/17/l-opinion-de-lucienne-granier-interprete-de-roussin-dans-bobosse_2065780_1819218.html,1951.0,frères,Positive,0.9315980076789856
Les demi finales du double messieurs ont en effet vu la défaite de Borotra Dubuc vaincus 5 7 6 4 6 4 7 5 par Drobny Garnero et des frères del Bello sortis 7 5 6 2 7 5 par Bernard Destremau,https://www.lemonde.fr/archives/article/1951/02/19/drobny-triple-finaliste-a-lyon_2064851_1819218.html,1951.0,frères,Negative,0.97678542137146
Elle fixe ainsi le bilan provisoire des dommages causés aux civils sud coréens c est à dire victimes de l agression de leurs frères du Nord 250 000 tués 200 000 blessés 200 000 disparus,https://www.lemonde.fr/archives/article/1951/02/24/la-croisade-du-pecheur-a-la-ligne_2065247_1819218.html,1951.0,frères,Negative,0.9574103355407715
