Text,date,link,year
" Pour beaucoup d'épouses d'Algériens ou de Marocains, la venue en France n'a pas été un choix personnel",1986-02-26,https://www.lemonde.fr/archives/article/1986/02/26/l-immigration-au-feminin_2925008_1819218.html,1986
"Des épouses cachant mal leur émotion, surveillaient attentivement les premiers pas dans l'hémicycle de leur nouveau député de mari",1986-04-04,https://www.lemonde.fr/archives/article/1986/04/04/m-chaban-delmas-soutenir-et-non-tenir-le-gouvernement_3144386_1819218.html,1986
"Cette fois, Recco confie à Mengel son intention d'aller tuer d'autres plaisanciers après avoir violé leurs épouses",1986-06-04,https://www.lemonde.fr/archives/article/1986/06/04/les-silences-d-antoine-recco_2913970_1819218.html,1986
"Par l'initiative personnelle, d'abord, qui est encouragée : les épouses les plus favorisées ou les moins socialement handicapées sont sollicitées d'apporter leur concours aux autres",1986-06-14,https://www.lemonde.fr/archives/article/1986/06/14/pensons-a-toi-stop_2914326_1819218.html,1986
"Mais le vendeur au noir fait rire la salle quand il dit : "" Il n'y a que trois robes comme celle-ci dans toute l'Union soviétique, et elles appartiennent aux épouses de diplomates de pays non communistes """,1986-08-18,https://www.lemonde.fr/archives/article/1986/08/18/urss-les-tabous-commencent-a-chanceler_2920367_1819218.html,1986
"Dans Bethsabée, qui vient de paraître, Torgny Lindgren poursuit un dialogue avec Dieu plus proche du Cantique des cantiques que de Dieu sait de Joseph Heller (Grasset 1985), avec les mêmes personnages : une Bethsabée inséminée d'amour et de volonté, qui refuse d'"" enfanter des fils superflus, des fils qui ne sont pas nécessaires sur la terre "" ; Bethsabée, préférée aux cinquante-deux autres épouses du harem et dont le fils régnera; Bethsabée, à qui le roi David dit avant de mourir : "" Tu es parfaite",1986-09-19,https://www.lemonde.fr/archives/article/1986/09/19/les-suedois-descendent-vers-le-sud-la-chronique-de-nicole-zand_3116885_1819218.html,1986
"Pour la plus grande gloire de cette femme ""timide et vertueuse "", mais "" qui sent très fort le désir "" et que le roi va préférer aux cinquante-deux autres épouses de son harem",1986-11-25,https://www.lemonde.fr/archives/article/1986/11/25/femina-etranger-torgny-lindgren-pour-bethsabee_2927830_1819218.html,1986
" L'histoire est celle d'un certain Bob Smith, à Londres, qui a deux épouses "" légales "", dans deux domiciles conjugaux",1986-12-03,https://www.lemonde.fr/archives/article/1986/12/03/double-mixte-de-ray-cooney-le-rire-devenu-fou_3117101_1819218.html,1986
"A partir de là, aventures, coups du sort, collisions, vont faire traînée de poudre, dans une corrida insensée qui emporte les deux épouses, les deux inspecteurs de police des deux quartiers, et les deux copains (Bob Smith le bigame et son ami Jeff)",1986-12-03,https://www.lemonde.fr/archives/article/1986/12/03/double-mixte-de-ray-cooney-le-rire-devenu-fou_3117101_1819218.html,1986
" La polygamie fait, dans de nombreux pays du monde, le bonheur des épouses, et c'est sans doute pour compenser sa sévérité à propos de la bigamie que la loi française a dépénalisé, en 1975, l'adultère : ce n'est plus un délit, il n'est pas punissable, il est tout au plus une cause de divorce, mais même pas une "" cause péremptoire "" : l'époux ou l'épouse convaincu (e) d'adultère ne voit pas nécessairement le divorce prononcé à ses torts",1986-12-03,https://www.lemonde.fr/archives/article/1986/12/03/double-mixte-de-ray-cooney-le-rire-devenu-fou_3117101_1819218.html,1986
"Au sommet, le roi, bien sûr, et cinq de ses frères dominent la vie politique : Sultan (ministre de la défense), Abdel Rahman (vice-ministre de la défense), Naïf (intérieur), Salman (gouverneur de Ryad) et Ahmad - connus sous l'appellation des ""frères Soudain"", car tous fils d'une des épouses favorites du roi Abdelaziz, Husa Soudain",1986-12-06,https://www.lemonde.fr/archives/article/1986/12/06/la-dialectique-de-l-or-noir-et-du-coran_2930807_1819218.html,1986
"Dans la Mort du vieux garçon, récit allégorique plein d'ironie et de scepticisme, le célibataire agonisant convoque à la dernière heure ses amis, qui arrivent trop tard, mais découvrent au chevet du défunt une lettre vieille de neuf ans dans laquelle le regretté avoue avoir été l'amant de leurs épouses",1987-01-02,https://www.lemonde.fr/archives/article/1987/01/02/vienne-au-crepuscule-une-promenade-avec-les-fantomes-de-sissi-d-arthur-schnitzler-et-de-stefan-zweig_4028735_1819218.html,1987
" Si cela ne vous rappelle rien, Messieurs, demandez donc aux épouses qui vous font face, fières, cet après-midi, de vous considérer dans votre gloire tranquille, mais qui savent, elles, le prix de nos tête-à-tête avec la page blanche : nuits de même couleur, matinées pâteuses, bougonnements contre les critiques, notes prises, au beau milieu de la conversation ou du sommeil, en vue du livre en chantier, ahurissement chronique de qui descend, chaque jour, au fond de soi, comme à la mine",1987-02-01,https://www.lemonde.fr/archives/article/1987/02/01/l-academie-francaise-a-recu-m-poirot-delpech-le-discours-du-recipiendaire_4021680_1819218.html,1987
"En 1931, elle avait quatorze ans et ouvrait le Bal, son premier film, suivi d'une centaine d'autres et d'autant de rôles de gamines délurées, de reines, d'épouses ou de maitresses passionnées",1987-02-15,https://www.lemonde.fr/archives/article/1987/02/15/danielle-darrieux-ou-le-gout-de-l-imprevu_4027161_1819218.html,1987
Mais l'époque a aussi le mérite d'ouvrir aux épouses les petites compensations naguère réservées aux maris,1987-02-20,https://www.lemonde.fr/archives/article/1987/02/20/les-passions-partagees-de-felicien-marceau-une-course-allegre-au-bonheur_4029106_1819218.html,1987
" Le chef d'Amal a fait ces déclarations lundi, après avoir reçu les épouses des enseignants américains Alann Steen, Robert Polhill et Jesse Turner et du professeur indien Mithileshwar Singh, en présence de M",1987-04-01,https://www.lemonde.fr/archives/article/1987/04/01/mis-en-cause-par-m-arafat-le-general-kanaan-et-m-nabih-berri-se-defendent-de-detenir-quatre-professeurs-en-otages_4054786_1819218.html,1987
C'est l'autobiographie imaginaire de l'empereur romain qui eut pour épouses Messaline et Agrippine (438 p,1987-04-03,https://www.lemonde.fr/archives/article/1987/04/03/violences-en-mediterranee_4057493_1819218.html,1987
"Tout autour, grouillent des personnages hauts en couleur : pions de cirque, espions d'opérette, épouses dignes, vieilles filles en chaleur, fillettes décidées à croquer dans la vie ; des héros positifs, aussi, jeunes gens couverts de gloire ou insoumis, et qui entendent monter, d'un camp de réfugiés russes, des chants d'utopie",1987-05-02,https://www.lemonde.fr/archives/article/1987/05/02/l-individu-en-detresse-de-georges-palante-maitre-et-modele-de-louis-guilloux_4058265_1819218.html,1987
"Parentes, épouses ou mères de détenus, elles souhaitaient obtenir des précisions sur le lieu de détention de leurs proches",1987-05-14,https://www.lemonde.fr/archives/article/1987/05/14/tunisie-peines-de-prison-confirmees-pour-treize-membres-de-l-opposition-de-gauche_4052412_1819218.html,1987
"Il faut ajouter à ce nombre de déportés environ 400 épouses de prisonniers de guerre juifs déportées le 2 mai 1944 et le 21 juillet à Bergen-Belsen, les 360 juifs déportés de Toulouse et Saint-Sulpice, le 30 juillet, et les 63 juifs déportés de Clermont-Ferrand, le 22 août, plus les juifs déportés individuellement",1987-05-17,https://www.lemonde.fr/archives/article/1987/05/17/convois-pour-la-mort_4053836_1819218.html,1987
" Trompera bien qui trompera le dernier : c'est le jeu auquel se livrent le nouveau Volpone de Guépier pour trois abeilles, les duettistes du Limier et l'invisible amie d'enfance des trois épouses abusives (chacune à sa façon) de Chaines conjugales",1987-05-17,https://www.lemonde.fr/archives/article/1987/05/17/le-reptile-l-ouest-au-vitriol_4055701_1819218.html,1987
"Ses remarques sur la transparence de la politique, qui en vaut bien d'autres, sur la gestion des partis, le poids des appareils, le sort des épouses de diplomates et d'autres serviteurs de la République, la pression des médias, par exemple, ne manquent ni de finesse ni d'authenticité",1987-05-24,https://www.lemonde.fr/archives/article/1987/05/24/regards-de-femmes_4057175_1819218.html,1987
" Lorsque la loi Naquet de 1884 rétablit le divorce, les épouses qui prétendent en faire usage sont qualifiées de "" déserteuses """,1987-06-12,https://www.lemonde.fr/archives/article/1987/06/12/l-avant-guerre-des-sexes_4055317_1819218.html,1987
"A cela, il faut ajouter les rumeurs de couloir, les sourdes mais vives rivalités, des jalousies personnelles, la "" révolte des épouses "", victimes de l'incertitude dont souffrent leurs maris",1987-06-24,https://www.lemonde.fr/archives/article/1987/06/24/la-reorganisation-de-la-banque-mondiale-dans-le-desordre-et-le-doute_4051178_1819218.html,1987
"Aux épouses de diplomates et de militaires, il ne restait en guise de lot de consolation que la posibilité de serrer la main de Bernard Hinault laissé sur place par le tourbillon chiraquien",1987-07-03,https://www.lemonde.fr/archives/article/1987/07/03/chirac-vieux-routier_4044576_1819218.html,1987
"Deux équipes, après un bref essai, ont fini par renoncer à ses services, les épouses des coureurs protestant haut et fort contre sa présence perturbatrice",1987-07-17,https://www.lemonde.fr/archives/article/1987/07/17/pas-d-etape-a-cythere_4050020_1819218.html,1987
"Au lendemain des incidents à la maison d'arrêt des Baumettes, à Marseille, qui ont entrainé l'hospitalisation de huit blessés, plusieurs dizaines de personnes, pour la plupart mères ou épouses de détenus, ont manifesté, le vendredi 14 août, devant la porte de la prison, afin d'obtenir les identités des blessés et pour protester contre la suspension des visites du vendredi et les conditions d'incarcération (près de deux mille quatre cents détenus pour mille places)",1987-08-16,https://www.lemonde.fr/archives/article/1987/08/16/a-marseille-manifestation-devant-la-prison-des-baumettes_4040906_1819218.html,1987
"Rien n'y manque, ni les limousines, ni les ""épouses sculpturales"", ni les génies de la finance",1987-09-05,https://www.lemonde.fr/archives/article/1987/09/05/les-coquins-de-la-commere_4048960_1819218.html,1987
"Shultz a annoncé qu'il recevrait aussi son interlocuteur, en privé, en compagnie de leurs épouses, ce qui est, après tout, une certaine forme de détente",1987-09-16,https://www.lemonde.fr/archives/article/1987/09/16/les-entretiens-shultz-chevardnadze-devraient-lever-les-derniers-obstacles-a-un-accord-de-desarmement_4041782_1819218.html,1987
"On voit en outre apparaitre aujourd'hui un nouveau type de personnes contaminées: les épouses ""traditionnelles"", arrivées vierges au mariage, contaminées par leur mari et mettant au monde des enfants eux-mêmes contaminés",1987-10-11,https://www.lemonde.fr/archives/article/1987/10/11/les-specialistes-redoutent-une-hecatombe-l-ombre-du-sida-sur-l-afrique_4081408_1819218.html,1987
On les a invités à venir un week-end avec leur épouses,1987-11-05,https://www.lemonde.fr/archives/article/1987/11/05/les-defis-de-l-aire-urbaine_4082843_1819218.html,1987
Les trois quarts ont encore des enfants à charge et les deux tiers des épouses qui n'ont pas de profession,1987-11-13,https://www.lemonde.fr/archives/article/1987/11/13/defense-selon-un-rapport-parlementaire-la-crise-economique-freine-la-reconversion-des-militaires_4073629_1819218.html,1987
"Les mains crispées sur le gilet, les yupies madrilènes trépignent de la talonnette face à leurs épouses qui claquent des doigts : la sevillana est la danse à la mode depuis déjà plusieurs mois dans les boites",1987-11-19,https://www.lemonde.fr/archives/article/1987/11/19/le-festival-du-cinema-espagnol-a-paris-les-fureurs-de-l-humour_4077000_1819218.html,1987
"Grand-père vient avec sa canne et sa croix de guerre, les enfants endimanchés sont émoustillés comme au spectacle, les épouses cachent leur émotion",1988-03-06,https://www.lemonde.fr/archives/article/1988/03/06/decorations-a-l-elysee-les-legionnaires-du-president_4063583_1819218.html,1988
"Le film _ jamais repris depuis un passage à la télévision en 1977 _ est construit en deux mouvements qui se répondent : le recrutement des célibataires et les mariages ; la fuite, non prévue, des hommes le soir de leurs noces et ce qu'il advient de leurs rencontres avec leurs épouses",1988-03-18,https://www.lemonde.fr/archives/article/1988/03/18/ils-etaient-neuf-celibataires-de-sacha-guitry-le-roman-d-un-seducteur_4069000_1819218.html,1988
" Manifestation de la vague d'émancipation qui atteint il y a une quinzaine d'années ces cités protestantes, dans la salle d'honneur à la décoration solennelle et empesée, les places réservées aux épouses sont désormais marquées "" siège du partenaire du recteur "", "" siège du partenaire de l'orateur """,1988-03-31,https://www.lemonde.fr/archives/article/1988/03/31/groningue-capitale-du-nord_4064423_1819218.html,1988
"Il parait que les épouses achètent à leurs maris ces treize "" petits bijoux "" qu'une femme attendrie adresse à ces indispensables machos, au fond si fragiles et qui n'ont jamais tué "" le-petit-garçon-qui-est-en-eux """,1988-04-08,https://www.lemonde.fr/archives/article/1988/04/08/suzanne-prou-et-ses-nostalgies-douces_4098656_1819218.html,1988
" La raison de cette "" mise au point "" est un article du Figaro Madame qui affirmait, samedi 16 avril, dans une enquête sur les épouses de quatre des candidats à la présidence de la République, que le secrétariat particulier de Mme Mitterrand, par l'intermédiaire de la fondation qu'elle préside, "" envoie des armes à ses protégés de Pologne, d'Afrique du Sud et d'Amérique latine """,1988-04-19,https://www.lemonde.fr/archives/article/1988/04/19/des-excuses-du-figaro-a-mme-mitterrand_4101353_1819218.html,1988
"Devant des auditoires composés en moyenne d'une quinzaine de personnes _ quelques conseillers municipaux, leurs épouses, une poignée de citoyens méritants _ sans flonflons ni vin d'honneur, l'ancien ministre des affaires sociales développe à la demande sa vision des affaires locales, nationales et mondiales",1988-06-01,https://www.lemonde.fr/archives/article/1988/06/01/dans-les-vosges-m-philippe-seguin-au-ras-des-paquerettes_4100270_1819218.html,1988
"Ieng Sary, ex-ministre des affaires étrangères au temps du régime khmer rouge à Phnom-Penh, ainsi que les épouses de ces deux hommes, qui sont soeurs : Mmes Khieu Ponnary (Mme Pol Pot) et Khieu Thirith (Mme Ieng Sary)",1988-06-21,https://www.lemonde.fr/archives/article/1988/06/21/la-negociation-sur-le-cambodge-pekin-serait-dispose-a-offrir-l-asile-aux-principaux-dirigeants-khmers-rouges_4099716_1819218.html,1988
"Une rétrospective de la carrière de Wu, en 1985, montrait plusieurs épouses de dirigeants en vue à Yan'an, mais ne comportait pas une seule photo de Jiang Qing, l'épouse de Mao, pourtant particulièrement visible à l'époque",1988-06-23,https://www.lemonde.fr/archives/article/1988/06/23/un-entretien-avec-wu-yinxian_4101058_1819218.html,1988
"Kourou, c'est son nom, se retrouve mêlé à des aventures "" incroyables et inouies "" dans la jungle urbaine où se côtoient toutes sortes de personnages, nains vendeurs de brochettes, musiciens obèses, tenanciers de bars, secrétaires récemment diplomées, épouses pas toujours fidèles, "" petits poussins "" (nom donné là-bas aux gigolos), "" deuxièmes bureaux "" (les maitresses), femmes libres, etc",1988-06-24,https://www.lemonde.fr/archives/article/1988/06/24/la-vie-est-belle-de-ngangura-mweze-et-benoit-lamy-papa-wemba_4101140_1819218.html,1988
"Peut-être conviendrait-il plutôt de scruter chevaliers et nobles épouses, Elizabeth, lady Hoby et Sir John Wyatt, avec à l'esprit le Christ mort et les gravures macabres",1988-07-14,https://www.lemonde.fr/archives/article/1988/07/14/holbein-le-jeune-a-bale-portraits-d-outre-tombe_4091149_1819218.html,1988
" A quoi il faudrait ajouter, sans s'en moquer ni s'en offusquer _ puisqu'on évalue un lignage royal aussi bien à l'étendue géographique de son influence et à ses richesses que, disent les spécialistes, à la ""capitalisation d'hommes et de femmes"", _ sept épouses et trente enfants",1988-07-23,https://www.lemonde.fr/archives/article/1988/07/23/loin-d-abidjan-une-nuit-chez-le-roi-de-bettie_4083850_1819218.html,1988
" Entouré de ses subordonnés et de leurs épouses, qui opinent du bonnet, le commandant de la brigade, l'adjudant-chef Maingan, réplique : "" Pour ce surcroit de travail, on fait un effort supplémentaire",1988-07-28,https://www.lemonde.fr/archives/article/1988/07/28/une-visite-impromptue-de-m-chevenement-les-gendarmes-de-saint-pol_4085197_1819218.html,1988
"Le jeune monarque, qui, à moins de vingt-cinq ans, avait déjà quatre épouses officielles, plus ses favorites, était vraiment très très ennuyé",1988-09-18,https://www.lemonde.fr/archives/article/1988/09/18/le-voyage-de-jean-paul-ii-au-swaziland-le-pape-le-lion-et-la-grande-elephante_4083479_1819218.html,1988
Il fait mettre en garde à vue les trois huissiers et leurs épouses _ Mme Alain Carret est la soeur de MM,1989-01-31,https://www.lemonde.fr/archives/article/1989/01/31/les-enquetes-sur-le-reseau-lyonnais-d-action-directe-trois-huissiers-epingles_4117823_1819218.html,1989
Les deux gérants du bar et leurs épouses sont présents,1989-02-11,https://www.lemonde.fr/archives/article/1989/02/11/dans-l-oise-trois-inculpations-apres-le-meurtre-d-un-jeune-beur_4114419_1819218.html,1989
"Plutôt discret, Guy Laroche avait en trente-deux ans imposé un sport chic à la française, une mode rassurante, sans excès, adoptée par les épouses de plusieurs hommes politiques, de Mme Balladur à Mme Pompidou (fidèle cliente dès 1961) en passant par Bernadette Chirac",1989-02-18,https://www.lemonde.fr/archives/article/1989/02/18/le-deces-du-couturier-guy-laroche-un-double-empire_4108573_1819218.html,1989
"Pour comprendre l'émotion suscitée dans le monde musulman par le livre de Rushdie, il faut tout d'abord rappeler que la mise en scène, sous une forme romanesque, de Mahomet, de ses compagnons, de ses épouses, etc",1989-02-19,https://www.lemonde.fr/archives/article/1989/02/19/apres-la-condamnation-a-mort-de-salman-rushdie-par-l-imam-khomeiny-les-passages-des-versets-sataniques-qui-choquent-les-musulmans_4107149_1819218.html,1989
" A quoi s'ajoute, pour aggraver le cas de Salman Rushdie, qu'il s'agit d'un Indien, et qu'il est né musulman : le blas- sphème suit l'apostasie, et que le récit assimile les épouses de Mahomet à des prostituées",1989-02-24,https://www.lemonde.fr/archives/article/1989/02/24/les-menaces-de-mort-contre-salman-rushdie-entre-la-fleche-et-la-cible_4109238_1819218.html,1989
" On sent une bonhomie amusée devant ces personnages bedonnants, aux rouflaquettes pompeuses, flanqués d'épouses grasses et suivis de leur marmaille, tous gonflés de leur importance",1989-04-01,https://www.lemonde.fr/archives/article/1989/04/01/a-lausanne-daumier-sculpteur-et-lithographe_4104791_1819218.html,1989
"Dans un village du sud-oranais, Kadour le rêveur, fils adoptif du riche Sidi (trois épouses travaillant aux métiers à tisser, bientôt une quatrième) tombe amoureux de la femme du cordonnier, le clame partout, dérange l'ordre du village",1989-04-06,https://www.lemonde.fr/archives/article/1989/04/06/la-citadelle-de-mohamed-chouikh_4106868_1819218.html,1989
"Les épouses sont-elles, dans certains cas, comprises dans le lot",1989-05-25,https://www.lemonde.fr/archives/article/1989/05/25/nouvelle-etape-de-la-querelle-diplomatique-avec-l-urss-londres-refuse-de-limiter-volontairement-sa-presence-a-moscou_4146548_1819218.html,1989
" En prime, les téléspectateurs eurent droit en direct aux commentaires restés objectifs de Bobby Unser, ancien champion et oncle du héros malheureux, puis, grâce aux nombreuses caméras, ils ont pu revoir l'accident sous tous les angles ainsi que l'effroi des épouses des pilotes au moment où les roues ont été en contact",1989-06-03,https://www.lemonde.fr/archives/article/1989/06/03/automobilisme-le-grand-prix-des-etats-unis-le-cart-ecrase-la-formule-1_4139247_1819218.html,1989
"Les autres sociétés lauréates sont Sentosphère, qui édite des jeux sensoriels; Infotrade, qui a mis au point un système de traitement informatique en temps réel destiné aux marchés financiers et aux particuliers; Paris-Passion, qui propose aux hommes d'affaires et à leurs épouses ou à des particuliers de découvrir la capitale comme ""de vrais Parisiens"", avec le luxe en plus; Légipresse, qui publie des documents concernant le droit de la communication",1989-06-08,https://www.lemonde.fr/archives/article/1989/06/08/les-prix-de-la-fondation-jacques-douce_4141278_1819218.html,1989
"Les autres sociétés lauréates sont Sentosphère, qui édite des jeux sensoriels; Infotrade, qui a mis au point un système de traitement informatique en temps réel destiné aux marchés financiers et aux particuliers; Paris-Passion, qui propose aux hommes d'affaires et à leurs épouses ou à des particuliers de découvrir la capitale comme ""de vrais Parisiens"", avec le luxe en plus; Légipresse, qui publie des documents concernant le droit de la communication",1989-06-08,https://www.lemonde.fr/archives/article/1989/06/08/les-prix-de-la-fondation-jacques-douce_4142662_1819218.html,1989
"Grand équipage de gardes du corps, de conseillers, d'épouses ; déplacements prévus tous azimuts et velléités touristiques impromptues",1989-06-13,https://www.lemonde.fr/archives/article/1989/06/13/sommet-des-sept-et-fetes-de-la-revolution-le-paris-fou-du-bicentenaire_4143421_1819218.html,1989
"Cela se comprend, et le chef donne l'exemple : à soixante-neuf ans, il a six épouses et vingt et un enfants",1989-07-11,https://www.lemonde.fr/archives/article/1989/07/11/pauvrete-ordinaire-au-burkina-faso-une-journee-dans-la-vie-de-catherine-bana_4145547_1819218.html,1989
"Selon lui, pour un homme attaché à la coutume, quatre épouses sont une bonne moyenne",1989-07-11,https://www.lemonde.fr/archives/article/1989/07/11/pauvrete-ordinaire-au-burkina-faso-une-journee-dans-la-vie-de-catherine-bana_4145547_1819218.html,1989
"Certes, mais parfois les maris en mal de libations opèrent des ponctions sur les maigres économies des épouses",1989-07-11,https://www.lemonde.fr/archives/article/1989/07/11/pauvrete-ordinaire-au-burkina-faso-une-journee-dans-la-vie-de-catherine-bana_4145547_1819218.html,1989
" Seize mille places assises ont été attribuées de manière nominative aux parlementaires, membres du corps diplomatique, à des artistes, aux épouses des soldats de service, aux sponsors et à deux mille Français et Françaises nés un 14 juillet ou baptisées Marianne",1989-07-13,https://www.lemonde.fr/archives/article/1989/07/13/m-lang-contre-les-grincheux_4146319_1819218.html,1989
"Enfin, les chasseurs brandissent de vieux fusils manufacturés à Saint-Etienne, tandis que leurs épouses, cigarette au bec, manipulent de bien prosaiques casseroles",1989-07-15,https://www.lemonde.fr/archives/article/1989/07/15/pygmees-a-touristes_4137041_1819218.html,1989
Voici des pierres grosses comme des melons qui affleurent simplement du sol : neuf des onze épouses de l'Envoyé,1989-07-22,https://www.lemonde.fr/archives/article/1989/07/22/medine-l-oasis-sainte_4140284_1819218.html,1989
"Djamedua Fumano, ses deux épouses et leurs huit enfants, habitait dans l'immeuble récent qui surplombe le parking",1989-08-01,https://www.lemonde.fr/archives/article/1989/08/01/en-seine-saint-denis-le-meurtrier-presume-de-la-petite-malienne-a-ete-inculpe_4143660_1819218.html,1989
"Des centaines de mères, d'épouses et d'enfants ont ainsi défilé sur plusieurs kilomètres en tenant entre leurs mains un simple carton blanc indiquant le nom et la date du décès de leurs parents",1989-08-15,https://www.lemonde.fr/archives/article/1989/08/15/irlande-du-nord-sous-l-etroite-surveillance-des-forces-de-l-ordre-catholiques-et-protestants-ont-defile-en-masse-dans-les-rues-de-belfast_4137224_1819218.html,1989
"Au travers d'une fable (un homme dont les épouses meurent avec une effrayante régularité), il s'agit ici des moeurs rigides de la minorité boukharan",1989-09-01,https://www.lemonde.fr/archives/article/1989/09/01/le-festival-des-films-du-monde-a-montreal-terres-d-asile_4135153_1819218.html,1989
" Parce que ces hommes entre parenthèses donnent aux vivantes qui leur sont proches, épouses, amantes, mères, comme un sursis de chagrin",1989-09-06,https://www.lemonde.fr/archives/article/1989/09/06/la-vie-et-rien-d-autre-de-bertrand-tavernier-la-guerre-est-finie_4126417_1819218.html,1989
"Le Festival international d'opéra de Versailles, organisé au mois de juillet pour le Bicentenaire dans le cadre du château, en présence notamment des épouses des chefs d'Etat participant au sommet des Sept, va probablement connaitre des prolongements judiciaires : son promoteur, l'homme d'affaires égyptien Fawzi Mitwali, refuse de payer plusieurs de ses fournisseurs",1989-09-07,https://www.lemonde.fr/archives/article/1989/09/07/les-manifestations-du-bicentenaire-a-versailles-l-organisateur-du-festival-d-opera-refuse-d-honorer-d-importantes-creances_4126540_1819218.html,1989
Tout porte à croire cependant que les épouses de gendarmes auraient eu et ont encore beaucoup à dire,1989-09-15,https://www.lemonde.fr/archives/article/1989/09/15/statut-epouses-de-gendarmes_4129958_1819218.html,1989
