Text,date,link,year
"De la jeune femme canadienne qui a absorbé des comprimés de thalidomide à celle qui, faute de logement, ne "" peut pas se permettre d'avoir un enfant tout de suite "", supprime cet enfant et devient sans doute stérile à jamais parce que l'opération a été accomplie dans des conditions désastreuses, le panorama n'est sans doute pas complet, mais il est éloquent",1966-01-13,https://www.lemonde.fr/archives/article/1966/01/13/l-avortement-autorise-ou-defendu-d-anne-marie-dourlen-rollier_2703050_1819218.html,1966
" Et les deux journalistes se sont déclarés convaincus que Figon se trouvait à Paris ; "" Une femme nous a téléphoné aujourd'hui même pour nous indiquer qu'elle avait vu Figon il y a quatre jours dîner avec trois Marocains au restaurant ""Joséphine"", rue des Acacias",1966-01-13,https://www.lemonde.fr/archives/article/1966/01/13/la-journee-des-journalistes_2701689_1819218.html,1966
"Toi tu fais du report photographique et du cliché d'actualité, tout en imaginant d'en dissimuler le résultat sous une palissade qui le masque aux trois quarts; moi je fais dans le carton bouilli et le polyester bariolé ; lui il fait un moulage de sa femme, le rate ou le casse en morceaux et le pose sur une plate-forme accrochée au mur (ce qui donne aux chairs une fermeté miraculeuse dans cette position)",1966-01-14,https://www.lemonde.fr/archives/article/1966/01/14/la-jeune-peinture-dans-les-fourgons-du-pop_2702270_1819218.html,1966
"Les évocations qui précèdent sont à leur tour le constat du Salon ; si l'on y perçoit de l'ironie, c'est qu'il est impossible de le décrire sans prêter à sourire (même si beaucoup des œuvres qu'il expose ont été accomplies dans l'effort et la foi), comme il est impossible de passer sans rire devant certaines de ses propositions : par exemple, devant cette maquette animée d'un fœtus oscillant et d'une danseuse de cancan faisant le grand écart parmi une panoplie de compteurs, le tout intitulé Les femmes et les enfants d'abord",1966-01-14,https://www.lemonde.fr/archives/article/1966/01/14/la-jeune-peinture-dans-les-fourgons-du-pop_2702270_1819218.html,1966
Et plus nettement encore la jeune femme sur canapé d'Aillaud pourrait être d'un élève de Derain et datée d'entre les deux guerres si elle ne figurait pas sous le titre Titania ou l'Heure fatale,1966-01-14,https://www.lemonde.fr/archives/article/1966/01/14/la-jeune-peinture-dans-les-fourgons-du-pop_2702270_1819218.html,1966
" Et c'est aux pages profondément tristes et sans révolte de Monteverdi ou de Vittoria que fait penser cette œuvre de deuil, adieu un peu amer à l'homme et à la femme qui passent d'un monde à l'autre recueillis par les anges de James Joyce : "" Deux qui chantent et deux qui prient, et deux qui portent mon âme dans leurs mains amies",1966-01-20,https://www.lemonde.fr/archives/article/1966/01/20/requiescant-de-dallapiccola_2702951_1819218.html,1966
" Au cours de cette rencontre ont été évoqués les problèmes de l'emploi et de la main-d'œuvre, particulièrement ceux de la réduction de la durée du travail, de la condition de la femme salariée et du chômage",1966-01-21,https://www.lemonde.fr/archives/article/1966/01/21/le-conseil-economique-et-social-se-reunira-le-26-janvier_2702595_1819218.html,1966
"Les princes savent qu'ils dureront moins longtemps que le marbre de leurs palais et le métal de leurs couronnes; les jeunes femmes, que leurs parures survivront au fragile éclat de beauté qu'elles ornent",1966-01-21,https://www.lemonde.fr/archives/article/1966/01/21/le-discours-du-recipiendaire-du-severe-au-plaisant_3127929_1819218.html,1966
"Ses livres sont pleins de l'amour, de l'amour de la femme",1966-01-21,https://www.lemonde.fr/archives/article/1966/01/21/le-discours-du-recipiendaire-du-severe-au-plaisant_3127929_1819218.html,1966
"Chacun y découvrira ce qu'elle peut avoir de fort et d'exquis : le Portrait de Paul Cézanne, l'admirable Pommes et biscuits (vers 1880), le somptueux Rocher rouge (vers 1895), de Cézanne ; ce qu'elle peut avoir de tendre chez Renoir, dont le Paysage de neige de 1868 est une merveille de mauves et de gris et dont la bonne grâce est évidente, même dans l'abandon, et plus sensible encore dans cette dernière page du vieil artiste qu'est la Femme à la rose",1966-01-22,https://www.lemonde.fr/archives/article/1966/01/22/la-collection-paul-guillaume_2703381_1819218.html,1966
"Devant des tableaux rarement vus et devenus un peu légendaires, comme l'étrange Étreinte, pastel de 1903, la Femme au peigne, incisive et fluette, de 1906",1966-01-22,https://www.lemonde.fr/archives/article/1966/01/22/la-collection-paul-guillaume_2703381_1819218.html,1966
"Hélène Cadou, la femme du poète, mort en 1951, leur a remis ces textes pour manifester l'intérêt qu'elle prend à leurs activités",1966-01-22,https://www.lemonde.fr/archives/article/1966/01/22/la-maison-de-la-culture-de-bourges-edite-rene-guy-cadou_2703451_1819218.html,1966
Le président de la Ligue des droits de l'homme s'étonne qu'on ait incarcéré une jeune femme parce qu'elle avait donné asile à Figon,1966-01-27,https://www.lemonde.fr/archives/article/1966/01/27/m-mitterrand-nous-faisons-le-serment-d-atteindre-partout-ou-elles-se-trouvent-les-responsabilites-politiques_2702743_1819218.html,1966
" Il semble, d'après les premiers éléments de l'enquête, que la jeune femme s'est volontairement jetée sous l'autorail en entraînant ses enfants dans la mort",1966-01-27,https://www.lemonde.fr/archives/article/1966/01/27/une-jeune-femme-se-jette-sous-un-autorail-avec-ses-deux-enfants_2702784_1819218.html,1966
"Wayne Hays, représentant démocrate de l'Ohio, a affirmé que la femme d'un employé civil américain au Vietnam du Sud avait expédié aux États-Unis, au cours de ces six derniers mois, 36 000 dollars sous forme de mandats postaux",1966-01-28,https://www.lemonde.fr/archives/article/1966/01/28/corruption-et-marche-noir-au-vietnam-du-sud_2701908_1819218.html,1966
"Perrin et les conclusions du commissaire du gouvernement Fournier) ; l'un des arrêts rejette la requête formée par une femme contre le refus d'acquisition de la nationalité française par mariage, refus fondé sur des motifs de moralité dont l'intéressée contestait l'exactitude",1966-01-29,https://www.lemonde.fr/archives/article/1966/01/29/les-mesures-de-decheance-ou-de-refus-de-la-nationalite_2703538_1819218.html,1966
" De même, il n'est pas vrai que Mireille Darc-Galia incarne un nouveau type de femme",1966-01-31,https://www.lemonde.fr/archives/article/1966/01/31/galia_2703103_1819218.html,1966
"Tandis que les organisations les plus modérées et les milieux gouvernementaux parlaient à l'envi de "" décolonisation de la femme mariée "", un certain nombre d'associations, comme le Mouvement démocratique féminin ou la Ligue française pour le droit des femmes, des personnalités comme Mme Thome-Patenôtre, du Rassemblement démocratique, maire de Rambouillet et vice-présidente de l'Assemblée nationale, attaquaient bientôt le projet qualifié de "" réformette """,1966-02-02,https://www.lemonde.fr/archives/article/1966/02/02/la-reforme-des-regimes-matrimoniaux-ne-fait-pas-l-unanimite_2705216_1819218.html,1966
"Lorsque les trois corps Jurent trouvés par les pompiers, alertés par les voisins qui avaient décelé une fuite de gaz dans l'appartement, on put croire un moment que dans une crise d'éthylisme le mari avait tué sa femme et son enfant, puis s'était donné la mort en ouvrant les robinets de la cuisinière",1967-01-03,https://www.lemonde.fr/archives/article/1967/01/03/un-jeune-pompier-etait-l-auteur-du-triple-assassinat-de-levallois_2608485_1819218.html,1967
"Mais ne me demandez pas pourquoi j'ai d'abord happé mon ami, puis pourquoi j'ai assassiné sa femme et son enfant, devait-il dire",1967-01-03,https://www.lemonde.fr/archives/article/1967/01/03/un-jeune-pompier-etait-l-auteur-du-triple-assassinat-de-levallois_2608485_1819218.html,1967
"Selon les autorités locales, quatre villageois, dont deux enfants et une jeune femme, ont été tués",1967-01-03,https://www.lemonde.fr/archives/article/1967/01/03/un-village-cambodgien-a-ete-attaque-vendredi-par-les-americains-et-les-sud-vietnamiens_2609491_1819218.html,1967
"ont trouvé à leur arrivée était lamentable : femmes en pleurs, hommes et enfants prostrés, le visage défiguré par la douleur",1967-01-03,https://www.lemonde.fr/archives/article/1967/01/03/un-village-cambodgien-a-ete-attaque-vendredi-par-les-americains-et-les-sud-vietnamiens_2609491_1819218.html,1967
Ma femme se joint à moi pour vous prier de partager avec Mme Johnson l'assurance de nos sentiments très cordiaux,1967-01-04,https://www.lemonde.fr/archives/article/1967/01/04/le-general-de-gaulle-appelle-de-nouveaux-progres-dans-la-voie-de-l-amitie-et-de-la-cooperation-entre-paris-et-bonn_2609806_1819218.html,1967
Les jolies femmes qui voltigent dans les salons à la mode et les élégants officiers qui jouent gaiement le jeu de l'amour et du hasard ne sont guère épargnés,1967-01-05,https://www.lemonde.fr/archives/article/1967/01/05/julie-de-chaverny_2610708_1819218.html,1967
Françoise Dorléac a bien fait sentir ce qu'il y avait de raide et d'altier chez cette jeune femme qui ne peut se pardonner un moment d'abandon,1967-01-05,https://www.lemonde.fr/archives/article/1967/01/05/julie-de-chaverny_2610708_1819218.html,1967
Nicolas d'Espine était le fils de Pierre d'Espine et de sa femme née Catherine Sarasin,1967-01-05,https://www.lemonde.fr/archives/article/1967/01/05/la-justice-va-rouvrir-le-dossier-de-l-affaire-d-espine_2610076_1819218.html,1967
"45, le leader algérien, accompagné de sa femme et de son beau-frère, sortait de son domicile madrilène, rue Saint-François-de-Sales, situé à l'entrée du quartier résidentiel qui mène à la cité universitaire",1967-01-05,https://www.lemonde.fr/archives/article/1967/01/05/les-deux-meurtriers-attendaient-le-leader-algerien-devant-son-domicile-a-madrid_3110971_1819218.html,1967
"Sa femme et son beau-frère transportèrent la victime, dans un taxi, à la clinique de la Conception, distante de quelque 700 mètres du lieu de l'attentat",1967-01-05,https://www.lemonde.fr/archives/article/1967/01/05/les-deux-meurtriers-attendaient-le-leader-algerien-devant-son-domicile-a-madrid_3110971_1819218.html,1967
"Deux femmes, Mme André Passet, quarante-six ans, et Annick Carrère, vingt ans, ont été tuées à coups de revolver mercredi après-midi dans un appartement d'une cité H",1967-01-06,https://www.lemonde.fr/archives/article/1967/01/06/deux-morts_2610261_1819218.html,1967
" Louis Carrère, qui, au moment de son arrestation, était ivre, est l'auteur de ce double meurtre ; il a agi sous le coup de la colère : sa femme",1967-01-06,https://www.lemonde.fr/archives/article/1967/01/06/deux-morts_2610261_1819218.html,1967
"La première mondiale du nouveau film de Charlie Chaplin, la Comtesse de Hong-Kong, a eu lieu jeudi soir au Carlton, cinéma de Londres, en présence du réalisateur, de sa femme Oona et de huit de leurs enfants",1967-01-07,https://www.lemonde.fr/archives/article/1967/01/07/le-dernier-film-de-charlie-chaplin-est-tres-mal-accueilli-par-la-presse-anglaise_2610554_1819218.html,1967
"A Angers, Mme Millot, femme de l'ancien député et maire gaulliste, affrontera M",1967-01-07,https://www.lemonde.fr/archives/article/1967/01/07/les-elus-ve-republique-formeront-ils-un-seul-groupe_2610598_1819218.html,1967
Richard Paris avait en effet choisi de se donner la mort en compagnie de sa femme en tirant dans sa chambre sur une cartouche de dynamite,1967-01-10,https://www.lemonde.fr/archives/article/1967/01/10/l-explosion-de-las-vegas-est-due-a-un-deserteur-qui-a-voulu-se-donner-la-mort_2609280_1819218.html,1967
Richard Paris et sa femme figurent parmi les huit victimes,1967-01-10,https://www.lemonde.fr/archives/article/1967/01/10/l-explosion-de-las-vegas-est-due-a-un-deserteur-qui-a-voulu-se-donner-la-mort_2609280_1819218.html,1967
"Sun Chihkuang, serait parti avec sa femme pour Pékin",1967-01-11,https://www.lemonde.fr/archives/article/1967/01/11/les-diplomates-chinois-en-vacances-veulent-feter-le-nouvel-an-chinois_2609564_1819218.html,1967
"Il est vrai que la mère de Jean Guitton ne s'intéressait pas directement à la philosophie ; mais outre que c'était une femme cultivée, qui réfléchissait intelligemment sur ce qu'elle lisait, elle était, d'autre part, sérieusement religieuse, et elle vivait sa vie d'épouse et de mère, elle transférait ses affections et ses vertus à un niveau de spiritualité consciente où la philosophie se trouvait concernée sous un biais profond : "" Plus de problèmes ici, dit bien Jean Guitton, mais, antérieur à tous les problèmes, le mystère qui les précède",1967-01-11,https://www.lemonde.fr/archives/article/1967/01/11/les-portraits-de-jean-guitton_2611028_1819218.html,1967
"Si bien que "" la famille "" passe au second plan de ses préoccupations, et qu'il en est de même pour la femme du pasteur qui, d'une manière très générale, seconde son mari dans son ministère",1967-01-13,https://www.lemonde.fr/archives/article/1967/01/13/celibat-et-ministere-pastoral_2609401_1819218.html,1967
"Daniel Parker, fils de pasteur, souligne de son côté : "" L'admirable ministère que poursuivent avec discrétion et dévouement bon nombre de femmes de pasteurs",1967-01-13,https://www.lemonde.fr/archives/article/1967/01/13/celibat-et-ministere-pastoral_2609401_1819218.html,1967
" En complet bleu marine, les cheveux argent, l'œil vif, souriant, d'une jeunesse étonnante à soixante-dix-sept ans, accompagné de sa femme et de deux de ses filles, Josephina, dix-sept ans, et Virginia, quinze ans, le "" petit homme "", pris sous un feu roulant de questions, a voulu répondre, au cours de sa conférence de presse, aux attaques subies par sa Comtesse dans la presse britannique",1967-01-13,https://www.lemonde.fr/archives/article/1967/01/13/charlie-chaplin-defend-la-comtesse-de-hong-kong_2609917_1819218.html,1967
"A la place de l'époux, mort, un inconnu se présente, dans l'espoir de s'enfuir, et la femme accepte de démontrer aux officiers qu'il s'agit bien de son mari",1967-01-28,https://www.lemonde.fr/archives/article/1967/01/28/les-ancetres-redoublent-de-ferocite-de-kateb-yacine-la-grande-imprecation-devant-les-murs-de-la-ville-de-tankred-dorst_2610952_1819218.html,1967
"Sans pouvoir se concerter et menacés de mort s'ils se contredisent, les deux héros s'inventent un passé commun - rencontre, mariage, vie quotidienne, inondation, dettes, meurtre d'un usurier - jusqu'à ce que le faux époux préfère, comme le vrai, les hasards du combat à ce simulacre de vie misérable, et laisse la femme crier de nouveau sa solitude d'opprimée",1967-01-28,https://www.lemonde.fr/archives/article/1967/01/28/les-ancetres-redoublent-de-ferocite-de-kateb-yacine-la-grande-imprecation-devant-les-murs-de-la-ville-de-tankred-dorst_2610952_1819218.html,1967
"C'est la femme "" totem """,1967-01-28,https://www.lemonde.fr/archives/article/1967/01/28/les-collections-de-printemps_2610847_1819218.html,1967
"- Inculpés de non - assistance à personne en danger, six témoins d'une scène dramatique : une jeune femme accouchant la nuit dans la rue, par une température de -10 degrés, ont comparu jeudi devant le tribunal de Mulhouse",1967-01-28,https://www.lemonde.fr/archives/article/1967/01/28/les-temoins-indifferents-d-un-accouchement-dramatique-sont-condamnes-par-le-tribunal-de-mulhouse_2611065_1819218.html,1967
"Dans leur désarroi, les deux jeunes femmes précipitèrent ensuite le nouveau-né dans la chaudière de l'établissement où elles travaillaient",1967-01-28,https://www.lemonde.fr/archives/article/1967/01/28/les-temoins-indifferents-d-un-accouchement-dramatique-sont-condamnes-par-le-tribunal-de-mulhouse_2611065_1819218.html,1967
"("" Tandis que nous autres, les sociaux-démocrates classiques, perdions notre temps, à des tâches d'éducation, d'agitation et de formation, un génie indépendant prenait les choses en main et rien qu'en assassinant et en éventrant quatre femmes, il convertissait la presse des possédants à une sorte de communisme absurde "", écrivait alors, avec humour noir, G",1967-01-30,https://www.lemonde.fr/archives/article/1967/01/30/sherlock-holmes-contre-jack-l-eventreur_2609803_1819218.html,1967
"Etonnant décor de cour des miracles que ces "" pubs "" du quartier des docks, ces asiles de bienfaisance et ces soupes populaires, suintants de misère et de brouillard, pimpants de crasse, où résonnent parfois les cris d'horreur qui saluent la découverte, dans le ruisseau, d'une femme un couteau planté en travers de la gorge",1967-01-30,https://www.lemonde.fr/archives/article/1967/01/30/sherlock-holmes-contre-jack-l-eventreur_2609803_1819218.html,1967
" Cheveux courts, recouverts de grands chapeaux de gardian, de képis de majorette ou de mini-melons, silhouette au buste menu et court, d'où s'évase en corolle une jupe très ample, tissus à pois, volants festonnés, grands cols Claudine ornés de cravates droites ou lavallière, Jean Pommarède, chez Jacques Heim, a imaginé pour le printemps une collection pour la femme qui veut paraître vingt ans",1967-01-31,https://www.lemonde.fr/archives/article/1967/01/31/jeu-de-jambes_2609470_1819218.html,1967
" Le chef du gouvernement détaille alors ce que recouvre pour lui le progrès et, dans son énumération, on relève au passage "" la libération de la femme menée à son terme dans tous les domaines "", "" un effort accru en matière de logement "", "" la mise en œuvre progressive, mais résolue, de l'association des travailleurs aux profits comme aux responsabilités de l'économie ""; bref, souligne-t-il, "" une synthèse de ce qu'il y a de meilleur dans les traditions de la droite et de la gauche """,1967-02-02,https://www.lemonde.fr/archives/article/1967/02/02/la-presentation-des-candidats-de-la-majorite-et-la-preparation-des-elections_3144162_1819218.html,1967
Il y vivait si bien avec sa femme qu'il en tirait chaque jour plaisir et ne rechignait pas au travail,1968-01-03,https://www.lemonde.fr/archives/article/1968/01/03/inedit-joao-guimaraes-rosa-fatalite_3067743_1819218.html,1968
"Mais, guidé par le mal, un chercheur de noises était venu tout changer en enfer, un étranger qui s'était fougueusement entiché de sa femme et lui lançait des regards incendiaires",1968-01-03,https://www.lemonde.fr/archives/article/1968/01/03/inedit-joao-guimaraes-rosa-fatalite_3067743_1819218.html,1968
À peine sa femme mettait-elle le pied hors de la porte que l'homme surgissait pour la couver des yeux et lui faire affront avec ses intentions déshonnêtes,1968-01-03,https://www.lemonde.fr/archives/article/1968/01/03/inedit-joao-guimaraes-rosa-fatalite_3067743_1819218.html,1968
" Comme ennuis et vexations se succédaient, sa femme et lui n'avaient trouvé qu'une solution : ils décidèrent de déménager",1968-01-03,https://www.lemonde.fr/archives/article/1968/01/03/inedit-joao-guimaraes-rosa-fatalite_3067743_1819218.html,1968
"Et ce fut encore plus difficilement, presque en cachette, que José Demicentre et sa femme purent s'enfuir, ayant grand chagrin",1968-01-03,https://www.lemonde.fr/archives/article/1968/01/03/inedit-joao-guimaraes-rosa-fatalite_3067743_1819218.html,1968
"Il objecte modestement que, peu capable de subvenir à ses propres besoins, il ne saurait pourvoir, par surcroît, à ceux d'une femme",1968-01-03,https://www.lemonde.fr/archives/article/1968/01/03/la-bible-en-espagne_2512938_1819218.html,1968
"L'homme minuscule au pied des buildings qu'il a lui-même construits et qui lui cachent le soleil, l'homme ahuri dans les foules, l'homme abasourdi de publicités et d'agressives propagandes, l'homme enrégimenté par la guerre et par le travail, mais encore plus abruti par les loisirs qui lui sont proposés, devait bien découvrir que ses vrais ennemis n'étaient pas la jeune femme dépensière ni la matrone de mauvaise humeur",1968-01-03,https://www.lemonde.fr/archives/article/1968/01/03/le-nouvel-humour-graphique-en-france_2511296_1819218.html,1968
"Réfugié dans un laboratoire inutile, il échappe ainsi à la vie et à sa femme",1968-01-05,https://www.lemonde.fr/archives/article/1968/01/05/deuxieme-chaine-theatre-americain-albee-et-schisgall_3067637_1819218.html,1968
 Il semble que ce soit à la suite de l'hospitalisation de sa femme que M,1968-01-05,https://www.lemonde.fr/archives/article/1968/01/05/un-pere-de-famille-entraine-ses-deux-enfants-dans-la-mort_2512864_1819218.html,1968
"Elle, au visage étrange et beau, à la voix vibrante et dramatique de femme passionnée, d'une exigence absolue ; lui, solaire et solitaire, prisonnier volontaire de l'obscurité et du secret, tremblant pourtant de l'espérance d'un salut qu'il refuse",1968-01-08,https://www.lemonde.fr/archives/article/1968/01/08/evelyn-lear-et-thomas-stewart-a-prestige-de-la-musique_2511004_1819218.html,1968
"Cette femme, c'est Emmanuelle Riva ; cette pièce, c'est une réflexion-rêverie sur le temps, le temps qui nous est imparti, le temps qui détruit, qui fait que tout change, que tout s'efface et parfois ressurgit : l'amour, l'amitié, le devoir",1968-01-09,https://www.lemonde.fr/archives/article/1968/01/09/la-journee-d-une-reveuse_2512812_1819218.html,1968
"Dupertuis, a été emporté : une femme et son fils de dix ans ont été tués",1968-01-10,https://www.lemonde.fr/archives/article/1968/01/10/bull-la-seine-la-loire-et-de-nombreux-bull-vague-de-froid-sur-le-canada-cours-d-eau-en-crue-et-a-new-york_3067696_1819218.html,1968
"Trois portraits de femmes (3), dans l'élégante et exigeante collection des Soirées du Luxembourg, font revivre une grande dame anglaise au XVIIIe siècle, la duchesse de Devonshire ; une princesse autrichienne qui devint comtesse d'Albany par son mariage avec Charles-Édouard Stuart, avant d'être la maîtresse du poète italien Alfieri et du peintre français Fabre : une parfaite Européenne, on le voit ; enfin, la très étonnante Henriette-Marie de France, sœur de Louis XIII, épouse de Charles Ier et mère d'Henriette d'Angleterre, beaux noms qui réveillent dans nos mémoires les phrases les plus solennelles de Bossuet",1968-01-10,https://www.lemonde.fr/archives/article/1968/01/10/monplaisir-en-litterature-de-paul-morand-survie-d-andre-maurois_2512003_1819218.html,1968
"En 1928, André Maurois a fait avec sa seconde femme un séjour en Angleterre ; il imagine ce que Proust aurait écrit si c'eût été lui qui eût vu ce qu'il voyait ; c'est un exercice d'une virtuosité extraordinaire, où le plus habile pasticheur se trouve le mieux pastiché",1968-01-10,https://www.lemonde.fr/archives/article/1968/01/10/monplaisir-en-litterature-de-paul-morand-survie-d-andre-maurois_2512003_1819218.html,1968
"Une expédition française, patronnée par le ministère de la jeunesse et des sports, et dirigée par François Guillot, entouré de Jacques Desautel, Claude Duviller, Bernard Amy, Jacques Klèle, Pierre Divialhet, le docteur Eyssen et sa femme, Joël Coqueugnot, Vincent Baurges et Jacques Membre, est arrivée mardi à Rio-Gallegos (Argentine), où elle s'apprête à tenter par la face orientale l'escalade du Fitzroy, situé dans la cordillère sud des Andes, à une altitude de 3 378 mètres",1968-01-11,https://www.lemonde.fr/archives/article/1968/01/11/alpinisme_2512844_1819218.html,1968
"Le style néoromantique sera seyant aux femmes qui, ces dernières saisons, étaient quelque peu négligées au profit de leurs filles, votre de leurs petites filles",1968-01-11,https://www.lemonde.fr/archives/article/1968/01/11/chez-les-couturiers-le-printemps-s-annonce-neo-romantique_2512210_1819218.html,1968
" Gérard Pipart, de Nina Ricci, prend pour thème la "" femme-fleur "", qui gardera ses jupes courtes et amples avec des vestes longues",1968-01-11,https://www.lemonde.fr/archives/article/1968/01/11/chez-les-couturiers-le-printemps-s-annonce-neo-romantique_2512210_1819218.html,1968
" Le donneur - une jeune femme de vingt-neuf ans - était atteint d'une tumeur au cerveau et hospitalisé à 40 kilomètres de New-York, lorsque, son état s'étant brusquement aggravé, les médecins de service, redoutant une issue fatale imminente, prirent l'initiative d'alerter le professeur Kantrowitz, puis de diriger la moribonde sur l'hôpital Maimonides",1968-01-11,https://www.lemonde.fr/archives/article/1968/01/11/echec-d-une-nouvelle-greffe-de-c-ur-aux-etats-unis_2511019_1819218.html,1968
"Si la femme règne à la maison, elle n'y gouverne pas, l'interdiction du divorce crée des situations troubles et sans issue, et le scandale que provoque ici Anne en aimant un homme marié, depuis longtemps d'ailleurs séparé de sa femme, n'a pas les mêmes conséquences, ne soulève pas les mêmes problèmes en France qu'en Italie",1968-01-11,https://www.lemonde.fr/archives/article/1968/01/11/le-cahier-interdit_2512013_1819218.html,1968
", de préconiser une politique de formation professionnelle des femmes, seule capable de combattre les discriminations de salaires entre les deux sexes (20 % en moyenne), d'intéresser davantage les femmes à leur travail, d'accroître l'efficacité de l'inspection du travail pour combattre les horaires et les cadences excessifs et les conditions d'hygiène souvent défectueuses (Mme Sartin cite le cas d'une banque qui demande à ses mécanographes 18 000 perforations à l'heure, alors que l'administration française en demande en moyenne de 8 à 10 000)",1968-01-11,https://www.lemonde.fr/archives/article/1968/01/11/le-poids-des-traditions-freine-l-emploi-feminin-dont-le-gouvernement-souhaite-pourtant-le-developpement_2513614_1819218.html,1968
