Text,link,year,aspect,sentiment,prob
Tandis que Cédric enfouit son nez dans les paillettes des Folies Caumartin et visite le Louvre raconte t il avec Joséphine Baker Emmeline fait la sieste près d un garage surchauffé avec le frère de la gitane Marianca le mat Matt,https://www.lemonde.fr/archives/article/1987/02/20/les-passions-partagees-de-felicien-marceau-une-course-allegre-au-bonheur_4029106_1819218.html,1987.0,frère,Negative,0.6175258755683899
Il revient à Marcel Paoli en sa qualité d adjoint aux affaires culturelles de la ville d avoir eu l intelligence d insérer ce mouvement spontané et proliférant dont le grand frère fut Maurice Vinçon et son Mini Théâtre issu du mouvement associatif dans une politique d ensemble,https://www.lemonde.fr/archives/article/1987/02/20/marseille-les-saltimbanques-dans-leur-quartier_4029081_1819218.html,1987.0,frère,Positive,0.9303189516067505
Sandra Macchi est notre contemporaine le petit Louis vivait probablement au siècle dernier frère Servat au Moyen Age Bartolomé Torres fut le compagnon de Christophe Colomb Pauline Coenius est une patricienne romaine du troisième siècle après Jésus Christ,https://www.lemonde.fr/archives/article/1987/02/20/une-esthetique-de-l-insolite_4029101_1819218.html,1987.0,frère,Neutral,0.9119146466255188
Pour Ovando le sculpteur des chapiteaux de l église de frère Servat c est un symbole rapporté d Orient l oeil du chien,https://www.lemonde.fr/archives/article/1987/02/20/une-esthetique-de-l-insolite_4029101_1819218.html,1987.0,frère,Negative,0.45564740896224976
L ancien directeur général de la BBC Sir Hugh Carleton Greene frère de l écrivain Graham Greene est décédé jeudi 19 février à l âge de soixante seize ans,https://www.lemonde.fr/archives/article/1987/02/22/la-mort-de-sir-hugh-c-greene-ancien-directeur-general-de-la-bbc_4029779_1819218.html,1987.0,frère,Neutral,0.9275162220001221
Il est obsédé par son frère arrêté devant lui quand il était gamin au Chili probablement torturé et abattu,https://www.lemonde.fr/archives/article/1987/02/24/festival-de-berlin-huis-clos_4029908_1819218.html,1987.0,frère,Negative,0.875212550163269
Et comme sonne faux ensuite cette demande du droit à la différence pour les religions et qu il refuse à son frère,https://www.lemonde.fr/archives/article/1988/01/08/juifs-et-chretiens-reponses-a-elie-wiesel-intolerance_4069842_1819218.html,1988.0,frère,Negative,0.9211454391479492
Le Nouvel Orchestre philharmonique et les choeurs de Radio France captivés par ce Berlioz très intense donnaient le meilleur d eux mêmes avec en soliste la voix sombre de Sara Walker chantant la tristesse de Roméo les délicieuses gamineries du ténor Frédérick Plantak et l émouvant frère Laurence de Laurence Albert un Noir américain de grande allure qui a besoin d étoffer beaucoup ses aigus,https://www.lemonde.fr/archives/article/1988/01/09/romeo-et-juliette-de-berlioz-aux-champs-elysees-john-nelson-le-berliozien_4069880_1819218.html,1988.0,frère,Positive,0.9397640228271484
Depuis quelque temps et surtout depuis l arrivée du réformateur soviétique au pouvoir l Afghanistan n est plus que le moindre des trois obstacles que Pékin voit à une normalisation de ses relations politiques avec l ex grand frère socialiste,https://www.lemonde.fr/archives/article/1988/01/10/afghanistan-la-pravda-critique-l-attitude-de-m-mitterrand-et-de-m-chirac-dans-l-affaire-guillo_4070536_1819218.html,1988.0,frère,Positive,0.8849679827690125
La soeur de Nijinski a manifesté le désir de danser un ballet qui avait été créé par son frère l Après midi d un faune de Debussy,https://www.lemonde.fr/archives/article/1988/01/13/picasso-theatre-un-livre-de-douglas-cooper-pour-les-beaux-yeux-d-olga_4071816_1819218.html,1988.0,frère,Neutral,0.9639730453491211
Son frère cadet et lui vivent dans un pavillon du côté de Bièvre sous la garde de trois femmes,https://www.lemonde.fr/archives/article/1988/01/15/remise-de-peine-de-patrick-modiano-l-invitation-de-claude-simon-deux-facons-d-envouter_4063234_1819218.html,1988.0,frère,Neutral,0.826625645160675
La panne récente du satellite allemand TV Sat frère jumeau de TDF 1 avait donné un avantage de poids à la DGT le gouvernement semblait prêt à lui concéder l exclusivité pour les prochaines années de la télévision par satellite,https://www.lemonde.fr/archives/article/1988/01/17/la-panne-du-satellite-telecom-1-b-le-relais-des-emissions-de-la-cinq-de-m-6-et-de-nombreuses-radios-privees-a-ete-interrompu_4062633_1819218.html,1988.0,frère,Negative,0.6874710321426392
Le frère Angelo de Mojana soixante dix septième Grand Maitre de l ordre souverain de Malte est mort le lundi 18 janvier à Rome à l âge de quatre vingt deux ans,https://www.lemonde.fr/archives/article/1988/01/20/deces-du-grand-maitre-de-l-ordre-de-malte_4063939_1819218.html,1988.0,frère,Negative,0.7685586810112
_ Je vais reprendre la comparaison avec une famille lorsque votre soeur se marie il n est écrit nulle part que vous seriez obligé d avoir de bonnes relations avec votre beau frère,https://www.lemonde.fr/archives/article/1988/01/20/les-negociations-sur-le-desarmement-et-le-25e-anniversaire-du-traite-de-l-elysee-le-chancelier-kohl-expose-au-monde-sa-conception-de-la-securite-europeenne-on-ne-peut-defendre-stra_4063993_1819218.html,1988.0,frère,Positive,0.979488730430603
C est actuellement le père de Mme Oufkir et son frère qui s occupent du règlement des litiges et de la gestion des biens par procuration,https://www.lemonde.fr/archives/article/1988/01/20/maroc-les-autorites-font-etat-d-une-nouvelle-demande-d-audience-de-mme-oufkir-au-roi_4063901_1819218.html,1988.0,frère,Neutral,0.9346103072166443
Et point seulement les siennes avec le marchand comparaissent ses peintres cubistes et surréalistes Masson à leur tête ses poètes et ses critiques Apollinaire Max Jacob Salmon et ses familiers Leiris le beau frère ethnologue et écrivain Gris le favori et Picasso enfin le diable incarné,https://www.lemonde.fr/archives/article/1988/01/22/biographiel-homme-de-l-art-et-des-dollars_4067917_1819218.html,1988.0,frère,Positive,0.9356322288513184
Or à la suite du grand frère nippon ces nouveaux pays industrialisés font des percées fulgurantes sur le marché nord américain,https://www.lemonde.fr/archives/article/1988/01/22/un-article-du-ministre-du-commerce-exterieur-l-europe-dans-ses-frontieres_4067243_1819218.html,1988.0,frère,Positive,0.9025927782058716
Voilà donc aussi ce qu aurait été le scandale inoubliable dont parle Leopold II au comte de Flandre son frère,https://www.lemonde.fr/archives/article/1988/01/25/les-revelations-du-baron-gilbert_4416863_1819218.html,1988.0,frère,Negative,0.7601737976074219
Mais si l un se tourne vers son frère et le traite de Cain Si l un veut dominer l autre et cherche à l humilier Ils commencent à délirer un délire tragique,https://www.lemonde.fr/archives/article/1988/01/26/si-l-un-veut-dominer-l-autre_4066636_1819218.html,1988.0,frère,Negative,0.9705356955528259
Son frère de coeur Pierre Goldmann faute d avoir pu faire partie des tueurs sacrés de l Affiche rouge avait élu pour champ de bataille la délinquance à main armée,https://www.lemonde.fr/archives/article/1988/01/27/la-mort-d-ania-francos_4067330_1819218.html,1988.0,frère,Negative,0.6410182118415833
Elle s élève sur l emplacement d un hôtel particulier où Napoléon Bonaparte avait installé en cadeau de noces son frère Louis et sa bru Hortense 1802,https://www.lemonde.fr/archives/article/1988/01/30/la-synagogue-de-la-victoire-vue-par-raymond-moretti_4068668_1819218.html,1988.0,frère,Neutral,0.7272838950157166
Ici c est une oreille qui plaide pour le versant ibérique des Demoiselles là un profil de jeune homme celui de l étudiant qui ressemble comme un frère à un autoportrait et à la tête en calcaire de Cerro de los Santos cinquième troisième siècle avant Jésus Christ exposée avec prudence parmi les choses vues avant ou pendant que Picasso travaillait aux Demoiselles du Bain turc d Ingres aux Baigneuses de Cézanne plus convaincantes de connivence en passant par la Vision de saint Jean du Gréco peut être encore également plus convaincant une céramique de Gauguin soit,https://www.lemonde.fr/archives/article/1988/01/30/les-demoiselles-d-avignon-au-musee-picasso-la-genese-d-un-tableau_4068698_1819218.html,1988.0,frère,Negative,0.9537185430526733
LE 10 juin 1889 Vincent Van Gogh écrivait à son frère Théo Un jour ou un autre je crois que je trouverai moyen de faire une exposition à moi dans un café,https://www.lemonde.fr/archives/article/1988/02/04/tourisme-et-patrimoine_4070712_1819218.html,1988.0,frère,Neutral,0.8806448578834534
Il n a aucune notoriété sinon celle d être le frère de Théo Van Gogh honorablement connu dans la corporation des marchands de tableaux et fort bien introduit dans le milieu des modernes peintres impressionnistes ou peintres plus jeunes élèves des premiers,https://www.lemonde.fr/archives/article/1988/02/04/une-exposition-au-musee-d-orsay-van-gogh-le-parisien_4070709_1819218.html,1988.0,frère,Positive,0.9707499146461487
Secrétaire de Mathieu Dreyfus frère du condamné il compte sur la notoriété de l écrivain pour soulever la chape de silence qui s est abattue depuis sa condamnation sur le bagnard de Cayenne dont la famille s acharne à établir l innocence contre l armée la justice et l Etat,https://www.lemonde.fr/archives/article/1988/02/07/il-y-a-quatre-vingt-dix-ans-zola-devant-ses-juges_4072110_1819218.html,1988.0,frère,Neutral,0.8575366735458374
De Benedetti et Minc ces dernières semaines aucun Belge ne les a rejoints ni Albert frère le patron du groupe Bruxelles Lambert resté d une prudente neutralité ni la Krediet Bank pourtant chargée de l OPA de Cerus ni aucun autre,https://www.lemonde.fr/archives/article/1988/02/10/la-generale-ne-pourra-pas-augmenter-son-capital-lecon-belge-pour-l-europe_4063427_1819218.html,1988.0,frère,Neutral,0.4923301637172699
Il est vrai qu il lui est reproché d avoir entrainé dans le mouvement son frère et Frédérique Germain,https://www.lemonde.fr/archives/article/1988/02/14/au-tribunal-correctionnel-de-paris-peine-maximum-pour-les-dirigeants-d-action-directe_4065471_1819218.html,1988.0,frère,Negative,0.8961666226387024
Jacques Chirac serait plutôt le frère ainé qu on a du mal à suivre trop écrasant et ne laissant aux autres que des jouets abimés,https://www.lemonde.fr/archives/article/1988/02/14/des-hommes-et-une-femme_4066165_1819218.html,1988.0,frère,Negative,0.9932389259338379
La mère de l enfant le frère de celle ci et l amie du frère ont été placés en garde à vue dans les locaux de la Brigade de protection des mineurs,https://www.lemonde.fr/archives/article/1988/02/14/mort-d-un-enfant-de-trois-ans_4065475_1819218.html,1988.0,"frère', 'frère","Negative', 'Negative","0.9348632097244263, 0.9348632097244263"
La mère de Jérémy divorcée employée de maison en banlieue parisienne avait confié la garde de l enfant à son frère et à l amie de celui ci,https://www.lemonde.fr/archives/article/1988/02/14/mort-d-un-enfant-de-trois-ans_4065475_1819218.html,1988.0,frère,Neutral,0.6069404482841492
Déjà Raul Castro le petit frère envoyé au début de 1958 dans la sierra de Cristal mène une brillante campagne dans l extrême pointe orientale de l ile réduisant l une après l autre les casernes des réguliers,https://www.lemonde.fr/archives/article/1989/01/01/il-y-a-trente-ans-castro-triomphe-a-cuba_3544891_1819218.html,1989.0,frère,Positive,0.6455234885215759
Zemlinski avouait d ailleurs avec franchise sa perplexité devant les audaces de Schoenberg qui était non seulement son ancien élève mais son beau frère sa vénération la plus absolue la plus illimitée pour Mahler la déclaration suit précisément les déflagrations de 1913,https://www.lemonde.fr/archives/article/1989/01/01/portraits-en-concert-zemlinski-l-ami-des-grands_4117110_1819218.html,1989.0,frère,Positive,0.9984281063079834
son frère Raul ministre de la défense numéro deux du régime affirme que un million de policiers ne suffirait pas à empêcher les vols dans les entreprises d Etat car le système lui même et le manque de responsabilités invitent les Cubains à commettre ces délits,https://www.lemonde.fr/archives/article/1989/01/03/trente-ans-apres-l-arrivee-au-pouvoir-de-fidel-castro-a-cuba-la-fievre-du-billet-vert_4116402_1819218.html,1989.0,frère,Neutral,0.7810642123222351
frère Roger l a compris depuis longtemps,https://www.lemonde.fr/archives/article/1989/01/05/trente-trois-mille-jeunes-reunis-a-paris-par-la-communaute-de-taize-l-europe-a-mains-jointes_4117671_1819218.html,1989.0,frère,Positive,0.4798813462257385
frère Roger qui n a pas fini d abattre des frontières rentrait de Madras en Inde où environ 10000 chrétiens asiatiques s étaient également réunis à l initiative de sa communauté et des autorités ecclésiastiques locales,https://www.lemonde.fr/archives/article/1989/01/05/trente-trois-mille-jeunes-reunis-a-paris-par-la-communaute-de-taize-l-europe-a-mains-jointes_4117671_1819218.html,1989.0,frère,Positive,0.9424772262573242
Son propre frère travaillait en étroite collaboration avec le principal accusé l homme d affaires Kemal Horzum actuellement en prison,https://www.lemonde.fr/archives/article/1989/01/06/turquie-mis-en-cause-dans-un-scandale-financier-le-vice-premier-ministre-demissionne_4118312_1819218.html,1989.0,frère,Negative,0.7338418364524841
Suivant qu il signe frère Patrick prieur du monastère de Bethléem à la recherche de fonds pour construire un nouveau monastère ou du nom du directeur de la clientèle privée de la Banque Indosuez pour vanter les mérites des services financiers de cette institution,https://www.lemonde.fr/archives/article/1989/01/07/une-dynastie-en-direct-philippe-bastide-pdg-de-courrier-plus_4119124_1819218.html,1989.0,frère,Neutral,0.514761745929718
frère et soeur incestueux Edouard et Elisabeth sont les guides de ce périple initiatique au coeur de la Terre,https://www.lemonde.fr/archives/article/1989/01/13/dernieres-livraisons_4122485_1819218.html,1989.0,frère,Positive,0.995016872882843
Aujourd hui DSM et sa centaine de filiales qui emploient vingt sept mille salariés dont les deux tiers aux Pays Bas est un groupe chimique moins important que son grand frère national Akzo ou que ses cousins allemands Hoechst BASF Bayer britannique ICI ou français Rhône Poulenc,https://www.lemonde.fr/archives/article/1989/01/14/la-chimie-a-bon-port_4121719_1819218.html,1989.0,frère,Positive,0.8647043108940125
_ et russophone qui lit toute la presse soviétique et regarde la télévision du grand frère,https://www.lemonde.fr/archives/article/1989/01/17/la-bulgarie-face-a-l-effet-gorbatchev-en-economie-velleites-de-perestroika-en-politique-resistance-determinee-a-la-transparence_4122421_1819218.html,1989.0,frère,Positive,0.7825470566749573
Lonrho avait entretenu des relations d affaires avec Mohamed et Ali Fayed de mars 1975 à juin 1976 la prise de participation par Lonrho de 20 du capital d une société Richard Costain Ltd fait entrer Mohamed Fayed au conseil d administration de Lonrho et son frère Ali devient un des directeurs de la compagnie,https://www.lemonde.fr/archives/article/1989/01/20/la-bataille-juridique-autour-de-la-firme-britannique-house-of-fraser-rebondit_4123750_1819218.html,1989.0,frère,Positive,0.9704274535179138
Un jour son frère Maurice de vingt ans plus âgé officier de marine reconverti dans la plus haute physique l attire dans son laboratoire,https://www.lemonde.fr/archives/article/1989/01/22/l-academie-francaise-a-recu-m-michel-debre-le-discours-du-recipiendaire_4125097_1819218.html,1989.0,frère,Negative,0.6012248396873474
Elu à l Académie française son frère l y reçoit,https://www.lemonde.fr/archives/article/1989/01/22/l-academie-francaise-a-recu-m-michel-debre-le-discours-du-recipiendaire_4125097_1819218.html,1989.0,frère,Positive,0.7417198419570923
_ Trop rares sont aussi les exhumations d oeuvres importantes du beau frère de Schoenberg premier prétendant et professeur de composition d Alma Malher,https://www.lemonde.fr/archives/article/1989/01/24/calendrier_4125203_1819218.html,1989.0,frère,Positive,0.9432936906814575
Drôle et douloureux Parents raconte en effet l histoire d un petit garçon chétif qui lui ressemble comme un frère et qui découvre que ses géniteurs sont cannibales,https://www.lemonde.fr/archives/article/1989/01/24/le-festival-du-film-fantastique-d-avoriaz-vous-avez-dit-etrange_4125205_1819218.html,1989.0,frère,Neutral,0.6445414423942566
Le grand frère s est gardé jusqu ici de décerner des blâmes ou des encouragements publics aux mauvais et aux bons élèves,https://www.lemonde.fr/archives/article/1989/02/01/les-droits-de-l-homme-a-l-est_4117953_1819218.html,1989.0,frère,Positive,0.7095706462860107
L exemple en est le contrat Pechiney qui pourrait être le frère ainé d une famille nombreuse et dont toutefois on ne peut être certain qu il sera fructueux en raison du risque pris en commun avec l entreprise sur le prix du dollar et de l aluminium,https://www.lemonde.fr/archives/article/1989/02/02/avec-une-perte-de-1-8-milliard-de-francs-en-1988-le-premier-souci-d-edf-reste-son-desendettement_4118495_1819218.html,1989.0,frère,Positive,0.7860146760940552
Kafka se sentaitd ailleurs le frère de tous les exilés,https://www.lemonde.fr/archives/article/1989/02/03/biographie-franz-kafka-groom-d-echafaud_4113166_1819218.html,1989.0,frère,Positive,0.597287654876709
Au fil de ses rencontres directeurs de galerie anciens professeurs demi frère belle mère ex mari amants autres artistes riches collectionneurs qui furent ses premiers acheteurs etc,https://www.lemonde.fr/archives/article/1989/02/03/la-verite-sur-alison-lurie_4113170_1819218.html,1989.0,frère,Positive,0.651675820350647
Le commandant Ahmad Shah Massoud un des principaux chefs de la résistance afghane a fait pendre quatre membres d un groupe rival accusés d avoir massacré trente de ses hommes dont six de ses lieutenants au cours d une embuscade en juillet dernier au nord du pays a annoncé le frère du commandant à Peshawar au Pakistan,https://www.lemonde.fr/archives/article/1990/01/02/afghanistan-le-commandant-massoud-a-fait-pendre-quatre-moudjahidines-d-un-groupe-rival_3974222_1819218.html,1990.0,frère,Neutral,0.9816785454750061
Ensuite parce que les mêmes qui n y ont rien à voir reconnaissaient il y a peu le parti du tyran comme un parti frère,https://www.lemonde.fr/archives/article/1990/01/04/la-contestation-au-sein-du-pcf-point-de-vue-avons-nous-merite-ca_3974869_1819218.html,1990.0,frère,Negative,0.8964521288871765
Son petit frère l admire et finalement ça n arrange rien car cette admiration oblige en quelque sorte Tony à se conduire en caid,https://www.lemonde.fr/archives/article/1990/01/13/cinema-la-prison-et-comment-en-sortir-reves-en-cage-de-john-n-smith-parvient-a-emouvoir-et-etonner-avec-un-sujet-rabache_3968932_1819218.html,1990.0,frère,Positive,0.8498787879943848
Paul Dhaille et Michel Bérégovoy le frère du ministre de l économie M,https://www.lemonde.fr/archives/article/1990/01/18/la-preparation-du-congres-de-rennes-la-neutralite-de-mme-cresson-et-de-m-dumas-traduit-la-reserve-de-m-mitterrand-vis-a-vis-de-m-jospin_3971024_1819218.html,1990.0,frère,Neutral,0.9394857287406921
Premier pays socialiste après l URSS la Mongolie a toujours suivi la ligne tracée par le grand frère soviétique,https://www.lemonde.fr/archives/article/1990/01/21/mongolie-manifestations-et-deboulonnage-d-une-statue-de-staline-oulan-bator-a-son-tour_3972314_1819218.html,1990.0,frère,Positive,0.9876468181610107
Mon frère est né il était beau intelligent correspondait aux voeux de mes parents,https://www.lemonde.fr/archives/article/1990/01/23/montana-pour-lanvin-le-dernier-en-date-des-grands-couturiers-presente-son-premier-defile-pour-la-haute-couture_3972938_1819218.html,1990.0,frère,Positive,0.9938619136810303
Son beau frère la conduit dans un quartier éloigné du centre de Bucarest,https://www.lemonde.fr/archives/article/1990/01/24/un-mois-apres-la-chute-de-ceausescu-et-la-fin-de-sa-politique-nataliste-les-roumaines-redecouvrent-l-avortement-libre_3973094_1819218.html,1990.0,frère,Positive,0.9324938058853149
Le frère de Milou Georges Michel Duchaussoy magnifique est correspondant du Monde à Londres marié à une comédienne Lily Harriet Walter qui ne joue guère,https://www.lemonde.fr/archives/article/1990/01/25/milou-en-mai-de-louis-malle-l-heritage-camarade_3973715_1819218.html,1990.0,frère,Positive,0.8766295313835144
Michel Platini est là à ses côtés et c est bien l essentiel pour cet enfant employé à la garde des chameaux dans la propriété de Cheikh Fahd Al Ahmed Al Sabah frère de l émir du Koweit,https://www.lemonde.fr/archives/article/1990/01/26/football-la-tournee-de-l-equipe-de-france-au-koweit-platini-papa-poule-et-soupe-au-lait_3974349_1819218.html,1990.0,frère,Positive,0.8592200875282288
Autour de cette table tournaient les soeurs bras dessus bras dessous devisant de politique de philosophie ou de religion quand elles n écrivaient pas chacune à leur pupitre dans le chuintement de la chandelle tandis qu au Black Bull leur frère étanchait sa soif et épanchait son âme en vrai fils d Irlande,https://www.lemonde.fr/archives/article/1990/01/27/a-l-enseigne-des-soeurs-bronte_3975081_1819218.html,1990.0,frère,Negative,0.5870406627655029
Actuellement placé à une vingtaine de kilomètres en dessous de Spot 1 le satellite du CNES auquel ont également participé la Belgique et la Suède devrait rejoindre l orbite de son grand frère lundi prochain,https://www.lemonde.fr/archives/article/1990/01/27/premieres-images-de-spot-2_3974988_1819218.html,1990.0,frère,Positive,0.9611791372299194
Son frère Abbas Hamade détenteur d un passeport allemand passait les contrôles sans difficulté,https://www.lemonde.fr/archives/article/1990/01/30/la-logique-et-l-improvisation-du-hezbollah_3975737_1819218.html,1990.0,frère,Positive,0.9043468832969666
Abdelaziz Gabsi trente huit ans a reçu des coups au visage tandis que son beau frère M,https://www.lemonde.fr/archives/article/1990/01/31/enquete-ouverte-sur-un-controle-d-identite-a-echirolles_3976997_1819218.html,1990.0,frère,Positive,0.8911349773406982
Le théâtre d hier celui de Shakespeare surtout admirablement cité par l auteur tant la figure du jeune homme dans ses accès de fièvre et d abattement de don de soi puis de repli anxieux d héroisme et de solitude en fait le frère d Hamlet,https://www.lemonde.fr/archives/article/1990/01/31/les-poetes-du-bout-du-monde-avec-le-baladin-du-monde-occidental-chef-d-oeuvre-de-synge-jacques-nichet-se-hisse-au-rang-des-grands-de-la-scene_3976354_1819218.html,1990.0,frère,Positive,0.5359717011451721
Le pétrole d Algérie les phosphates et les agrumes du Maroc le coton d Egypte les fruits secs turcs le cacao du Ghana la bauxite de Guinée ou l étain du Vietnam ont ainsi fait les choux gras du Grand frère et de ses alliés européens,https://www.lemonde.fr/archives/article/1990/02/01/l-est-colon-du-sud-le-bloc-communiste-a-longtemps-neglige-le-tiers-monde-dont-il-a-largement-profite_3967052_1819218.html,1990.0,frère,Positive,0.977779746055603
LA FASCINATION DU MAL Le solitaire à la tronçonneuse comme Freddy est le frère du tueur de baby sitters évaporées incarnation du Mal absolu qui avançait pesamment précédé de son souffle sifflant dans Halloween de John Carpenter _ dont le succès a fait naitre bien des répliques affadies,https://www.lemonde.fr/archives/article/1990/02/01/peur-et-exorcismes-de-l-an-2000_3977111_1819218.html,1990.0,frère,Negative,0.9819106459617615
Quand Michel Vieuchange meurt à Tiznit le 30 novembre dans les bras de son frère c est bien la fermeture parfaite du cercle qui s accomplit,https://www.lemonde.fr/archives/article/1990/02/02/desir-du-desert-en-1930-michel-vieuchange-traverse-une-partie-du-sahara-occidental-et-note-les-etapes-de-son-voyage-interieur_3969897_1819218.html,1990.0,frère,Positive,0.8741990923881531
Quand Michel Vieuchange meurt à Tiznit le 30 novembre dans les bras de son frère c est bien la fermeture parfaite du cercle qui s accomplit,https://www.lemonde.fr/archives/article/1990/02/02/desir-du-desert_3967826_1819218.html,1990.0,frère,Positive,0.8741990923881531
Quand Michel Vieuchange meurt à Tiznit le 30 novembre dans les bras de son frère c est bien la fermeture parfaite du cercle qui s accomplit,https://www.lemonde.fr/archives/article/1990/02/02/desir-du-desert-en-1930-michel-vieuchange-traverse-une-partie-du-sahara-occidental-et-note-les-etapes-de-son-voyage-interieur_3969897_1819218.html,1990.0,frère,Positive,0.8741990923881531
Quand Michel Vieuchange meurt à Tiznit le 30 novembre dans les bras de son frère c est bien la fermeture parfaite du cercle qui s accomplit,https://www.lemonde.fr/archives/article/1990/02/02/desir-du-desert_3967826_1819218.html,1990.0,frère,Positive,0.8741990923881531
Jean Vieuchange avait assuré en parfaite complicité et communion avec son frère le soutien logistique d une expédition particulièrement difficile et aventureuse,https://www.lemonde.fr/archives/article/1990/02/02/desir-du-desert-en-1930-michel-vieuchange-traverse-une-partie-du-sahara-occidental-et-note-les-etapes-de-son-voyage-interieur_3969897_1819218.html,1990.0,frère,Positive,0.9928979873657227
Jean Vieuchange avait assuré en parfaite complicité et communion avec son frère le soutien logistique d une expédition particulièrement difficile et aventureuse,https://www.lemonde.fr/archives/article/1990/02/02/desir-du-desert_3967826_1819218.html,1990.0,frère,Positive,0.9928979873657227
